anime_id,name,genre,type,episodes,rating,members,overview
3793,Nogsaegjeoncha Haemosu,"Action,Adventure,Fantasy,Shounen",tv series,2,5.48,43039.58709273302,"""Usavich is a series about an odd pair of rabbits imprisoned in a Soviet Gulag. Shows the absurd everyday occurrences of the two rabbits' prison life, and the the two rabbits' life on the run from law enforcement."""
1642,Manga Doushite Monogatari,"Adventure,Comedy,Kids",tv series,51,7.56,137602.64800219212,"""Elected as student council president with 98% of votes, Medaka is a brilliant students who will help students any way she can. This leads to the introduction of a suggestions box, which will later be given the nickname of 'Medaka Box'. Some of the suggestions therein, however, will provide some tough challenges for her and her student council friends.::Mattias1"""
5449,Busou Shoujo Machiavellianism,"Action,School,Shounen",movie,1,6.62,16884.130436946936,"'Set of rapid telescopic images of a gym, in fast forward, traveling through itself, space and time.::Alp'"
3414,Go Go Toraemon,"Comedy,Sports",movie,78,6.09,7980.626173758376,"'During the course of one day, a group of students at a school in Los Angeles find themselves caught up in a plot of sex, lies and dead bodies.::Anonymous'"
11319,Ef: A Tale of Melodies.,"Animation,Drama,Romance",tv series,12,7.77,53262.871075452655,"'In a story set years in the past, Himura Yuu is a studious and diligent young man intent solely on maintaining his top academic position at Otowa Academy. One day, he meets a mysterious girl named Amamiya Yuuko, who, to his surprise, recognizes him. Memories of a distant childhood, memories rather left forgotten - meeting Yuuko again will force Yuu to confront the regrets and sorrows of their collective pasts and presents. In the present, Kuze Shuuichi may seem like a womanizer, but upon closer inspection, is a man who would rather be left alone. Hayama Mizuki, however, is not the type of girl who would let him be, especially after hearing the beautiful sounds of his violin performance. As Mizuki attempts to become closer to him, Kuze attempts to push her away - the tale of their budding relationship is darkened with undertones of an imminent tragedy.'"
10683,Toushindai no watashi,Short,movie,4,7.24,83074.94378762951,
9824,Ashiaraiyashiki no Juunin-tachi,"Action,Fantasy,Seinen,Supernatural",movie,1,6.49,11152.41964103686,
839,Pokemon: Pikachu no Kirakira Daisousaku!,"Adventure,Comedy,Fantasy,Kids",tv series,2,6.3,111492.95827494204,"""2019, Divergence Ratio 1.048596. The near future, where a device popularly called the PokeCom, packaged with PhoneDroid OS, spreads, bringing the Augmented Reality world close to existence. Central Tanegashima High School's Robot Research Club is in danger of losing its club status. Kaito Yashio, one of only two members, is only obsessed with robot fighting games, showing no interest in the Robo Club even in this situation. The reckless, useless club head, Akiho Senomiya, aims to complete a giant robot, struggling hard to avoid losing the club's status. Then, one day, Kaito discovers the A.R. annotation that becomes the Kimijima Report. Written in that report is the indictment of someone named Kou Kimijima's conspiracy involving the world. (Source: VNdb)"""
8176,Binetsu Hime: Zange no Shou,Hentai,movie,8,6.05,146569.25307017769,"'Earth has been attacked by the Black Nebula Empire and is threatening to blow up the planet if they are counterattacked, The Yamato crew try to defuse the bomb.'"
18007,Nisekoi: False Love,"Comedy,Drama,Romance",movie,0,6.47,126092.72095876036,"'Two children of rival gangster families are betrothed to each other to ensure a truce. They dislike each other in the beginning, but over time they start to like each other.'"
24839,Seimei no Kagaku: Micro Patrol,Adventure,movie,7,4.21,183911.2132318827,"'Ken wants justice for his brother Bill, who was killed by a notorious gunman named Stevens for a goldmine map. The gunman is arguing with gangster Malone about the map. A deadly cat and mouse game between the three men ensues.', 'Ken wants justice for his brother Bill, who was killed by a notorious gunman named Stevens for a goldmine map. The gunman is arguing with gangster Malone (Horst Frank) about the map. A deadly cat and mouse game between the three men ensues.'"
1741,Vampire Knight Guilty,"Animation,Action,Horror,Romance",tv series,4,5.63,45216.019919842205,'Vampire Knight is a story about how Vampires Survive without drinking blood::Amalee Woolman'
21831,Medaka no Gakkou,Comedy,movie,1,5.01,72332.12526738468,
2866,Saru to kani saru to kani no gassen,"Animation,Short",movie,4,6.96,48811.828718639474,
22473,Genroku koimoyo Sankichi to Osayo,"Animation,Short",movie,1,5.54,932.1951839424886,
953,Choco Taco,Comedy,tv series,11,7.41,2909.9742469037883,
31563,Precure All Stars Movie: Haru no Carnival♪,"Action,Comedy,Fantasy,Magic,Music,Shoujo",movie,1,7.12,98423.94270528584,"""When Natsumi's father dies she return to the forest which she had visited with him with his motorcycle. She meets and decides to stay with a family who also own a store nearby.::aghaemi"""
21703,Harukanaru Toki no Naka de 3: Kurenai no Tsuki Special,"Comedy,Fantasy,Shoujo",movie,1,6.49,63615.30345643911,"'Found inside a shining stalk of bamboo by an old bamboo cutter and his wife, a tiny girl grows rapidly into an exquisite young lady. The mysterious young princess enthralls all who encounter her, but ultimately she must confront her fate, the punishment for her crime.::GKIDS', 'An old man makes a living by selling bamboo. One day, he finds a princess in a bamboo. The princess is only the size of a finger. Her name is Kaguya. When Kaguya grows up, 5 men from prestigious families propose to her. Kaguya asks the men to find memorable marriage gifts for her, but the 5 men are unable to find what Kaguya wants. Then, the Emperor of Japan proposes to her.::Anonymous', ""Deep into a swaying and lush bamboo forest, Okina, an elderly farmer, stumbles upon a mysteriously glowing bamboo stalk, that from within, a minuscule fairy-like creature enfolded in a royal robe sprouts before his amazed eyes. Without delay, the ageing man rushes to his wife, Ona, only to witness, much to their surprise, the tiny nymph transform into a baby. In the end, as the infant grows exponentially into a fine girl, the humble couple will take her to the capital, Kyoto, to make her an aristocratic and well-mannered lady worthy of Japan's most powerful suitors. But is this Princess Kaguya's fate?::Nick Riganas"""
5344,Cosmo Police Justy,"Animation,Short,Action,Sci-Fi",movie,20,6.37,6851.484546483074,"'In the future humanity is spread throughout the galaxy. In their efforts to combat criminal espers the Cosmo Police are fortunate to have Justy on their side. However the esper criminals also know this and some of them are making plans for Cosmo Policeman Justy. As their leader says ""There\'s only one way to kill the most powerful esper in the galaxy"".::myanimelist'"
1658,The Severing Crime Edge,"Animation,Action,Fantasy,Romance",tv series,1,6.69,85967.54805605598,
336,Vocaloid China Project Senden Animation,"Fantasy,Music",movie,13,6.54,79750.90251150394,'A man fails to break up the relationshiop between the girl he loves and her fiance. He decides to prove his love by writing lyrics for the songs she composed and entering them in a contest::Anonymous'
647,Uchuusen Sagittarius Pilot,"Adventure,Sci-Fi",tv series,2,6.44,55168.928503851625,
1428,Otogi sutôrî tenshi no shippo,"Animation,Comedy",tv series,1,6.48,57785.75306281647,'A down on his luck guy is told by a fortune teller that his luck will change. Soon after three girls appear claiming to be his guardian angels.'
2150,Xiyue Qi Tong (2006),"Action,Adventure,Fantasy",movie,78,7.95,93382.3030316413,"""Behind-the-scenes documentaries about 'Princess Mononoke,' from the film's conception up to its theatrical release and after - eventually rewriting the box office record in Japan. The documentaries include: Behind-the-scenes production process at the studios, the vocal cast doing overdubs and ADR sessions, featurette on the impact of the film on Japanese society."""
6235,Kakumeiteki Broadway Shugisha Doumei,Music,movie,2,6.41,8665.76522203389,"'The mahjong club at the girl school is determined to win the national tournament. Following the TV serial where the club members win the tournament, the five students compete to reach the semi-finals here. The main character Shizuno played mahjong at grade school and hopes to reunite with her close friends of those years.::aghaemi'"
15897,Kaitei Daisensou: Ai no 20.000 Miles,"Animation,Action,Adventure,Sci-Fi",movie,52,6.83,50790.16350619337,
8158,Noramimi,Animation,tv series,7,6.23,48074.028855531375,
1442,Houkago Midnighters,"Fantasy,Kids",tv series,13,5.81,137600.4438199882,"""With aims to one day reach out into the stars, humanity has colonized all the planets of the solar system. This story of young high school hopefuls is set in Fourth Tokyo in a Japanese Martian prefecture. Iris Shirasaki is a third year student/aspiring test pilot. Mizuki Sera is her peer/mechanic and Mizuki's brother Kaito is their homeroom teacher and the young director of the program developing their talents.::Crunchyroll"""
916,Choujikuu Seiki Orguss,"Action,Adventure,Mecha,Romance,Sci-Fi,Shounen",movie,13,6.71,170484.73353235202,
22625,Gakuen de Jikan yo Tomare,Hentai,movie,1,6.0,106007.96338611052,"""In order to wish for immortality and avenge his father, Garlic Jr. collects the dragon balls, kidnapping Goku's son Gohan in the process. Goku, Kami, Piccolo, and Krillin unite to rescue Gohan and save the world from being sucked into a dead zone.::page8701"""
29609,Symphony of Movement: Moods and Variations,"Drama,Musical",tv series,1,5.49,127190.74783291545,
21659,Canvas: Sepia-iro no Motif,"Comedy,Romance,SliceofLife",movie,1,7.82,67514.0874429431,'A comedy between a young girl and her two housemaid boyfriends.'
2120,Blame!,"Animation,Action,Drama,Sci-Fi,Thriller",movie,1,6.89,86648.24428378642,"'In the distant future, humans are declared ""illegal residents"" and hunted to near extinction by murderous robots. One day, a group of human scavengers come across a strange man named Killy, who may be the key to humanity\'s survival.', 'In the distant technological future, civilization has reached its ultimate Net-based form. An ""infection"" in the past caused the automated systems to spiral out of order, resulting in a multi-leveled city structure that replicates itself infinitely in all directions. Now humanity has lost access to the city\'s controls, and is hunted down and purged by the defense system known as the Safeguard. In a tiny corner of the city, a little enclave known as the Electro-Fishers is facing eventual extinction, trapped between the threat of the Safeguard and dwindling food supplies. A girl named Zuru goes on a journey to find food for her village, only to inadvertently cause doom when an observation tower senses her and summons a Safeguard pack to eliminate the threat. With her companions dead and all escape routes blocked, the only thing that can save her now is the sudden arrival of Kiri the Wanderer, on his quest for the Net Terminal Genes, the key to restoring order to the world.'"
29235,"The Prince of Tennis: Two Samurais, the First Game","Animation,Sport",movie,1,6.04,19966.345648025184,
6907,Yuuyake Banchou,Action,tv series,26,5.86,70656.123868065,
4049,Strait Jacket,"Animation,Action,Fantasy",movie,26,6.42,58889.83072581267,"'In a world where sorcery and science co-exist, the power of magic comes with a price: Humans who do not take proper precautions are transformed into horrific demons. Those who destroy these demons - and run the highest risk of all - are tactical sorcerists known as Strait Jackets.::Anonymous', 'In the city of Tristan, where advanced technology works side by side with sorcery, people are under constant threat of demon attack. To protect the defenseless citizens, the Magic Administration Office employs skilled warriors known as Tactical Sorcerists. One day, a half-human, half-demon girl named Kapelteta Fernandez introduces Magic Administrator Nelin Seemonz to the reclusive Tactical Sorcerist Layot Steinberg, a crack shot who fights with a powerful humanoid Mold weapon. Despite his incredible skill at defeating demons, Layot is tortured by the sins of his past, and longs only for death.'"
33325,Kigyou Senshi Arslan,"Comedy,Parody",movie,1,5.78,65443.35700177937,
27991,Eine Kleine,"Animation,Short,Drama,Music,Romance",movie,13,7.82,108912.35090103289,
7674,Doron Coron,"Animation,Short",movie,25,8.35,498426.03417222534,"'Doron Coron is a boy made of dirt that comes to life in an unexpected way. After leaving his town, Doron Coron meets various kinds of creatures throughout the year, communicates with them, and eventually returns to the soil.::anonymous'"
7668,Overlord: Pure Pure Pleiades,"Animation,Comedy,Fantasy",tv series,2,6.11,2813.1185425432727,'Lord Ainz embarks on a series of comedic mishaps when he tries to deal with his maid subordinates the Pleiades.'
18109,CHIKARA: Back to Skull,"Action,Sport",movie,1,6.05,29113.89811806587,"""Dasher Hatfield faces the intimidating challenge of Blaster McMassive in the main event as he seeks his third point for a shot at Hallowicked's Grand Championship, Princess Kimberlee takes on Juan Francisco de Coronado in the Challenge of the Immortals tournament, the Snake Pit faces the Colony, what secret does Kevin Condron know about Volgar, and more.::JasonIK75"""
15451,Eve no Jikan (Movie),"Sci-Fi,SliceofLife",tv series,12,7.87,314493.67489062226,"'The series follows an epidemic that breaks out in Atlanta, leaving the large city quarantined and those stuck on the inside fighting for their lives. The drama tells the story of loved ones torn apart, and how the society that grows inside the cordon reveals both the devolution of humanity and the birth of unlikely heroes.::Patricia Peña Hdez.'"
3633,Brothers Conflict Special,"Harem,Romance,Shoujo",tv series,1,5.61,170764.74671052073,
33505,Gli animali,"Documentary,Short",movie,0,6.87,81363.29908430387,
11031,Ken-chan no oneesan,,movie,2,6.56,50947.04062033581,
3676,Trick or Treat or Die!,Comedy,tv series,47,6.48,22605.041379784518,
857,Kannagi: Crazy Shrine Maidens,"Animation,Comedy,Drama,Fantasy,Romance",tv series,25,7.69,390582.379124548,"'For his art project Mikuriya Jin carved a statue from the recently chopped local sacred tree. As he is about to bring it to school, the goddess of the tree, Nagi, descends upon the statue, having slept until now, not knowing of her demise. Since the sacred tree can no longer protect the surrounding area from impurities, Nagi has to do it herself now, dragging poor Jin with her.'"
3458,Kureyon Shinchan: Dengeki! Buta no hizume daisakusen,"Animation,Action,Adventure,Comedy,Crime",movie,65,6.05,69188.53410470107,"'Everything begins when a secret agent hides in the boat where the Futaba students are having dinner. The bad guys follow her and take the boat with her, Shin Chan and her friends on board. From there, the boys go with the agent everywhere as their hostages.'"
25589,Bary-san x Gospe Rats: Tonde Bary Bary Monogatari,Music,tv series,13,6.5,48335.009547641814,"'A pretty schoolgirl hides a secret: she is actually a boy who got turned into a girl and is looking for a way to change herself back.', 'Megumi-chan is a teen-aged girl with a secret past. She used to be a boy until she saved a magician from a gang of boys and was given a magical book. As a boy when he bled into the book a genie appeared to grant one wish. Megumi wished to be a man, but the genie granted the wish backwards so he turned into Megumi-kun, a girl. Years pass and Megumi grows up to be the most beautiful of girls but still acts and fights like the boy that she really is. Upon entering High School she immediately beats up the school bully who falls in love with her. Thus begins her adventures looking for that book to change her back and fighting off both admirers and her on-coming femininity.::laird-3'"
13947,Sangokushi II: Amakakeru Otoko-tachi,"Action,Historical",tv series,1,6.05,97449.15316412911,"'Hana N. Fountainstand is a transfer student who love Japanese culture as well. She decides to make a YosakoI group with Naru Sekiya, Yaya Sasame, Tami Nishimikado, and Machi Tokiwa.::Lucia'"
18327,The Collected Animations of ICAF (2001-2006),"Fantasy,Mystery",movie,1,5.0,70494.27685664048,"'A strange prehistoric beast lurks in the depths of the Amazonian jungle. A group of scientists try to capture the animal and bring it back to civilization for study.::Glen_Chapman', 'A scientific expedition searching for fossils along the Amazon River discovers a prehistoric Gill-Man in the legendary Black Lagoon. The explorers capture the mysterious creature, but it breaks free. The Gill-Man returns to kidnap the lovely Kay, fiancée of one in the expedition, with whom it has fallen in love.::Marty McKee <mmckee@wkio.com>', ""After Dr. Carl Maia finds unique skeletal remains, a group of scientists led by David Reed head down the Amazon to see if other remains can be found. They have little luck at first until hearing that further downriver lies the Black Lagoon where other fossils might be found. They get more than they bargained for when they discover a living prehistoric creature - a half-man, half amphibious reptile - that doesn't take kindly to their attempts to capture him. The creature takes a liking to Kay Lawrence and kidnaps her but goes to war against the scientists and won't let them leave the lagoon.::garykmcd / edited by statmanjeff"""
3821,Kugutsu Ai: Doura Gaiden,Hentai,tv series,1,5.85,19851.96887140693,
11919,Sayonara zetsubô sensei,"Animation,Comedy,Drama",tv series,52,6.2,21859.18792171605,"'Nozomu tries to hang himself, but is prevented from doing so by an overbearingly cheerful young girl named Kafuka. He tries to escape from her, but learns she is his student.::Anonymous'"
14669,Blend,"Short,Drama",movie,1,7.67,143398.12571881706,
24703,Kyouhaku: Owaranai Ashita,Hentai,movie,12,7.71,223895.30431686988,
5214,Street Fighter IV: The Ties That Bind,"Animation,Action,Fantasy,Sci-Fi,Thriller",movie,2,6.74,65662.28908726477,'An anime OVA based on the Street Fighter IV Video game.'
34148,Nodame Cantabile Special,"Comedy,Josei,Romance,SliceofLife",tv series,0,0.0,85238.94083751536,"'As the skies of Metro City fill with giant mechs, Astro, a robot with human emotions and fueled by jet-powered legs, arrives in a blaze of glory to defend all that is good.'"
2171,Mafukiden: Pandarian,"Adventure,Comedy,Fantasy,Kids,Magic,SuperPower",movie,1,7.6,35532.60893869584,
33983,Ookami Shounen Ken,"Adventure,Kids",movie,13,0.0,183236.54598895763,
30567,Yowamushi Pedal: Special Ride,"Comedy,Drama,Shounen,Sports",movie,12,6.87,20671.639058804423,"'With the help of his old mentor Rias, sorceress Sonya, wizard Roe, and warriors Galen and Ryunan, brave young prince Serios must free his people from the tyrannical rule of warlock Ackdam and his demon army led by gargantuan dragon Zaggy.'"
16678,The Gourd,"Animation,Short",movie,1,7.04,12619.330801469576,
1329,Sugar Bunnies Chocolate! Specials,Kids,tv series,1,7.41,160602.86516404006,
171,Stratosphera no Yousei,"Drama,Hentai,Romance,Sci-Fi",movie,13,6.59,63222.885633255144,"'During a random night, the two brothers Mutta Nanba and Hibito witness what seems to be a UFO flying to the moon and they both vow to eventually become astronauts. 19 years later, Mutta has the opportunity to follow his brother and fulfill his promise.::Dielson Sales'"
547,Gekido,"Action,Adventure",tv series,3,6.35,45432.32736308937,"""2011: In a time where there is great corruption and terror, a young girl named Angela has been kidnapped. Rumor has it that Kintaro has made a deal with the devil. Angela's parents hire Travis, a private detective, to investigate the crime boss Kintaro and retrieve Angela. Knowing that the mission to rescue Angela will not be easy, he is aided by three sidekicks, Michelle, Ushi and Tetsuo."""
2410,Iblard jikan,"Animation,Short,Fantasy",movie,3,6.74,65668.18653457418,"'A fantastical city portrayed in artful pictures that come to life through animation, music and background sounds.'"
4773,Tottoko Hamtarou Movie 1: Ham-Ham Land Daibouken,"Adventure,Comedy,Kids",tv series,37,7.13,252662.1133481466,
2007,Doraemon: 2112-nen Doraemon Tanjou,"Comedy,Fantasy,Kids",tv series,2,5.8,102148.77253424238,
33003,Little Jumbo,"Animation,Short",movie,12,7.17,94144.027974617,"'Adrift at sea a boy and his pet white elephant, Jumbo, wash up on an island that is between two other islands at war with one another in this musical fantasy film.::Nicholas Scott Smith'"
24269,Dallos,"Animation,Sci-Fi",movie,1,4.69,31287.05223380018,"'In a near future, mankind has moved from a drained Earth to the Moon. Rebel acts of terrorism lead to conflicts with the Earth Federal Government. A mysterious entity called Dallos appears to restore hope.::Sinedd'"
3320,Junkers Come Here,"Animation,Adventure,Family,Fantasy",movie,1,5.49,49337.773484456135,'The movie is about a girl named Hiromi Nozawa and her dog Junkers. Hiromi is having troubles at home mainly because her parents wanting to separate. Junkers tries to comfort her in ways no other dog can. He can talk and grant her 3 wishes.::anonymous'
8217,Aladdin and the Magic Lamp,"Animation,Adventure,Family,Fantasy",movie,52,7.67,14132.27854864593,'This is the classic story of the young boy Aladdin who is tricked by and evil wizard to go inside the cave that holds a great treasure and there is an old lamp that he needs to bring to him. He meets the slave of the lamp and his and becomes the most famous kid in town and marries the princess Madral.::MuffinChan'
6607,Kino no Tabi: Nanika wo Suru Tame ni - Life Goes On,"Adventure,Drama,Fantasy",tv series,1,5.86,98822.85167040632,"'Martin becomes obsessive about Clare after she praises work colleague Dr Harding and follows her to a staff night out where he makes a fool of himself by not realizing that Dr Harding is a platonic woman friend. Matthew assists Mandy in deceiving Marco into believing that she is a virgin but the deceit is discovered when Marco turns up unexpectedly whilst Matthew is watching a video he secretly made of Mandy having sex. Jason, in love with Matthew, coaxes him out of the house to the park and a gym where he acquires some gay admirers. Newly confident Matthew goes to the corner shop and foils a robber by hitting him with his surf board but he is traumatized by the experience and reverts back to not wanting to go out.::don @ minifie-1'"
7004,The Monkey King and the Fruit of Immortality,Adventure,movie,52,6.18,16451.425849086867,
10790,Usagi-chan de Cue!,"Animation,Short,Action,Comedy,Romance",movie,10,7.78,214913.24672927888,
17187,Armitage III,"Animation,Sci-Fi,Thriller",tv series,1,7.64,161816.12595620507,"'In the year 2046, a cop and his female android partner called Armitage, part of the latest android line known as ""class III"" models that look, act and feel human, investigate illegal manufacture of class III androids on colonized Mars.::Anonymous'"
2118,Itsuka Tenma no Kuro Usagi Picture Drama,"Comedy,Ecchi,Romance,Shounen,Supernatural,Vampire",tv series,1,7.02,29563.268632801493,
9106,Grimm Masterpiece Theatre,"Animation,Family,Fantasy",tv series,26,6.42,11430.468667268335,'An animated series retelling a different folk or fairy tale in each episode.::Nick J. Phillips'
216,Trava: Fist Planet,Animation,movie,1,6.11,179027.72063597786,'Trava and Shinkai travel to finish surveying an unknown and possibly dangerous planet.::Josh Wunder'
33759,King of Prism by PrettyRhythm,Animation,movie,12,7.19,110529.27154241773,"'The completely male musical group \'Over The Rainbow\' succeeds in its debut. Aiming to become the best boy band, more students enroll in Edel Rose (school). Hiro and the others begin practice for the Prism King Cup the ultimate test for music groups, an event that is held once every four years. However, a rival bands called ""Schwarz Rose"" appears... Who will become the Prism King, the one who can make girls\' hearts throb the most!?'"
3990,Bamboo Bears,Animation,tv series,1,5.94,126192.40349814766,"'Bamboo-Lee, Dah-Lee and Slo-Lee are three bears with a goal: to save the world before more species become extinct. But can the bears stand up to the spineless villains behind Ratco Corporation?'"
15061,Shin Maple Town Monogatari: Palm Town-hen,"Fantasy,SliceofLife",tv series,178,7.69,26028.18261287041,
32010,Tale of Crab Temple,"Animation,Short",movie,1,6.46,33576.574192559056,
2625,Mahou no Chocolate,"Drama,Romance",movie,1,7.04,4576.348702328947,"""A retired pop singer turned actress' sense of reality is shaken when she is stalked by an obsessed fan and seemingly a ghost of her past.::Kenneth Chisholm"", 'Mima leaves the idol group CHAM, in order to pursue her dream as an actress. Mima climbs up the rocky road to success by performing as rape victims and posing nude for magazines, but is haunted by her reflections of the past.::<H@jime>'"
20081,Cyborg 009: The Reopening,"Action,Adventure,Mecha,Sci-Fi,Shounen",tv series,46,5.75,45470.790333066914,
1492,Tezuka Osamu no Kyuuyaku Seisho Monogatari: In the Beginning,Historical,tv series,26,7.15,91670.83992064383,
12477,Seiden RG Veda,"Animation,Drama",movie,1,8.23,211825.8681669207,"""Prophecy says that six warriors will end a brutal tyrant's rule. Swords clash as the battle between good and evil explodes!::Sujit R. Varma"""
34085,Crayon Shin-chan Movie 04: Henderland no Daibouken,"Comedy,Ecchi,Kids,School,Shounen,SliceofLife",tv series,1,7.29,74008.51044090497,
1861,Uchuu Enban Dai-Sensou,"Action,Mecha,Romance",movie,1,7.66,226134.9723291941,'Pepe Benengeli and his team participate in the Japanese Cup.'
