anime_id,name,genre,type,episodes,rating,members,overview
426,Initial D,"Animation,Action,Comedy,Sport",tv series,4,6.25,35606.59307493358,"'The story of a young delivery boy who becomes a drift-racing legend.::Nathan J Rossberg', ""Takumi Fujiwara is an average 18-year old high school student with an average job as a gas station attendant, and a not-so-average hand in the family business. To help his father's tofu shop, Takumi has been delivering tofu in his father's 'Eight-Six' Trueno (known as the Toyota Corolla GT-S in the US) to a hotel at the peak of Mt. Akina (the local mountain), every night at 4 a.m. In doing so, Takumi has been unknowingly training to be the greatest mountain-pass drift-racer in all of Japan. After a freak late-night encounter with Keisuke Takahashi, the number two driver of the infamous RedSuns team, Takumi is quickly, and unwillingly plunged into a high-speed world of white-knuckle contests on the most dangerous mountain passes in the Gunma prefecture. Assisted by the local Akina Speedstars team, his slightly obnoxious friend Itsuki, his somewhat shady girlfriend Natsuke and the sage-like words of his chain-smoking, ex-racer father Bunta, he'll need all the help he can get to outwit and outmaneuver Japan's most talented underground drift-racers.::Nathan J Rossberg"""
2659,Anita Manning,Reality-TV,tv series,1,7.26,267100.7187728269,
32376,Free!: FrFr - Short Movie,"Comedy,Sports",tv series,1,7.04,19214.499769023,
7666,Cook no Polka,"Kids,Music",movie,1,6.72,6214.777241584256,"'In the special episode to season 1, the queen from Valhalla planet arrives on earth with a virtual-world-program, called ""bride training boot camp"". They built several pairs which have to take a random card with a special situation that might occur if you are married. For instance Kazuto and Valkyrie have to make dinner, Raine and Kazuto\'s sister have to manage poverty or Akina and Hydra have to prepare a wedding ceremony as bride and groom (so everyone gets the most unlikely and unsuitable situation). The Queen from Valhalla Planet has been visiting Kazuto and the gang quite often. She tell them that she is was in Earth region for business purposes, in reality her main concern for coming around quite often is because she has concerns that Valkyrie wouldn\'t make a good wife for Kazuto. So she comes up with to put the gang through wedding training.::animenewsnetwork.com'"
1678,Yurusarezaru mono,"Short,Drama",movie,52,7.36,92412.83039980916,
30573,Mirai Shounen Conan (Movie),"Adventure,Drama,Sci-Fi",tv series,1,6.58,32177.526912265508,"'Takatoshi Tsuda joins Ousai Academy, a co-ed high school that until recently had been an all-girl school, where he is asked to join the student council as vice-president and a male representative.::Nolberto Roa'"
6131,Ore-sama Kingdom,"Romance,Shoujo",movie,365,5.48,109863.85378675033,"'A small group squad of American soldiers find horror behind enemy lines on the eve of D-Day.::Chockys', ""Night of the 5 to the 6 June, 1944. On the eve of D-Day, several American paratroopers are dropped behind enemy lines to carry out a mission crucial to the invasion's success: destroy a radio tower built in a little castle of an old French town that it's close to Normandy's beaches, and that Third Reich uses as straight communication between Berlin and beaches' bunkers. Due to the intense enemy fire caused by cannons and machine guns, all the planes are shoot down and the most of the soldiers die in the landing or they are killed by Nazis' night patrols after to take land. However, a private named Ed Boyce survives to meet Corporal Ford, a last-minute incorporation from Italy and a veteran expert in bombs and explosives; Tibbet, a rogue sniper; Chase, a war photographer; and finally private Dawson. After to watch the killing of their superior Sargeant Eldson by a Nazi night patrol, Ford assumes the mission as leader of the group and they try to get the town when Dawson dies after to step a landmine. Burying him in the forest, they meet Chloe, a villager who refugees the soldiers in her house where she lives with her old and ill aunt and her elder brother, child Paul. But the mission complicates when by chance Boyce get into the Nazi radio tower, just to find a horrible secret experiment with human beings that it could bring the victory to Hitler and would change the fate of the world forever. With D-Day approaching, Boyce and the others begin to realize there is more going on in this Nazi-occupied village than a simple military operation, having to fight against supernatural forces not only to destroy the radio tower, but destroy the own experiment before Hitler's gets his Third Reich of thousand years he promised.::Chockys"""
22675,Shiawase no katachi,"Animation,Comedy,Drama,Romance",tv series,5,4.67,100260.05647417971,
13677,"Hitou Meguri The Animation: Wakaokami, Rachiru",Hentai,movie,1,7.34,27541.17274910526,"""The protagonist of the story happens to be stuck in his classroom a derry cold night. Well as per the title of the story he just kisses his rival a.k.a antagonist who happens to be a senior . And that's where the whole plot of the story is based and the title is taken.::nonsense 365"""
31630,Sugio: Mori de Koi wo Shite,Comedy,tv series,24,6.49,202744.22432376532,
30915,Kamen no Marionette-tachi,Dementia,movie,1,6.8,25576.55017736021,"'A follow up to the television series ""Kimagure Orange Road"" that wraps up loose ends. Kyosuke must deal with the fact that his, Hikaru and Madoka\'s friendship is falling apart.::Anonymous'"
19751,Psychic Force,"Animation,Action,Adventure,Drama,Fantasy",tv series,1,5.58,79135.8399778371,'An Anime OVA based on the video game series.::Anonymous'
8417,Gowapper 5 Gordam,"Action,Adventure,Mecha,Sci-Fi",tv series,9,5.8,54318.37610870314,
20175,Shakugan no Shana Specials,"Comedy,Parody",movie,1,6.5,21790.610620499643,"'Doron Coron is a boy made of dirt that comes to life in an unexpected way. After leaving his town, Doron Coron meets various kinds of creatures throughout the year, communicates with them, and eventually returns to the soil.::anonymous'"
25345,Black Bullet: Tenchuu＊Girls,Fantasy,movie,4,7.61,11148.426556474173,"'The movie will compile the episodes from the second season of the anime, and will also have new cuts of animation.::myanimelist'"
12373,Pygmalion,"Comedy,Drama,Romance",movie,1,6.75,46747.67972361549,"'A phonetics and diction expert makes a bet that he can teach a cockney flower girl to speak proper English and pass as a lady in high society.::Anonymous', 'The snobbish & intellectual Professor of languages, Henry Higgins makes a bet with his friend that he can take a London flower seller, Eliza Doolittle, from the gutters and pass her off as a society lady. However he discovers that this involves dealing with a human being with ideas of her own.::Steve Crook <steve@brainstorm.co.uk>'"
1820,Chicchana Yukitsukai Sugar Specials,"Comedy,Magic,Shoujo,SliceofLife",tv series,2,5.65,106336.98588212322,"'Commonly known as the ""Dungeon,"" the city of Orario possesses a huge labyrinth in the underground. Its strange name attracts excitement, illusions of honor, and hopes of romance with a pretty girl. In this city of dreams and desires, new adventurer Bell Cranel has his fateful encounter with the tiny Goddess Hestia. Thus begins the story of a boy striving to become the best adventurer and a lonely goddess searching for followers both hoping to reach their goals and perhaps have some romance on the side.'"
7179,The Legend of Huainanzi 2nd Season,"Adventure,Fantasy,Historical",movie,2,6.44,35677.08335287159,
3583,Vandread: Gekitou-hen,"Action,Adventure,Comedy,Ecchi,Mecha,Sci-Fi,Space",movie,1,5.88,44033.61571292176,
5266,Ganbare! Lulu Lolo 3rd Season,"Kids,SliceofLife",movie,1,6.72,48901.39306168616,
31318,Fairy Tail,"Animation,Action,Adventure,Comedy,Fantasy",tv series,12,6.0,142673.77393332176,"'Lucy, an aspiring Celestial Wizard, becomes a friend and ally to powerful wizards Natsu, Gray, and Erza, who are part of the (in)famous wizard guild, Fairy Tail.::Tyler Smith', 'Lucy, a 17 year old girl, sets out on journey to become a full-fledged wizard and joins the strongest and most (in) famous guild FAIRY TAIL where she meets Natsu, Happy, Gray and Erza, who treat her more like family than friends. This epic series takes us through all the dangers that the members of fairy tail face and eventually overcome through mutual love and friendship.::AnimeLover', 'Lucy, a runaway celestial wizard, finds herself under the curse of a magic charm. Natsu Dragneel, a Dragon Slayer, and his sidekick, Happy, swoop in to save her from being sold on the black market. Causing massive property damage, is a specialty of Fairy Tail, as Lucy is soon to find out as she joins the magical guild. Lucy soon meets Gray and Erza, both are also wizards at Fairy Tail, Gray is an ice wizard with a cool personality and a special ""hobby"". Erza on the other hand is a wizard with requip magic, which allows her to switch armour and weapons at any moment. Through Arcs of all kinds Fairy Tail sticks together::Ariadne'"
32892,Shoujo-tachi wa Kouya wo Mezasu,School,movie,0,5.14,5417.411551152953,'A young biker stumbles onto a prototype motorcycle with a hidden function that has a link to the true nature of his world.::Kenneth Chisholm'
10589,Tamayura: More Aggressive Picture Drama,"Comedy,Drama",tv series,1,7.62,43462.30850686496,"'An intelligent high school student goes on a secret crusade to eliminate criminals from the world after discovering a notebook capable of killing anyone whose name is written into it.::Anonymous', 'After an intelligent yet cynical high school student begins to cleanse the world from evil with the help of a magical notebook that can kill anyone whose name is written on it, international authorities call upon a mysterious detective known as ""L"" to thwart his efforts.::Paleman', 'A battle of wits between a high school student and a mysterious detective known as ""L"" where the student looks to cleanse the world of evil criminals with the help of a supernatural notebook while the detective wants to stop all these killings of criminals.', ""After the smart and brilliant Light Yagami discovers this book, he soons yet to realize it has a secret power. He looks like an average, top of the class, student. But in reality he's way more than that, in his eyes, he's a god. The savor of the earth and will kill anyone who will get in the way."", ""Light Yagami, after finding a book that kills people whose names are written in it, developps a God complex. His own father being the chef of Tokyo police, he fights against the world's best detective, L, to bring the world to his own idea of utopia.::Pel Par"", ""An intelligent high schooler who wants justice in the world and wants to be God of the new world he has created by destroying all evil. He plans on achieving this by using a strange supernatural book that fell from another realm onto earth. He tries to cleanse the world from all darkness but he runs into obstacles with the police and a strange mysterious detective known as 'L'"""
18149,Mamono Hunter Yôko no jijô,"Animation,Action,Comedy,Horror,Music",tv series,1,5.04,44076.13341841506,
5504,Peeping Life: Tezuka Pro - Tatsunoko Pro Wonderland Specials,"Comedy,Parody",movie,12,7.33,221352.59471321487,"""Anthropomorphic cats abduct little kids' dog to use him as a weapon for their Mistress who wants to control the fantastical cat world. Young boy and his sister must travel to this world to save their pet and the cat world.::Anonymous"""
6164,Tetsuwan Atom: Ivan no Wakusei - Robot to Ningen no Yuujou,"Action,Mecha,Sci-Fi,Shounen,SuperPower",tv series,11,7.29,187454.61023428536,
2801,Ninku,"Animation,Action,Adventure",tv series,1,6.69,25719.976569519476,"'Once upon a time, there was a war between the Imperial army and Ninku, an elite unit of 12 zodiac warriors led by their master. Just when the Ninku were about to win the war, their master asked them to hold back and disbanded the unit. The series follows the adventures of 3 of the 12 zodiac warriors, along with the sister of one of them and a penguin, and the repercussions of that fateful day. It is a journey of friendship, loss and adventure, as they run away from the Imperial army who are trying to eliminate them.'"
9584,Majuu Jouka Shoujo Utea,Hentai,tv series,1,6.11,139574.59864875805,'Follow the life of Tadayasu Sawaki as he enrolls in an Agricultural University and learn about bacteria and viruses that he alone can see with the naked eye.::Alberto'
5393,Muv-Luv Alternative: Total Eclipse Recap - Climax Chokuzen Special,"Action,Mecha,Military,Sci-Fi",tv series,1,5.38,12855.663011354936,"""Yuuta Takemoto is a poor college student who lives in a dilapidated apartment building with his two friends, Shinobu Morita and Takumi Mayama. The series chronicles the students' story as they struggle through life and love.::dxg"""
513,Harem Time The Animation,"Harem,Hentai",tv series,1,8.38,82108.59184558144,"""Destination is a state of mind. A tale of one girl and her bike and the road ahead. Kino wanders around the world on the back of Hermes, her unusual, anthropomorphic motorcycle, only staying in each country for three days. During their adventures, they find happiness, sadness, pain, decadence, violence, beauty, and wisdom. But through it all, they never lose their sense of freedom. They discover that because of the world's imperfections, it is actually a thing of beauty."""
6505,Peesuke: Gatapishi monogatari,,movie,5,8.11,50470.809324983675,
5682,Ryuusei no Rockman,"Action,Game,Sci-Fi,Shounen",tv series,26,8.16,90696.9422223992,"'Fujita Reiji is the owner of an art gallery, Gallery Fake. He deals with fake items, and is also familiar with the black market. However, he has a special talent for art, and used to work for the Metropolitan Museum of Art in New York as a curator.::https://myanimelist.net/anime/364/Gallery_Fake?q=Gallery%20Fake'"
32947,Harukanaru toki no naka de: Hachiyoushou,,tv series,11,5.92,54220.484069469974,
740,Spacy,Short,movie,43,7.74,160350.29498108776,"'Set of rapid telescopic images of a gym, in fast forward, traveling through itself, space and time.::Alp'"
23735,Moyashimon: Kin Gekijou Deluxe,Comedy,tv series,6,6.22,161620.87498075268,"""In a world where terror grips the land and innocents have no solace from violence and brutality, one girl walks the line between life and death to bring her own special brand of - Ramen. Miki Onimaru works at her parent's Ramen shop, making deliveries, waiting tables, and attracting customers with cute, girlish charm. Somehow, Miki can't complete even one of these simple tasks without the full employment of her extensive bone-crunching, skull-splitting martial arts moves and penchant for unleashing relentless destruction. Can Miki get through the day without messing up and angering her Mom, who makes her look like a gentle kitten in comparison?::Crunchyroll"""
195,The 15:17 to Paris,"Biography,Drama",movie,12,7.35,76282.34995278613,"'Americans discover a terrorist plot on a Paris-bound train.', ""In the early evening of August 21, 2015, the world watched in stunned silence as the media reported a thwarted terrorist attack on Thalys train #9364 bound for Paris--an attempt prevented by three courageous young Americans traveling through Europe. The film follows the course of the friends' lives, from the struggles of childhood through finding their footing in life, to the series of unlikely events leading up to the attack. Throughout the harrowing ordeal, their friendship never wavers, making it their greatest weapon and allowing them to save the lives of the more than 500 passengers on board."""
26217,Ichigeki Sacchuu!! Hoihoi-san,,movie,1,7.0,63740.10794793611,"""In the year 20xx AD, insects have become resistant to every kind of insecticide. In order to create an effective pest control, the Japanese company Mars Pharmacy develops a small insect-terminating robot - the 11.5 cm tall maid type robot Hoihoi-san. Dewa Kimiko, who works for a pharmacy always loved dolls, and bought Hoi Hoi-san soon after release. Little did she expect her peaceful slumber at home to be disturbed by her robot's vehement bursts of gunfire - exterminating insects. So she tends to be annoyed by robot-fan customers. To top things off, another small robot type named Combat-san - belonging to a frequent pharmacy customer - fights a nightly all-out war against Kimiko's Hoi Hoi-san - loosing every time."""
105,Sci-Fi Harry,"Animation,Drama,Horror,Mystery",tv series,13,6.59,181490.04491892376,'A bullied shy awkward teenage slowly gains mysterious psychic powers leading him into a dark conspiracy involving a clandestine organization with lethal and frightening consequences for all.::dnesmith'
2769,Little Nemo Pilot,"Animation,Short,Fantasy",movie,25,6.71,16454.218514408818,"'Little Nemo: Adventures in Slumberland was released in American theaters in 1992. However, at one point earlier in its development many people from Studio Ghibli had been involved with the project. In 1984 they produced this test pilot.'"
205,One Piece: Adventure of Nebulandia,"Animation,Action,Adventure,Comedy",movie,26,8.5,448574.8060959772,"'The special has the Straw Hat Pirates fight Foxy again in the New World, on Mushroom Island. This soon gives way to a battle against the Marines on an island called Nebulandia that can nullify Devil Fruit powers.::Anonymous'"
20075,Pokemon XY&amp Z,"Action,Adventure,Comedy,Fantasy,Kids",tv series,164,6.47,52528.69617316401,"'In a futuristic world, most people have come to be totally dependent on avatars they can use in the real world due to the Fractale System. The problems of this Utopian world are becoming apparent however as the system gradually starts failing. Some even aggressively rebel against it. Clain, a young boy, happens upon a girl, who is being chased, one day who will initiate a change in his life he could not have imagined. This girl, Phryne, leaves a gift in the form of an avatar, Nessa, who is unlike any others.::Mattias1'"
3101,Natsuyuki Rendezvous,"Animation,Drama,Fantasy",tv series,51,6.46,51227.034452095686,"'Hazuki is secretly in love with his florist boss, but his chances of a successful romance seem slim when he not only has to overcome shyness, but also the possessive ghost of her dead husband.'"
29941,Inugami-san to Nekoyama-san,Comedy,tv series,11,4.95,13018.588316368909,
1808,Nichiro sensô hyaku nen ni maru san kôchi no higeki ha naze okita no ka,History,tv series,26,7.51,171767.80584035759,
18411,Hyper Police,"Animation,Action,Comedy,Fantasy,Sci-Fi",tv series,12,7.23,59666.52238165936,"'It is the year 22 H. C. (Holy Century), Shinjuku is populated by monsters and goblins. Humans are endangered and the town is rife with crime.::Anonymous', 'It is the year 22 H. C. (Holy Century), Shinjuku is populated by monsters and goblins. Humans are endangered and the town is rife with crime. Natsuki Sasahara is a rookie at the Police Company and a newbie bounty hunter. Scouted by her superior, Batanen Fujioka the werewolf, she is half-human, half-catbeast with magical powers that is slowly getting the hang of the business...::Anonymous'"
17233,Sei Juushi Bismarck,"Action,Mecha,Sci-Fi,Space",movie,1,6.76,18397.877194568602,'An old witch doctor struggling with her craft invokes the spirit of a magical fox and together they help heal the many sick people around her village. Unfortunately people begin to suspect the origin of her new found voice and things turn for the worse.::Anonymous'
30018,Saiko ama Gobarian,"Animation,Action,Sci-Fi",tv series,1,4.65,90675.91118105623,
25027,Somei-ka no Hi no Youjin: Bouka no Tebiki Katei-hen,"Drama,Kids",tv series,1,6.56,39006.775267658464,"'Lucy, an aspiring Celestial Wizard, becomes a friend and ally to powerful wizards Natsu, Gray, and Erza, who are part of the (in)famous wizard guild, Fairy Tail.::Tyler Smith', 'Lucy, a 17 year old girl, sets out on journey to become a full-fledged wizard and joins the strongest and most (in) famous guild FAIRY TAIL where she meets Natsu, Happy, Gray and Erza, who treat her more like family than friends. This epic series takes us through all the dangers that the members of fairy tail face and eventually overcome through mutual love and friendship.::AnimeLover', 'Lucy, a runaway celestial wizard, finds herself under the curse of a magic charm. Natsu Dragneel, a Dragon Slayer, and his sidekick, Happy, swoop in to save her from being sold on the black market. Causing massive property damage, is a specialty of Fairy Tail, as Lucy is soon to find out as she joins the magical guild. Lucy soon meets Gray and Erza, both are also wizards at Fairy Tail, Gray is an ice wizard with a cool personality and a special ""hobby"". Erza on the other hand is a wizard with requip magic, which allows her to switch armour and weapons at any moment. Through Arcs of all kinds Fairy Tail sticks together::Ariadne'"
6909,"Yakushiji Ryouko no Kaiki Jikenbo: Hamachou, Voice &amp  Fiction","Mystery,Police,Supernatural",tv series,1,7.19,25947.978319512098,"'The increase in income disparity, progressive environmental pollution, unresolved waste problems, waiting lists for child care, corruption continues. The government, stained by personal interests, does not can do nothing against the many problems. In this situation, with Japan cornered, the idols rise to save the day. The Heroine Party, Sunlight Party, Starlight Party, Bishoujo Party, Wakaba Party, New Subculture Party, and SOS Party, of these seven idol political parties, the idols that have become members of the legislature and representatives of each prefecture, will break the stalemate that covers Japan, using the power of song and dance. They will bring back the smiling faces of the people, and they will envelop Japan in a bright aura.'"
388,Yakushiji Ryouko no Kaiki Jikenbo,"Mystery,Police,Supernatural",movie,52,7.91,41172.023423096514,"'This story involves the shopkeeper Suzuri of Kokumondou who sells historic books and Mizuki, granddaughter of the land owner. When Mizuki releases a somewhat cute young spider demon out of a sealed book, the pair investigate the origins behind it::bbcgjg'"
15455,Komatsu sakyô anime gekijô,Animation,tv series,1,5.19,88687.5605304886,
31789,Shenmi Shijie Lixian Ji 2,"Adventure,Comedy,Fantasy",movie,0,7.28,62290.62017600656,"'The beautiful girl Cinterrier (like the terrier version of Cinderella), was proposed to by many dogs. Who finally got her heart?'"
17979,Disaster Movie,Comedy,movie,1,4.88,14706.533645080211,"'Over the course of one evening, an unsuspecting group of twenty-somethings find themselves bombarded by a series of natural disasters and catastrophic events.::IMDb Editors', 'Will, Lisa, and two of their friends attempt to flee man-made and natural disasters and encounter Batman, Hancock, The Hulk, Indiana Jones, Hannah Montana, Michael Jackson, Beowulf, the Love Guru, Iron Man, rabid chipmunks amongst others in their seemingly vain efforts to seek help and shelter from unknown threats.::rAjOo (gunwanti@hotmail.com)'"
1895,Kyofu shinbun,Animation,movie,1,6.36,122874.87184268582,
6693,Ookami Shoujo to Kuro Ouji Recap,"Comedy,Romance,School,Shoujo",tv series,1,6.44,51146.09688317923,"'22 years ago, a bizarre uprising occurred in Japan\'s Yokohama region, destroying civilization, killing many, and causing the area to break off from Japan\'s mainland. This region came to be known as the ""Lost Ground"". Over the years, some of the citizens managed to erect a new city in a corner of the Lost Ground and surrounded it with a barrier to protect it from the impoverished inhabitants of the island\'s surrounding wasteland. However, another phenomenon began to show up in the Lost Ground: Alter, the ability to rearrange matter at the atomic level in certain ways. ""Inners"" who were born with Alter powers became known as Alter Users, and Alter Users who lived outside the city and misused their powers were branded ""Natives"". The police force known as HOLD was constructed to control Native Alter Users. A division of it called HOLY was later created and made up almost entirely of law-abiding Alter Users. Now, however, HOLD and HOLY\'s control over the Lost Ground has become increasingly oppressive to the point that it has started to enslave the wasteland\'s people. Enter Kazuma, a reckless and hotheaded Native who lives with a little girl named Kanami. Kazuma barely manages to survive off working on a farm and doing tasks for his friend Kimishima. Soon, however, Kazuma becomes caught in the conflict with HOLY and forms a fierce rivalry with Ryuhou, one of its highest officers. What is the true intent of HOLY and its leader, Martin Zigmar?::Axemblue', ""On a ruined island section of Japan in which a portion of the inhabitants are gifted with special matter-controlling abilities, a cocky, brash native of the wasteland area fights for independence from the city sector's corrupt police force.::Anonymous"""
