anime_id,name,genre,type,episodes,rating,members,overview
27369,Uchuujin Tanaka Tarou,"Comedy,School,Shounen",movie,100,5.0,145897.06004221406,"""Mii and Yuko, two junior high school students are visiting Hiroshima Peace Memorial Park on a school trip when they come upon a monument dedicated to Dr. Marcel Junod standing forlornly in a corner of the park. They wonder who Dr. Junod was and what he did. Just then they are bathed in a strange light and transported back to Europe, more than 70 years before. It is 1935. The young Dr. Junod, who has been working in a hospital in Mulhouse, France, is heading to Ethiopia as a delegate of the ICRC. Time travelers Mii and Yuko set off along Dr. Junod's path of hardship and turmoil. In Ethiopia, Dr. Junod witnesses attacks on Red Cross workers and the use of poison gas. One after another people are felled. The young doctor sees firsthand the horrors of war, but buoyed by an indomitable spirit he willingly offers a helping hand to those who are suffering as a result of the war. Dr. Junod's work takes him from Ethiopia to Spain and across the European battlefields of World War II. He works to improve the treatment of prisoners of war and arranges prisoner exchanges. He establishes a method for prisoners and their families to write to each other. He secures routes for the delivery of relief supplies. As a humanitarian, Dr. Junod offers moral support to the weak. Seeing that, Mii and Yuko reflect on their own lives and problems.::https://myanimelist.net/anime/9525/Junod?q=Junod"""
329,Neko hiki no Oruorane,"Animation,Short,Fantasy",movie,26,8.38,147765.71085460475,
20057,Hawaiian Rockn Roll,"Kids,Music",movie,13,7.86,356902.4610870398,"""A nerd gets himself in hot water with the new bully, a quiet bad boy who challenges him to fight on the grounds of their high school after the day's end.::mystic80"", 'A high school nerd, Jerry Mitchell (Siemaszko) is assigned to write a piece for the school paper about new boy Buddy Revell (Tyson), who is rumored to be a psychopathic nutcase. When Jerry accidentally touches Buddy, he says that they must fight in the parking lot at 3pm. Jerry will just about do anything to avoid the confrontation.::Corey Semple (AdamSandlers8SexyNights)'"
8862,Corporal Norakuro,"Animation,Short,Comedy",movie,1,6.06,268062.6652028767,"'The Fierce Canine Army has been given the day off, but Norakuro has no home to return to. After he goes to a yakitori (fried chicken) shop for a drink, he goes to the park to take a short nap. Just then, soldiers from the Mountain Monkey Army, who have stolen some secret documents, make their appearances and Norakuro goes after them in hot pursuit. When the Mountain Monkey troops appear to have made their escape in a hot air balloon, Norakuro, as a last desperate measure, climbs into a tube designed for launching fireworks and blasts himself right into the balloon. He retrieves the stolen documents, but the plot unfolds in an unexpected manner.'"
11959,Asura Cryin',"Animation,Action,Comedy,Drama,Romance,Thriller",tv series,2,5.89,15238.671908210332,"'A boy whose friend died and became a ghost, starts high school. On his first day, a trunk is sent to him by his brother. From that moment on everyone are after him believing that he holds the mysterious powerful ""Asura Machine"".::Anonymous'"
10546,Ane Jiru the animation: Shirakawa san shimai ni omakase - Onêsan ga shite ageru,"Animation,Short",movie,4,6.63,130375.41036734356,
9736,Persona 4: The Animation,"Animation,Action,Comedy,Fantasy,Mystery",tv series,12,6.81,32759.055924015138,"'Yu Narukami has moved from Tokyo to Inaba to stay with his uncle and cousin, while his parents are away on business. However, after a murder shakes up the sleepy town, things get even more crazy when he discovers the mysterious ""Midnight Channel,"" and that he has the even more mysterious ability to enter TVs. Accompanied by his disbelieving friends, Yu discovers another world inside the TVs, that seems to be connected with the murder. They also discover the ability to summon \'Persona\', their \'other selves\', whose power they can use to fight the shadows that inhabit the TV world. The murders, the Midnight Channel, the world inside the TV, and Persona. Yu and his friends fight to figure out how they\'re connected, and to solve the case before it\'s too late.::Lovebunny'"
1167,Gatchaman,"Action,Animation,Sci-Fi",tv series,12,6.12,45700.362901032,"'A team of bird-themed superhero ninjas battle the menace of Galactor, a technologically advanced international terrorist organization determined to conquer the world.::Kenneth Chisholm', ""In the year 2001, Earth is under attack by a terrorist organization named Galactor, which is waging a destructive campaign of conquest and terror using super-high technology in the form of bizarre and supremely powerful war machines and biological weapons. The United Nations's forces are helpless to stop this menace, but Professor Nambu of the International Science Organization has a counterforce of his own: the Science Ninja Team, a team of super-agile youngsters who operate with a bird theme and have fighting skills that are a match for any foe, regardless of numbers or firepower. The team is made up of Ken (Eagle), aka Gatchaman, their noble leader with an incomplete past; his hotheaded second-in-command Jô (Condor), their level-headed electronics and demolitions expert; Jun (Swan), their young and impulsive reconnaissance specialist; Jinpei (Swallow), Jun's adopted brother and eighth-generation decedent of the Iga ninja; and their jovial and rotund pilot, Ryû (Owl) are determined to frustrate Galactor at every turn. They have advanced personal vehicles that are carried inside their main vehicle, the God Phoenix, an advanced, supersonic, and heavily armed aircraft that can go into any environment and can temporarily transform into a destructive bird of fire to escape danger. However, the fight won't be any easier because Galactor's leaders, who are the mysterious entity known only as Sôsai X, and his immediate human subordinate, Berugu Katse, have even darker secrets that our heroes can only suspect.::Kenneth Chisholm (kchishol@rogers.com)"""
3456,Emblem Take 2,"Action,Drama,Seinen",movie,1,7.02,65657.36491979138,
1821,Shakugan no Shana III: Final,"Animation,Action",tv series,3,6.36,6341.358919801975,"""Yuji disappeared the fateful night he was supposed to choose between a life combating evil by Shana's side or as a normal teenager. He returns from near-death to lead the Crimson Denizens in a dubious plot to bring peace to the universe, but Shana isn't fooled. In an explosive reunion, the fiery warrior faces her unlikeliest of foes while Flame Hazes from across the world join forces to ignite a war that will determine the fate of all supernatural kind."""
29377,JK to Ero Konbini Tenchou,Hentai,tv series,1,5.08,22819.36435932229,
29994,Mii-chan no Tenohira,"Drama,Historical",tv series,1,3.0,153963.50845365706,"'Yuuta suffered from ""chuunibyou"" while he was in middle school. When he graduated, he try to forgot about it but he accidentally got into a contract with Rikka and disrupts his desperately ordinary life.::anonymous'"
8717,Licca-chan: Fushigi-na mahô no ringu,"Animation,Short,Adventure",movie,1,5.45,42057.07835136085,
4548,Kappa no Coo to Natsuyasumi,"Adventure,Shounen",movie,12,6.96,6653.50886018091,"'Earth has been attacked by the Black Nebula Empire and is threatening to blow up the planet if they are counterattacked, The Yamato crew try to defuse the bomb.'"
30078,Tondemo Senshi Muteking,Animation,tv series,1,4.99,180691.99574053122,
23405,Eiga Ojarumaru: Yakusoku no natsu Ojaru to Semira,"Animation,Comedy,Fantasy",movie,3,6.91,102742.08091531004,
17689,Kono Aozora Ni Yakusoku Wo,"Animation,Romance",tv series,1,7.48,117662.26984051912,
5931,Shiroishi no Yousei Pichi,"Fantasy,Historical,Kids",movie,1,6.07,88432.87236932521,
517,Keroro takara sagashihayappa takarajima dayone dearimasu,"Animation,Comedy,Sci-Fi",tv series,2,7.85,85482.38692678946,
1724,Arakawa Under the Bridge,"Animation,Comedy,Fantasy,Romance",tv series,26,6.6,20066.137198661654,"'A young man is drawn by his eccentric new girlfriend into her home, a village of eccentrics who live under a bridge on the Arakawa River.::Q. Leo Rahman', ""Kou Ichinomiya is a perfect man with a perfect life: he is handsome, smart, self-sufficient, and the young heir to a grand corporation. One day, he falls into the Arakawa River and nearly drowns, but is saved by a young girl named Nino, who lives in a community under a nearby bridge on the Arakawa. It's the Ichinomiya tradition to never be indebted to anyone and settle all accounts, and now Kou owes Nino a life debt. Her request is that he becomes her lover and lives with her. And so Kou begins a new life as a member of the village under the bridge - a village, he discovers, full of self-deluded and eccentric people. There's the musician who wears a star mask, a male war veteran dressed as a nun and his femme-fatale rival who runs a farm, a hairdresser samurai and many others, all led by a man in a green costume. Still, as time passes Kou begins to truly feel at home at the Arakawa under the bridge.::Q. Leo Rahman"""
9252,Aftermath,"Drama,Thriller",movie,1,7.94,175761.80174036167,"""Two strangers' lives become inextricably bound together after a devastating plane crash."", ""Two strangers' lives become inextricably bound together after a devastating plane crash. Inspired by actual events, AFTERMATH tells a story of guilt and revenge after an air traffic controller's (Scoot McNairy) error causes the death of a construction foreman's (Arnold Schwarzenegger) wife and daughter."", 'Near Christmas, the construction foreman Roman is eager to welcome his wife and pregnant daughter that are coming home. When he arrives at the airport, he is informed that their plane has crashed with no survivors, destroying his life. The air traffic controller Jacob ""Jake"" Bonaos commits an error and two planes collide. Jake is forced to have another identity and move to another town, being separated from his beloved wife Christina and son. Roman hires a private investigator to locate Jake. When Roman meets him, a tragedy happens.::Claudio Carvalho, Rio de Janeiro, Brazil', ""Eagerly preparing for the return of his wife and his pregnant daughter from Kiev, construction manager Roman Melnyk anxiously awaits their arrival to pick them up at the airport. Instead, Roman will receive the worst news that anyone could ever receive, as well as the irrevocable certainty that his family has perished in a tragic mid-air collision with no survivors. However, in the background of this calamity, another tragedy occurs as the well-meaning air traffic controller and family man Jake who is held accountable is squashed under the weight of his actions. In the end, with so many lives lost unjustly and unexpectedly, in the aftermath of the two men's grief and sorrow, revenge might sound as a sweet alternative, but sometimes, an apology is enough.::Nick Riganas"""
16009,Otoko Doahou! Koushien,"Action,Sports",movie,12,7.53,153691.5898608939,'Animated version of the classic story of a young farmgirl who is transported to the magic land of Oz.::Anonymous'
32092,Onna Kyoushi Nijuusan-sai,Hentai,movie,1,3.56,199094.58368839187,
1721,Oban Star-Racers,"Animation,Action,Adventure,Sci-Fi",tv series,12,6.91,22600.59192084437,"'Earth, 2082, twenty-five years after the failed invasion of the Crog forces. Young Eva (15) is determined to be reunited with her father, race manager Don Wei, who sent her off to a tough boarding school after the tragic death of the mother, ten years earlier. She escapes from school and secretly joins her dad\'s famous star-racer team under the alias ""Molly"". But Don Wei doesn\'t recognize his daughter. He has other troubles on his mind: the President of the Earth Coalition has just put him in charge of a dangerous top-secret mission. Don Wei must lead the Earth to victory in a mysterious and mythical intergalactic competition - The Great Race of Oban. It is said that the outcome of the competition will radically transform the balance of power within our Galaxy. Earth cannot afford to lose - especially not against the Crogs! Before she knows what is happening, ""Molly"" takes off for the planet Alwas, the first stage of The Great Race of Oban, with Don Wei, champion pilot Rick Thunderbolt, gunner Jordan and mechanics Stan and Koji. The fate of Molly and her friends, as well as the future of the human race, are now inextricably intertwined.::STW Productions'"
25617,Monochrome Factor,"Action,ShounenAi,Supernatural",tv series,1,6.75,71778.46066751255,
4396,Hidamari no ki,Drama,tv series,1,4.42,14640.66654831709,
12859,Possessions,"Animation,Short,Fantasy",movie,1,8.39,3583.7063633449147,"'One night of the eighteenth century, in the depths of the mountain, a human being is lost and finds a small temple. In the moment when he enters the room space is transformed into a completely different world.::NTKH'"
9793,Toriko no Chigiri,Hentai,movie,2,7.4,6134.583104952329,'A ship owned by the Yatsushiro group hit an iceberg and sank. Fifteen years later the Yatsushiro group invite Detective Kogoro and his friends on a cruise where a murder subsequently takes place. Now Conan and the police attempt to identify the murderer.::Anonymous'
32247,Ikusa Otome Valkyrie Specials,Hentai,movie,1,5.2,102979.22205110043,
9318,Elemental gelade,"Animation,Action,Adventure,Fantasy",tv series,1,4.73,71988.75576802355,"'After a routine raid, the rookie sky pirate Cou finds a most unusual cargo in his mates\' cargo hold: Ren, an ""Edel Reid"", a race prized by humans for granting special combat power to their partners through ""Reacting"". He quickly discovers, however, that Ren is even more prized than he expected. The pirate ship is visited by three members of the Edel Reid Complete Protection Agency ""Arc Aire"", who try to purchase her. When Cou refuses, the ship is suddenly attacked by a mysterious force, and Cou\'s captain charges him with Ren\'s protection. In this series, there are three human ""species"", humans, Edil Raid/Eden Reid and Sitting Raid. The Raids have magical power and can ""react"" with human beings. If they do so they become living weapons with several great abilities. Sitting Raid are artificially created Edil Raid. The sky pirate Could, the extremely strong and legendary, but newly awaken Edil Raid girl Ren and three members of Arc Aile, an Edil Raid protection organization, are on a journey to the Edil Garden. On this ""journey of love adventure"" they experience many problems between the different species, because Edil and Sitting Raid are often used only as weapons, as well as fights between Arc Aile and ""Chaos Choir"", an organization that wants the Edil Raid to rule the world. Due to the developing love between Ren and Could they can reunite humans and Edil Raid with an ancient song after many funny, exciting, but also tragic adventures. (Edil Raid songs, also called psalms, are used to set free immense magical power).::Anime News Network'"
29876,Tengen Toppa Gurren Lagann: Ore no Gurren wa Pikka-Pika!!,"Action,Adventure,Comedy,Mecha,Sci-Fi",movie,6,6.17,21917.089652287166,"'Simon and Kamina, brothers in arms, take upon themselves to venture beyond the borders of their world, reality and imagination. Venturing further and further into a hidden truth that has kept humanity prisoners for millennia.::WeX'"
26331,Tanahashi Hiroshi X Mameshiba Pro Wrestling,"Comedy,Sports",movie,1,7.33,53593.46316252268,'A comedy disguised as a psychological thriller with science fiction elements.::Anonymous'
8311,Ramen Fighter Miki,"Animation,Action,Comedy",tv series,25,7.9,135160.96114231122,"""In a world where terror grips the land and innocents have no solace from violence and brutality, one girl walks the line between life and death to bring her own special brand of - Ramen. Miki Onimaru works at her parent's Ramen shop, making deliveries, waiting tables, and attracting customers with cute, girlish charm. Somehow, Miki can't complete even one of these simple tasks without the full employment of her extensive bone-crunching, skull-splitting martial arts moves and penchant for unleashing relentless destruction. Can Miki get through the day without messing up and angering her Mom, who makes her look like a gentle kitten in comparison?::Crunchyroll"""
3964,"Okaasan, Nakanaide","Drama,Kids",movie,1,6.85,104978.40060917533,
33570,Kämpfer Picture Drama,Comedy,movie,1,4.73,72909.61745740956,'The movie is about a girl named Hiromi Nozawa and her dog Junkers. Hiromi is having troubles at home mainly because her parents wanting to separate. Junkers tries to comfort her in ways no other dog can. He can talk and grant her 3 wishes.::anonymous'
2708,Mobile Suit Z Gundam 2: A New Translation - Lovers,"Animation,Action,Drama,Romance,Sci-Fi",movie,26,5.71,74453.74726753437,'Camille falls in love with the unstable enemy pilot Four Murasame and tries to save her from the destructive influence of the Psycho Gundam.'
25647,Ee Bandhana,"Drama,Family,Romance",movie,6,7.35,64408.89129744223,
3165,Are You Serious?,"Short,Comedy",movie,2,7.62,62367.72890109893,'A young woman who has been jilted by her fiancé wants desperately to lose her virginity. But the men she meets are all extremely unlikely candidates.::Jim Beaver <jumblejim@prodigy.net>'
5152,From Up on Poppy Hill,"Animation,Drama,Family,Romance",movie,1,7.14,41259.754920092906,"""A group of Yokohama teens look to save their school's clubhouse from the wrecking ball in preparations for the 1964 Tokyo Olympics.::Anonymous"""
2731,Eien no Aseria: 'Motome' no koe,"Animation,Short",movie,6,5.9,57228.83756346432,
2239,Hetalia: The World Twinkle Extra Disc,"Comedy,Historical,Parody",tv series,2,5.26,157259.82164451492,
1296,Hyakka Ryouran: Samurai Bride Specials,"Comedy,Ecchi",tv series,1,6.73,92586.81324436744,"'An army of sentient transforming dinosaurs fight to defend the Earth from alien invaders.::Q. Leo Rahman', 'Around the prehistoric era, an alien race known as the Dragozaurs arrived to consume the lifeforce of Mother Earth. In response, Earth created the Dino Knights, an army of sentient dinosaurs infused with extra lifeforce, to combat the invaders. The battle was fierce, but in the end the Dino Knights were victorious. Circa 2000, the Dragozaurs return to Earth for a second attempt, and the skeletal remains of the Dino Knights are stored in a museum... until two young children in danger, Kaito and Rena, manage to return them back to life. The Dino Knights prepare to defend the Earth against the Dragozaurs, once more.::Q. Leo Rahman', 'The DragoZaurs have returned to the Earth to steal the ""life force"" and destroy the entire planet. Two 12 year olds, a boy named Kaito and a girl named Rena were chosen by the DinoKnights to help protect the Dinodaggers. Now the DinoZaurs have to reawake to save the world from the evil DragoZaurs!::Stuart Brewer'"
7157,Robot Carnival,"Animation,Comedy,Drama,Fantasy,Sci-Fi",movie,1,6.56,33761.888938284355,"'A collection of short stories, made by different animators with ""robot"" as the working title.::Ask Liliequist Stølan', 'This is a Fantasia-like anthology of robots. The most noble are Presence, Deprive, and Nightmare. Nightmare is the story of an evil, cybernetic overlord that rises one night and unleashes its robotic servants. Deprive is a science fiction tale of a young girl who has been abducted by an invading army of robots, and only a mysterious cyborg can help her. Presence is about a young toy-maker who makes a beautiful, female cyborg. When she becomes ""a bit too real"", he destroys her, only to be haunted by her spirit for the rest of his life.::Chuck ""Dark-Side"" Williamson'"
7463,Katteni Kaizô,"Animation,Short,Comedy",movie,12,6.3,36970.690636731575,
10689,Huckleberry Finn Monogatri,"Animation,Family",tv series,1,6.74,35129.67309587044,
5298,Future Card Buddyfight,"Animation,Action,Sci-Fi",tv series,1,7.12,97708.65082179016,"'It is the year 2030, and the stage is the capital of Japan, Chou-Tokyo. Through ""Buddyfight"", humans have started cultural interactions with residents from other worlds called ""Affinity Dimensions"". Buddyfight is a game with selected humans as the ""Buddyfighter"", and residents from the other world as the partner (known as ""Buddy Monster""). These battles have high significance and sometimes it is even used to decide the fate of a nation, and naturally there are those who seek to use the Buddy Monsters for evil purposes.::Crunchyroll'"
770,Pants no Ana,"Animation,Short,Comedy",movie,1,7.53,12372.599778259726,"'A collection of short stories, all of which are perverted to various degrees.::Moh X'"
2186,DD Fist of the North Star,"Animation,Action,Comedy",tv series,2,5.61,100945.06845494476,"'A parody of the post-apocolyptic anime, ""Fist of the North Star"", wherin the nuclear holocaust never happens, and so Kenshiro and his brothers have to settle into a regular society and find jobs!'"
33655,Bannou Bunka Neko-Musume DASH!,"Action,Comedy,Ecchi,Romance,Sci-Fi",tv series,0,6.79,23429.277701983257,"'A 12-year old boy named Naota one day meets a strange woman, riding a Vespa and wielding a big guitar. As soon as she appears, mysterious things start happening.::Snake202', ""Naota is a normal student living with his abnormal father and grandfather. One day, a seemingly insane girl named Haruko blazes in from out of nowhere on her Vespa, wielding an electric guitar with a buzzsaw! Haruko moves in with Naota under the pretense of being a housekeeper, but Naota knows there's something obviously strange about her. To make matters worse, large shapes are growing out of his head, hatching into large monsters that Haruko makes her mission to kill. Who is Haruko really, and what is she after? You won't find out until the end of this bizarre story.::Anonymous"""
19745,Hustle!! Tokitama-kun,Dementia,tv series,1,7.29,15906.73770988502,
23343,The Romanoffs,Drama,tv series,1,6.5,28978.74431536148,'A contemporary anthology series set around the globe featuring eight separate stories about people who believe themselves to be descendants of the Russian royal family.'
528,Kick Off 2,Sport,tv series,1,7.66,28279.043628653555,
3745,Ai Tenchi Muyo!,"Animation,Short,Comedy,Sci-Fi",tv series,1,7.15,133145.45711325706,"'A reboot of the Tench Muyo anime In TV short form. The Series takes place in the city of Takahashi, the real-life sponsor of the show.'"
21821,Aoki Honô,"Animation,Drama,Romance",movie,12,5.82,102622.92382492064,"'The story of Ryuuichi a man trying to get ahead in life, and make a name for for himself, along the way he meets (and sleeps with) many women. Based a manga by Kimio Yanagisawa.::Shadowjac'"
8898,Sayonara Ginga Tetsudou 999: Andromeda Shuuchakueki,"Adventure,Drama,Sci-Fi,Space",movie,1,5.78,22128.760850631617,"""There's an old decrepit building at the edge of the school grounds that hasn't been used for years, and it falls apart a little bit more each day. But the little house holds a secret, as Takahiro and his friends are soon to find out...they wind up making contact with a mysterious entity known as Saki. Can Takahiro save Saki's world from destruction."""
12877,Shusaku Replay,"Hentai,School",tv series,1,6.26,71493.03714280085,"""Jeff comes ashore with his family in Tokyo, Japan where they visit a world famous fish market and make perfect sushi hand rolls. Then, they visit the Mt. Fuji area's glittering ice caves before ending their Japanese adventure dressed in kimonos learning a traditional fan dance."""
6344,Ragnarok: The Animation,Animation,tv series,1,7.12,11965.635789243626,
23767,Love Will Find the Way Back Home,Music,tv series,2,4.33,4273.85310613644,
16916,Beet the Vandel Buster Excellion,"Adventure,Fantasy,Shounen,Supernatural",tv series,1,8.07,36784.58943332608,
23347,Mujaki no Rakuen,"Animation,Comedy",tv series,260,6.7,64054.84675984983,
7468,Strike Witches,"Animation,Action,Comedy,Fantasy,Sci-Fi",tv series,6,6.27,41573.399434577615,"'The story takes place in year 1944 and the world lives in fear of unidentified flying objects called neuroi. A young heroine Named Yoshika miyafuji joins the 501st joint wing, known as the strike witches to fight and defeat the neuroi so that way she can protect the world.'"
15607,Akai ito,Drama,movie,2,6.47,86257.34138337398,"'A drama that follows the emotional and spiritual growth of teenage girl as she wrestles with love, family, and other matters.::Anonymous'"
3407,Binetsu Shoukougun,Hentai,movie,24,7.07,53287.06471457151,"'During a random night, the two brothers Mutta Nanba and Hibito witness what seems to be a UFO flying to the moon and they both vow to eventually become astronauts. 19 years later, Mutta has the opportunity to follow his brother and fulfill his promise.::Dielson Sales'"
5162,Kodai Ouja Kyouryuu King: Yokuryuu Densetsu,"Action,Adventure,Game,Kids,Sci-Fi",tv series,13,7.65,187429.5535473728,"'Set in the world of Korean entertainment production, the drama series depicts the hopes and dreams of a group of young Korean, Japanese and Thai women as they embark on a career in the entertainment industry.'"
8598,Food Wars: Shokugeki no Soma,"Animation,Comedy,Drama",tv series,1,6.67,38420.439157863184,"'Yukihira Soma is a teen with a great enthusiasm for cooking. He dreams of surpassing his father, a great chef and restaurant owner, and so attends Totsuki Culinary Academy, a legendary and formidable cooking school for the greatest teenage chefs in Japan.'"
1111,Ranpo Kitan: Game of Laplace,"Animation,Crime,Horror,Mystery,Thriller",tv series,1,7.02,128558.32845926641,"""A young boy,Kobayashi meets genius detective Akechi, who comes to his school to investigate several murder cases. Kobayashi takes an interest in Akechi and, in spite of his friend Hashiba's worries, he volunteers to be Akechi's assistant."""
