anime_id,name,genre,type,episodes,rating,members,overview
3004,Toushindai My Lover: Minami tai Mecha-Minami,Hentai,tv series,2,6.38,2708.0,"'Best friends Mikan and Hotaru are separated when Hotaru is scouted by a special school called ""Alice Academy."" Mikan determines to enroll too but Alice Academy is a mysterious place.'"
17981,Psychedelic Pictures Presents: The Hippy Vampire (in development),Comedy,tv series,1,4.75,96.0,
3481,Crayon Shinchan 2016 Theatrical Film: Bakusui Yumemmy World Daitotsugeki,,movie,1,6.77,1179.0,
5475,Tezuka Osamu ga Kieta?! 20 Seiki Saigo no Kaijiken,Mystery,tv series,26,6.35,305.0,
7501,Houkago 2: Saiyuri,Hentai,tv series,1,4.88,174.0,"'Short animated features featuring Snoopy, Charlie Brown, and the rest of the Peanuts gang.::TheMovieSmith', ""Charlie Brown and the Peanuts gang are back. This is time, it in is a series of animated vignettes that are largely direct adaptations of Charles Schulz's stories from his classic comic strip, except that Snoopy's thoughts are still not heard directly. Once again, we are treated to the misadventures of the world's favorite hard-luck hero, Charlie Brown, the larger than life mischief of Snoopy, and the rest of the gang as they live their lives with their own eccentricities and insecurities.::Kenneth Chisholm (kchishol@rogers.com)"""
2222,Yamada-kun and the Seven Witches,"Animation,Comedy,Fantasy,Romance",tv series,243,7.28,5330.0,"'Attending the private school Suzaku High Ryu Yamada is a student completely bored with his surroundings. One day while following the honor student Urara Shiraishi up the stairs falls down on her waking up to have switched bodies by accidentally kissing. Finding out their ability to to swap bodies Toranosuke Miyamura, the student councils president discovers their abilities to go into one and others bodies offering them the abandoned supernatural studies club and clubroom.'"
8372,My Melody no Akazukin,"Fantasy,Kids",tv series,1,5.41,160.0,"'About a witch hiding her identity', 'Honoka Takamiya is just an average student who just so happens to sit next to Ayaka Kagari, the ""Princess"" of the school, and has never said a word to her. However, one day when Takamiya\'s life is put in danger, Kagari arrives to his rescue dressed as a witch.'"
5201,Unlimited Fafnir,"Animation,Fantasy,Romance",tv series,50,6.81,443.0,"'Midgar, all-girl academy, would have been notable just for the action of accepting its first and only male student, Yuu Mononobe. But Midgar stands out for much more than that: it\'s a school exclusive to a group of girls known as D\'s. Each of them have extremely powerful abilities in generating dark matter and manipulating it into powerful weaponry. The D\'s didn\'t exist twenty-five years ago, and only appeared after a number of mysterious, destructive monsters known as ""Dragons"" started appearing around the world. Strangely, just as suddenly as they appeared, they vanished. In their destructive wake, some girls started being born with symbols on their bodies and powers similar in nature to those wielded by the Dragons themselves. Now the D\'s attend this school, hoping to harness and utilize their powers against the Dragons. Yuu is their latest member and is extraordinary for being the only known male D in existence. Now he must forge relationships with the girls around him, including his long separated sister who attends the school as well, and work with them to investigate and eliminate the threat of the powerful Dragons.'"
13727,Kaibutsu Oujo (OVA) Specials,"Adventure,Comedy,Horror,Shounen,Supernatural",tv series,1,6.88,5793.0,
2316,Tiger &amp  Bunny: Too Many Cooks Spoil the Broth,"Action,Comedy,Mystery,SuperPower",tv series,52,6.93,957.0,"'The story begins with a young boy named Dai .Dai, the young protagonist of the series, is the only human living on the island. Having been raised by Brass and with his best friend, the monster Gome, Dai grows up dreaming of becoming a hero.', 'The story begins with a young boy named ""Dai"" .""Dai"", the young protagonist of the series, is the only human living on the island. Having been raised by his adoptive grandfather ""Brass"" and with his best friend ""Gome"" , Dai grows up dreaming of becoming a hero.::ABeer Baskerville'"
29513,Lightning Trap: Leina and Laika,"Animation,Adventure",movie,1,7.21,9611.0,"'Terrorists attack the new airplane Lightning L808, and only a special agent and a young schoolgirl on board can stop them.'"
28053,Manga Kotowaja Jiten,"Comedy,Historical",movie,1,5.8,158.0,"""November 1998: A young man swears he committed a heinous crime, he looks in the news, but nobody talks about what happened, even when the police find the alleged victims ... alive and unharmed. He says that he has done it and wants the aid of Shiki. Behind this seemingly senseless event, there is a large apartment building in which is woven a very convoluted plot in which Touko's past is involved. Will Shiki and Mikiya discover the truth? Can all of them escape from the spiral?::Nolberto Roa"""
21571,Dr,Comedy,movie,1,6.59,2213.0,"""In the moment when Belgrade industrialist Zivota Cvijovic had dreams to marry off his son Milorad, Doctor of Philosophy, to a minister of transport's daughter, a telegram from Milorad's professor from Heidelberg arrives, saying that he wants to visit them. Bad luck is that Velimir, a poor student, was financed by Milorad, and studying under his name received a diploma.::Nikola Popovic"""
5833,Teekyuu 3,"Comedy,School,Shounen,Sports",movie,56,6.73,243.0,"""November 1998: A young man swears he committed a heinous crime, he looks in the news, but nobody talks about what happened, even when the police find the alleged victims ... alive and unharmed. He says that he has done it and wants the aid of Shiki. Behind this seemingly senseless event, there is a large apartment building in which is woven a very convoluted plot in which Touko's past is involved. Will Shiki and Mikiya discover the truth? Can all of them escape from the spiral?::Nolberto Roa"""
10391,Maki-chan to Nau,Hentai,movie,6,5.77,6115.0,"'A widower takes an offer to screen girls at a special audition, arranged for him by a friend to find him a new wife. The one he fancies is not who she appears to be after all.::<rag@kabelfoon.nl>', 'In Tokyo, Shigeharu Aoyama is a widower that grieves the loss of his wife and raises his son Shigehiko Aoyama alone. Seven years later, the teenage Shigehiko asks why his middle-aged father does not remarry and Shigeharu meets his friend Yasuhisa Yoshikawa, who is a film producer, and tells his intention. However, Shigeharu has difficulties to approach to available women to date and Yasuhisa decide to organize a sham audition for casting the lead actress for the fake movie. They receive several portfolios of candidates and Shigeharu becomes obsessed by the gorgeous Asami Yamazaki. Despite the advice of the experienced Yasuhisa, Shigeharu calls Asami to date and he falls for her. But who is the mysterious Asami?::Claudio Carvalho, Rio de Janeiro, Brazil', 'A lonely Japanese widower whose son is planning to move out of the house soon expresses his sadness to a friend and fellow film producer, who becomes inspired to hold an audition for a non-existent film so that the widower can select a new potential bride from the resulting audition pool. The widower ultimately becomes enamored with and fascinated by one particular young woman...but first impressions can often be horribly wrong....::deusdiabolus'"
29589,Yakin Byoutou Ni,Hentai,movie,24,6.94,67336.0,
1043,Juushin Enbu: Hero Tales,"Action,Fantasy,Shounen",movie,2,6.82,11730.0,"'The Joker five-star system is under Emperor Amaterasu. Mecha pilot Ladios must save his co-pilot, Fatima-class female android Lachesis, from one of many warlords, who oppose Amaterasu.'"
3009,Ecchi na Shintai Sokutei Anime Edition,Hentai,tv series,105,7.38,4031.0,"""A young computer hacker who doesn't work for money, steals from big bank corporations sucking every last cent out of them, all while battling the King of America."""
4098,Kansen: Ball Buster The Animation,Hentai,movie,1,5.62,572.0,'Young Atsuko Kagami comes into possession of a magical mirror that lets her transform into anything she wishes. Atsuko Kagami then attempts to save a company which is about to be sold by using her transformation abilities. She also falls in love as a 22-year-old college student.::anonymous'
29357,Kero Kero Keroppi no Tomodachi wa Mahoutsukai,"Kids,Magic",movie,1,5.11,69.0,'A short music video about a girl and her pet hamster.'
287,Yami Shibai 2nd Season,"Dementia,Horror,Supernatural",movie,24,7.41,23220.0,"""Princess Rangiku lost her entire family to Lord Karimata, who invaded her home seeking her father's life work, puppets with unique capabilities. As her duty, Rangiku sets out with three of her father's greatest puppet warriors to seek revenge. She can manipulate these to battle the strongest of warriors, however manipulating the puppets leaves her own self vulnerable to direct attacks, so she seeks a ninja warrior named Manajiri to aid and protect her in her quest.::Anonymous"""
5472,Tengen Toppa Gurren Lagann Movie: Lagann-hen Special - Viral no Amai Yume,Comedy,tv series,1,6.03,455.0,"'The astronomical adventures of the Angel Brigade, a squad of females dispatched to retrieve powerful objects scattered around the Milky Way.::Serena Tsukino', 'The Angel Brigade is a five team members military branch of Transbaal Empire military. There mission is to track down and find the ""Lost Technology"". Somehow they most of the time mess up on the mission by getting into trouble and weird situations.::David'"
28647,Jibun no Mune ni te wo Atete,"Drama,Kids",tv series,1,4.71,335.0,
26165,Detektiv Conan - Der Magier des letzten Jahrhunderts,"Animation,Adventure,Crime,Mystery",movie,12,7.19,48549.0,"""Suzuki Zaibatsu found the 51st Easter Egg made by Russian Jewel maker February. Kaido Kido sent police a warning letter that he would stole the egg which Suzuki would display 4 days later. Kaido Kido (when) able to steal egg at the time when everyone's outside. SCORPION shot Kaido's eye and made Kaido vanished. Conan met 3 ladies in the mission that they have to protect the easter egg in Suzuki's home. Seiran Hoishi (27), Romanov Empire, knew chinese and she was finally...::Kazuha"""
23059,Enkou Shoujo: Rikujoubu Yukki no Baai The Animation,Hentai,tv series,1,4.54,527.0,'A story about a bad cop standing up to an even worse society.'
4730,The Tale of Japanese Envoys to Tang Dynasty China,"Animation,Short",movie,1,5.96,2238.0,
23935,"Thats Hanakappa Musical: Pan to Gohan, Docchi nano!?","Comedy,Kids,Music",movie,1,5.46,691.0,
21077,Koume-chan ga Iku!,"Comedy,Romance,SliceofLife",tv series,3,6.39,1924.0,
1989,"Misenai Namida wa, Kitto Itsuka","Fantasy,Music",tv series,1,5.91,1484.0,"'Chuuta Kokonose has been hearing voices in his head since childhood. One day, he gets taken and transported to a space police station, filled with mysterious creatures and given a test, to check his ability to become a member of eLDLIVE.'"
8357,Naniwa Kinyuu Den: Minami no Teiou,"Comedy,Drama,Seinen",tv series,1,5.27,122.0,"'When evil awakes, the deity of Fate will choose six heroes to save the world from ruination.::Mattias1'"
20965,12-Sai. Chiccha na Mune no Tokimeki,Comedy,tv series,1,6.48,2855.0,"'Hanabi Ayase and her best friend, Yui Aoi, are 6th graders in school. When Hanabi is chosen to work with Yuuto Takao for an upcoming test, she begins to fall in love with him and they both start dating. Yui also falls in love with Kazuma Hiyama, after he protects her from a classmate who talked about Yui behind her back, and they start dating as well. But with physiological changes and more and more obstacles in their love lives, will Hanabi and Yui overcome everything and find true love at the age of 12?'"
23585,Rurouni Kenshin: Meiji Kenkaku Romantan - Ishinshishi e no Chinkonka,"Drama,Historical,Samurai,Shounen",movie,2,6.14,138.0,"'A convict returns to his home town to torturing again his family and face his neighbors trying to destroy the local religious fanatics and their plans to keep money from the village people.::abel', ""A man returns to his hometown after being in jail. The turbulent relationship with his family mixes with thriller about a religious fraud that the main character tries to stop but the village people don't want believe him and the hustlers will try to close his mouth.::abel"""
19999,Yumemakura Baku Twilight Gekijou,"Horror,Psychological",movie,162,7.18,72.0,"""A series of nine flipbook-like vignettes showcasing simple revelations of movement and color. Koji Yamamura's animation refers back to the phenakistoscope, one of the earliest mechanisms used to make drawings move."""
1663,Ko ro ro roshianti,"Animation,Comedy,Sci-Fi",tv series,52,7.39,3685.0,
32475,Taiho Shichau zo: Full Throttle,"Action,Comedy,Police,Shounen",tv series,1,5.8,43.0,"'A young man is drawn by his eccentric new girlfriend into her home, a village of eccentrics who live under a bridge on the Arakawa River.::Q. Leo Rahman', ""Kou Ichinomiya is a perfect man with a perfect life: he is handsome, smart, self-sufficient, and the young heir to a grand corporation. One day, he falls into the Arakawa River and nearly drowns, but is saved by a young girl named Nino, who lives in a community under a nearby bridge on the Arakawa. It's the Ichinomiya tradition to never be indebted to anyone and settle all accounts, and now Kou owes Nino a life debt. Her request is that he becomes her lover and lives with her. And so Kou begins a new life as a member of the village under the bridge - a village, he discovers, full of self-deluded and eccentric people. There's the musician who wears a star mask, a male war veteran dressed as a nun and his femme-fatale rival who runs a farm, a hairdresser samurai and many others, all led by a man in a green costume. Still, as time passes Kou begins to truly feel at home at the Arakawa under the bridge.::Q. Leo Rahman"""
5644,Fairy Tail Movie 1: Houou no Miko - Hajimari no Asa,"Fantasy,Magic,Shounen",tv series,2,6.86,1771.0,
1184,Kanojo ga Nekomimi ni Kigaetara,Hentai,movie,26,7.1,9293.0,
1212,Ketsui,"Action,Drama,Fantasy,Horror,Mystery,Sci-Fi",tv series,26,7.51,24156.0,
4451,"Saikin, imouto no yousu ga chotto okashiindaga OVA","Short,Comedy,Fantasy,Romance",movie,2,6.35,868.0,
6107,Wizardry,Fantasy,movie,13,6.45,685.0,"'Based on the first Wizardry game ""The Proving Grounds of the Mad Overlord"", a group of characters enter a dungeon to confront the ultimate wizard to prevent him from reaching an unstoppable power. On their way they meet up with a few new friends who have their own battles to settle, but their paths lay together.::Anime News Network'"
20541,Kyouryuu no jidai,Documentary,tv series,12,7.59,133385.0,
16514,Ikusa Otome Valkyrie Shinshou,Hentai,movie,1,6.19,152.0,"""Akira is beautiful-so much so that he can have any girl...or guy that he lays eyes on. Unfortunately, the only woman he has ever wanted is the one woman he could never have-his own sister. When he first met Kaname-innocent to the ways of the world-his own world slowly began to change. The realization of the reality that his sister can never be his and that he can never find true comfort in her arms devastates him. There, from the depths of his despair, he finds salvation in Kaname's loving embrace.::animenewsnetwork.com"""
5534,Kero Kero Keroppi no Dai Bouken,"Adventure,Fantasy,Kids",movie,164,7.08,296.0,
16490,Yurumates 3D Plus: Natsuyasumi Maison du Wish Report,"Comedy,Seinen,SliceofLife",tv series,1,4.93,91.0,
30140,Bokura Machi Bouzu!,"Kids,Music",movie,26,6.33,45.0,"""An actress, Julie Beck, finds out that she is ill and has only a short time to live. She becomes taken with Hitty, a young orphan prone to dreaming. Julie soon decides to adopt the child so that her husband Bill will not be alone when she dies. After Julie dies, Bill is so grief stricken, he shuts out everyone in his life, even Hitty. Hitty believes she's receiving visits from Julie who offers Hitty advice on how to make Bill happy. Unfortunately, Bill is not charmed by Hitty's efforts to care for him; he does not believe she's seen Julie and wants to send her to boarding school. Rather than leaving Bill, Hitty runs away to find Julie. After Bill hears a record Julie recorded before she died, he finally realizes he must move on with his life and with Hitty.::Daniel Bubbeo <dbubbeo@cmp.com>"""
28215,Space Station No.9,"Short,Music,Sci-Fi",movie,13,7.28,11992.0,
8533,Time Travel Tondekeman!,"Action,Adventure,Comedy,Kids",tv series,1,6.37,987.0,
7329,Pokemon: Pikachu Tanken Club,"Adventure,Comedy,Fantasy,Kids",tv series,1,6.84,1472.0,"""A female android battles her evil creator's forces as a mysterious superhero.::Kenneth Chisholm"", 'Cybersix is the name of a powerful advanced female genetic construct android who is the creation of malevolent scientist named Von Richter. He considers her a failed creation owing to her indomitable free will and she was forced to escape to avoid termination by her creator. Now she hides in regular society as a male teacher named Adrienne Seideleman, but she stalks the night as a caped superhero. Vowing eternal opposition to the plans of her creator and his henchmen, she protects her new found world and friend and seeks the humanity that her creator denied from her.::Kenneth Chisholm <kchishol@execulink.com>', 'Cybersix is the name of genetically created female made by the malicious Dr.Von Reichter. She is one of many individuals in the ""Cyber-series"" who are all ultimately terminated because of their innate humanity and sense of good. However, before she can be destroyed, she escapes from Von Reichter and hides in regular society disguised as a male high school teacher, Adrian Seidelman. She eventually teams up with ""Data 7"", another of Von Reichter\'s creations. Data 7 is, in fact, her brother Cyber 29, who was killed in an accident and had his consciousness transplanted into a panther. Together, they work to thwart the plans of Von Reichter, his son Jose and their genetic mutation army. Throughout, Cybersix tries to maintain her secret identity from her close friend and co-worker, Lucas Amato. As well, she constantly debates her existence and what it all means, since she knows full well that she is not actually human, but a genetic creation.::Matthew Wong <mci_sac@hotmail.com>'"
387,Doraemon Movie 29: Shin Nobita no Uchuu Kaitakushi,"Adventure,Comedy,Fantasy,Kids",tv series,13,8.07,120731.0,"""Yuuta Takemoto is a poor college student who lives in a dilapidated apartment building with his two friends, Shinobu Morita and Takumi Mayama. The series chronicles the students' story as they struggle through life and love.::dxg"""
21471,Magical★Taruruuto-kun: Sukisuki Takoyaki!,"Adventure,Comedy,Ecchi,Fantasy,Magic,School",tv series,1,5.58,577.0,"'High school student Junichi Tachibana attempts to find love once again after having his heart broken last Christmas. This series follows his romantic endeavors in a sequence of six separate arcs, each involving a different heroine.'"
1763,Shikabane Hime: Puchitto,Comedy,tv series,2,5.84,1144.0,"""After Araragi Koyomi graduated from high school, Kanbaru Suruga feels lonely because there's no one to talk about Oddities anymore. One day, she heard a rumor about Mr. Devil, who can realize people's wishes. She comes to meet that person, but it turns out to be Numachi Rouka - an old basketball rival of her. What can Kanbaru do to help Numachi?"""
2388,Rurouni Kenshin: Wandering Samurai,"Animation,Action,Adventure,Comedy,Drama,Fantasy,History,Romance,Thriller",tv series,1,6.26,445.0,"'The adventures of a young wandering swordsman who stumbles upon a struggling martial arts school in Meiji era Japan.::Franry Catayong', 'A man slayer, Kenshin Himura, who played a major role in defeating Tokugawa Shogunate of feudal Japan carries his reverse blade sword (with a promise not to slay anymore). He embarks on a quest to repent for his sins by helping the innocent. He lodges in Kamia Kashin dojo where he becomes an acquaintance of Kaorou, the assistant instructor of the dojo. After being saved by Kenshin from mafia, a stubborn young boy, Yahiko Myojin joins the dojo as a student. Sanousuke, a victim of war becomes an acquaintance of Kenshin after losing to him in a duel. Together with his new friends, Kenshin carries out his ideal of helping the innocent. A series of events unfold that questions his ideal of living for the innocent and not slaying men. Kenshin faces every opponent with his reverse blade to uphold justice.::kumar29nov1992@gmail.com', 'During the Bakumatsu (the final days of the Tokugawa government) in Japan, there was a merciless swordsman known as Hitokiri Battousai (Himura Kenshin), who fought alongside revolutionaries against the government. After the revolution, he suddenly disappeared and throughout the years became a legend. About ten years later, he is a wandering swordsman, who dedicates his life to helping and protecting people as a way to pay for all the lives he took during the revolution. This is the story of Kenshin, wandering swordsman, master of Hiten Mitsurugi Ryu style of sword fighting. His many adventures begin with his arrival at Tokyo and meeting Kamiya Kaoru, sword instructor and owner of a dojo...::Agent Neuman'"
16189,Sei Shoujo The Animation,Hentai,movie,1,6.94,3000.0,"'In the special episode to season 1, the queen from Valhalla planet arrives on earth with a virtual-world-program, called ""bride training boot camp"". They built several pairs which have to take a random card with a special situation that might occur if you are married. For instance Kazuto and Valkyrie have to make dinner, Raine and Kazuto\'s sister have to manage poverty or Akina and Hydra have to prepare a wedding ceremony as bride and groom (so everyone gets the most unlikely and unsuitable situation). The Queen from Valhalla Planet has been visiting Kazuto and the gang quite often. She tell them that she is was in Earth region for business purposes, in reality her main concern for coming around quite often is because she has concerns that Valkyrie wouldn\'t make a good wife for Kazuto. So she comes up with to put the gang through wedding training.::animenewsnetwork.com'"
19187,Nazo no Kanojo X: Nazo no Natsu Matsuri,"Ecchi,Mystery,Romance,Seinen",movie,1,5.96,893.0,"'Karo was hurrying to his house on a rainy day. Then he met a fish swimming in the air. He talked about the fish to Piyobupt but he laughed at Karo. So they started to imagine. And outside of the window, flying fishes were enjoying the rain.'"
15313,Angel Cop,"Animation,Action,Sci-Fi",tv series,12,6.36,8081.0,"'An elite anti-terrorist agent battles terrorists threatening Japan, but a mysterious third player is involved in their own way.::Kenneth Chisholm', 'In the late twentieth century, the Secret Security Force was formed to stop the actions of the communist terrorist group known as the Red May. Angel, a beautiful, yet cold woman, has recently joined the small anti-terrorist group. But her first mission will be a true test of skill, for members of the Red May are being found dead, murdered by gruesome methods. Who is causing these murders? And why?::Chuck ""Dark-Side"" Williamson'"
8213,Shibainuko-san,Comedy,movie,1428,6.05,194.0,
9007,Nightwalker: Midnight Detective,"Animation,Action,Comedy,Crime,Fantasy,Horror,Mystery",tv series,1,5.74,132.0,"'Mankind is threatened by a race of creatures called the Nightbreed, people who have, either willingly or through deception, succumbed to supernatural beings. And hunting them down is a man named Shido. A detective. A warrior. A vampire. And with the help of an urban spirit, his naive secretary, and a police agent assigned to special cases, Shido stands as a vanguard against the Nightbreed. But he has his own difficulties as well. Including his sire, the mysterious Cain, and his prophecies of the Golden Dawn...::Miriani'"
9887,"Saitama-ken Zaijuu, Fujiyama Osamu, 33-sai, Mushoku (NEET): Fujilog Nyuumon-hen",Comedy,tv series,2,5.7,409.0,"'Once upon a time, there was a war between the Imperial army and Ninku, an elite unit of 12 zodiac warriors led by their master. Just when the Ninku were about to win the war, their master asked them to hold back and disbanded the unit. The series follows the adventures of 3 of the 12 zodiac warriors, along with the sister of one of them and a penguin, and the repercussions of that fateful day. It is a journey of friendship, loss and adventure, as they run away from the Imperial army who are trying to eliminate them.'"
4471,Cleavage,Documentary,movie,1,6.11,977.0,"'""Cleavage"" is an uplifting and informative journey to the most eye-catching destination on earth: The space between a woman\'s breasts. Cleavage is what happens when breasts collide--a merger that at once fascinates, scandalizes, and mesmerizes. Cleavage makes movie & pop stars, enriches surgeons, tempts politicians, and dominates fashion. When breasts are lifted and pushed together, all of society rubbernecks...::Anonymous'"
10532,Tachumaru Gekijou,"Comedy,Parody",tv series,2,6.84,8973.0,"'Martin becomes obsessive about Clare after she praises work colleague Dr Harding and follows her to a staff night out where he makes a fool of himself by not realizing that Dr Harding is a platonic woman friend. Matthew assists Mandy in deceiving Marco into believing that she is a virgin but the deceit is discovered when Marco turns up unexpectedly whilst Matthew is watching a video he secretly made of Mandy having sex. Jason, in love with Matthew, coaxes him out of the house to the park and a gym where he acquires some gay admirers. Newly confident Matthew goes to the corner shop and foils a robber by hitting him with his surf board but he is traumatized by the experience and reverts back to not wanting to go out.::don @ minifie-1'"
