anime_id,name,genre,type,episodes,rating,members,overview
29469,Bitto za kyûpiddo,Animation,tv series,9,5.75,50.0,
1558,Azumanga Daioh,"Animation,Comedy",tv series,1,6.26,2153.0,"'A humorous and highly unpredictable animated series following a group of high school girls and their teachers.::Anonymous', 'An animated series based off of the four panel managa of the same name, Azumanga Daioh is a whimsical, hilarious and very cute look at the lives of an ecclectic group of high school girls and their teachers at a Tokyo high school. As the series progresses, small bits of their lives are shown, slowly painting a bigger picture as the cast shares the ups and downs of high school life, revolving around a close-knit friendship and a lot of silliness.::Anonymous', 'Azumanga Daioh, based on the 4-panel manga of the same name by Kiyohiko Azuma, is a charming and funny series that focuses on a group of girls - each with their own distinct personalities - at a high school in Japan. There\'s Chiyo, the adorable 10-year-old prodigy; Sakaki, the quiet girl who loves cute things but has trouble with a particularly vicious kitty; Tomo, the loud and energetic but untalented one; Kagura, a competitive and athletic girl; Yomi, the relatively level-headed member of the group; Kaorin, a shy girl with an unusual admiration for Sakaki; and Ayumu, a.k.a. ""Osaka"", a kind girl who just happens to always have her head in the clouds. The series also pays attention to a group of teachers at the school: Yukari, the English teacher with some rather juvenile tendencies; Minamo, Yukari\'s longtime friend/rival who teaches physical education; and Mr. Kimura, a creepy-looking, slack-jawed classic literature teacher who\'s not afraid to admit that he only became a teacher because he has a fetish for high school girls.::Anonymous'"
6524,Digimon Adventure tri. 2: Bestimmung,"Animation,Action,Adventure,Fantasy,Sci-Fi",movie,1,5.44,88.0,"""The DigiDestined go to a nearby hot springs theme park and everyone has a good time, but Joe doesn't show up because he wants to study for his exams. Another infected Digimon, Ogremon, attacks Odaiba. Gomamon runs away from home while Mimi faces problems with the other DigiDestined and her classmates because of her selfish ideas. Would Joe accept his responsibilities as a DigiDestined before it's too late?::Rahspot"""
30121,Bad Police,Action,tv series,0,4.0,40.0,'A story about a bad cop standing up to an even worse society.'
16908,Rin Rin Kangeki! Panda-kun Chi!/Pengin-san no Kokuhaku,"Animation,Comedy",tv series,102,5.83,97.0,
338,Syupeo Taegwon V,"Action,Mecha,Sci-Fi",tv series,40,8.4,32188.0,"'After graduating from university, twenty something year-olds Meg, her cousin Bunny and their friend Laura share a flat and face the ups and downs of love and life.'"
8366,Maria kyousoukyoku,Drama,movie,1,6.88,973.0,
34119,Nick News: Nick's Big Green Challenge,News,movie,1,3.33,37.0,'10 children set out to get things changed which are threatening climate change for our planet. Presented by David De Rothschild'
5212,Shinryaku! Ika Musume: Kore ga Umi e no Ai Jana-ika!,Music,movie,2,6.34,2863.0,
5019,Cafe de Oni,Music,movie,1,7.27,2338.0,"'The film is about 4 high school seniors, who race on the mountain roads at night in order to refine their motorcycle skills build up their skill in an attempt to become professional motorcycle racers.'"
9304,Karo & Piyobupt: A House,"Animation,Short",movie,1,4.94,172.0,"'One day in winter, two birds were flying to the snow field. They found a fine big tree and decided to build their house on it. Carrying logs, cutting them, putting together, finally a lovely house was completed.'"
7305,Yoiko no tomodachi shakkin shitsuji banzai!,"Animation,Action,Comedy,Crime,Drama,Romance",tv series,1,7.85,4069.0,
842,Hikenai Guitar wo Hikundaze,Music,movie,10,7.23,6086.0,"'The film is about 4 high school seniors, who race on the mountain roads at night in order to refine their motorcycle skills build up their skill in an attempt to become professional motorcycle racers.'"
5321,Tomo ka teki ka? Tekken mahha panchi no otoko arawaru sono na wa J,"Animation,Action",tv series,2,6.43,1958.0,
1117,Kuro,"Drama,Mystery",movie,1,7.46,78876.0,'A Japanese woman living in Paris with her paraplegic lover reminisces about their time together in Japan.'
9087,Planetes Picture Drama,"Comedy,Sci-Fi,Space",movie,2,6.02,860.0,"'A young girl is plucked from small-town obscurity and thrust into the spotlight of the glamorous world of super-models.::Anonymous', 'A sports photographer in rural Canada sends a picture of a high school athlete, Tina Menzhal, to a Montréal fashion agency. This starts Tina on a career taking her from Canada to Paris to Montréal again, to Manhattan, to the world, and then home, through two boyfriends, two husbands, and innumerable TV interviews, either with nasty smiling scandalmongers or with gushing witless twits. In nearly every case, Tina never gets to finish a sentence. She has a suave agent, paparazzi are everywhere (""What the celebs forget, there\'s always a camera,"" says one), and a documentary filmmaker is on hand as well. What is it that Tina thinks, feels, and wants: will we ever find out?::<jhailey@hotmail.com>'"
6328,Miss Monochrome: The Animation 2,"Comedy,Music,SliceofLife",tv series,1,5.55,1375.0,
29770,Sei Brunehilde Gakuen Shoujo Kishidan to Junpaku no Panty The Animation,Hentai,tv series,1,5.97,247.0,"'As the skies of Metro City fill with giant mechs, Astro, a robot with human emotions and fueled by jet-powered legs, arrives in a blaze of glory to defend all that is good.'"
1141,High School Fleet,"Animation,Action,Drama,Sci-Fi",tv series,1,6.62,3462.0,"'15 year old girl Misaki Akeno aspire to become a Blue Mermaid, a group of women trained to operate navy warships for the purpose of international peace and handling maritime disaster. She attended Yokosuka girls High school where she became the captain of the Harekaze with her classmates as her crew. Unfortunately, they became fugitive for have mutinied which makes them to be hunted by the authorities although their mutiny are more than meets the eye.'"
1579,Hiromi Iwasaki: Egao,"Animation,Short,Music",movie,25,7.69,63134.0,'A short music video about a girl and her pet hamster.'
3385,Denkou Chou Tokkyuu Hikarian,"Action,Adventure,Kids",movie,3,6.37,2049.0,'Nobita with Doraemon and others fight a robot army to save earth for alien invasion.::mahade047'
3329,Spy gekimetsu,"Animation,Short",movie,5,6.27,1539.0,
29539,Mamoru-kun ni Megami no Shukufuku wo!,"Comedy,Romance,School",movie,1,6.8,60.0,'The scientist cyborg girl Kuze Airi and her friend the busty half-dog girl Hizuki Ayana go to extremes with the power of science.'
12341,Choukou Sennin Haruka,"Hentai,Yuri",movie,4,3.64,115.0,"'The mahjong club at the girl school is determined to win the national tournament. Following the TV serial where the club members win the tournament, the five students compete to reach the semi-finals here. The main character Shizuno played mahjong at grade school and hopes to reunite with her close friends of those years.::aghaemi'"
1669,Sazae-san: Dawn to Ikka de Hawaii Ryokou,"Comedy,SliceofLife",movie,51,6.77,27959.0,"'A comedic tale about peer pressure, falling in love and the trials and errors of dating.::Anonymous', ""Max Burns and his friends Dean and Tom make a bet who can kiss the better looking girl on Saturday night. Max seeks a stereotype trophy blonde and along the way befriends a barista, Allison a plain-jane artist. Max and Allison's budding friendship shows promise, but, peer pressure, hijinxs and a bet winning mystery woman put Max in a compromising position.::David Katz"""
32748,Konchuu Monogatari Mitsubachi Hutch: Yuuki no Melody,"Adventure,Comedy,Drama",movie,1,6.07,86.0,"'Over the course of one evening, an unsuspecting group of twenty-somethings find themselves bombarded by a series of natural disasters and catastrophic events.::IMDb Editors', 'Will, Lisa, and two of their friends attempt to flee man-made and natural disasters and encounter Batman, Hancock, The Hulk, Indiana Jones, Hannah Montana, Michael Jackson, Beowulf, the Love Guru, Iron Man, rabid chipmunks amongst others in their seemingly vain efforts to seek help and shelter from unknown threats.::rAjOo (gunwanti@hotmail.com)'"
116,Demon Busters: Ecchi na Ecchi na Demon Taiji The Animation,"Demons,Harem,Hentai,School,Supernatural",movie,26,7.1,9289.0,
528,Kick Off 2,Sport,tv series,1,7.66,100089.0,
11531,Love es M The Animation,Hentai,tv series,1,7.74,23340.0,"'An anthology series centering on different characters and locations, including a house with a murderous past, an insane asylum, a witch coven, a freak show, a hotel, a possessed farmhouse, a cult, and the apocalypse.', 'Both physical and psychological horrors affect a decomposing family, workers and residents of an insane asylum, a coven of witches, a cast of circus freaks, the employees and guests at a struggling hotel, a family who moved into a mysterious farmhouse, and the members of a small suburb in Michigan in this haunting anthology series, focusing on the themes of infidelity, sanity, oppression, discrimination, addiction, and exploitation.', 'American Horror Story is a horror series in which every season tells a different story. The first season is about a haunted house, and the family that has moved into it. The second season centres around an insane asylum and a man who is wrongly accused of murdering several women, including his wife. The third season tells the story of a coven of witches trying to figure out who their new ""supreme"" is. The fourth season is about a ""Freak Show"" and the lives of its performers. The fifth season is about the employees and guests at the Hotel Cortez, a building made as a secret torture chamber in the 1920s. The sixth season is about a farmhouse near Roanoke, North Carolina that is besieged by the ghosts of the infamous lost colonists and other strange happenings.::Erica Adina Amaral', 'American Horror Story is an horror television anthology series. Each season is conceived as a self-contained miniseries, following a disparate set of characters and settings, and a story-line with its own beginning, middle, and end. While some actors appear for more than one year, they usually play completely different roles in each season.::ahmetkozan', 'A house haunted by murderous spirits, a catholic insane asylum from the 60s, a coven of witches, a freak show starring some truly twisted characters, a hotel filled with serial killers run by a vampire countess, an isolated haunted shack that may hold the secrets to the disappearance of the Roanoke colony, a cult on the rise after the 2016 Presidential election and an outpost that hides the few survivors of the apocalypse. Every new season comes all new, wholly American terrors in this interconnected modern horror anthology series.'"
21493,Kana Kana Kazoku Shorts: Naru Haya Kakusan Kibou,Comedy,tv series,1,5.88,116.0,"""With aims to one day reach out into the stars, humanity has colonized all the planets of the solar system. This story of young high school hopefuls is set in Fourth Tokyo in a Japanese Martian prefecture. Iris Shirasaki is a third year student/aspiring test pilot. Mizuki Sera is her peer/mechanic and Mizuki's brother Kaito is their homeroom teacher and the young director of the program developing their talents.::Crunchyroll"""
6381,Osamu Tezuka Story: I am Son-Goku,Animation,movie,12,7.43,51114.0,
33262,Kinnikuman: Ubawareta champion belt,Animation,movie,52,4.5,63.0,
1260,Shinichi Hoshi's Short Shorts,Animation,tv series,1,7.07,8217.0,
5644,Fairy Tail Movie 1: Houou no Miko - Hajimari no Asa,"Fantasy,Magic,Shounen",tv series,2,6.86,1771.0,
10819,Pokemon: Pikachu Koori no Daibouken,"Adventure,Comedy,Fantasy,Kids",tv series,1,7.13,2077.0,
376,Final Fantasy VII: Advent Children,"Animation,Action,Adventure,Fantasy,Sci-Fi,Thriller",movie,1,7.34,116129.0,"""An ex-mercenary is forced out of isolation when three mysterious men kidnap and brainwash the city's children afflicted with the Geostigma disease.::Sean"", 'Two years after the events in ""Final Fantasy VII"", a disease called \'Seikon-Shoukougun\', or \'Geostigma\', is spreading through the planet. This disease is believed to have been caused by the body fighting off foreign material that invaded the body two years earlier, at the end of ""Final Fantasy VII"". Guilt-ridden and haunted by his past, ex-SOLDIER Cloud Strife has decided to live a secluded, solitary life away from his friends while maintaining ""Strife\'s Delivery Service"", whose headquarters is located in Tifa Lockheart\'s bar, the Seventh Heaven. Tifa\'s bar serves as an orphanage for children stricken with Geostigma. Here, Tifa keeps an eye on Barret\'s six-year-old daughter, Marlene, while Barret searches the planet for an alternative energy source to the Planet\'s energy, Mako. One day, Cloud receives a phone call from the former Shinra, Inc. president, Rufus, asking him for protection from a mysterious man named Kadaj. Kadaj, in the meantime, along with his brothers Loz and Yazoo, are searching for their ""mother"", and seem to believe that Cloud knows where to find her. Meanwhile, Vincent Valentine has been wandering the planet gathering information on Kadaj\'s scheme, and Cloud and his friends must come together again to fight these new enemies.::Andrea', 'Two years after ""Final Fantasy 7"", life seems to have returned to a state of normality after Sephiroth\'s attempts at mass genocide and the danger of Meteor. On the edge of the ruins of the metropolis Midgar, a new city has thrived, called the Edge and at it\'s center lies a monument that entails no one will forget Meteor and the ones who died. Cloud Strife, the hero who defeated Sephiroth, is a delivery boy now, no longer interested in fighting wars or leading rebellions. The world is at peace, and AVALANCHE is gone it\'s separate ways. Tifa Lockheart has reopened the new 7th Heaven, in the Edge, looking after Marlene and other orphans, including Denzel. Barret Wallace is working with the WRO in finding new energy sources to supply the world now that Mako is no longer used. Cid Highwind is also working with the WRO, as an airship pilot and leader of their air fleet. Reeve (and Cait Sith) is now heading the WRO and working, striving, to create a better world for all. Vincent Valentine has returned to solace, switching his places between his mansion home in Nibleheim and the Sleeping Forest, and the Forgotten City. Yuffie Kirisagi is back in Wutai, though what the Ninja is doing is unknown to all. But despite this lull in adventure, there is something that is striving the world. Geostigma, the Sephiroth, JENOVA\'s memetic legacy. A disease that counters the body\'s own defence system in on itself and causes it to destroy itself. Rufus ShinRa, ex-President of Midgar, is a sufferer of the disease, along with the ex-SOLDIER Cloud, and lives now in his hide-away home the Healin Lodge with his faithful bodyguards, the Turks. But who are the mysterious silver haired band, known as Kadaj\'s Gang? Kadaj, Loz and Yazoo, all of silver hair and teal eyes. Who are these strange people, who appear so much like Sephiroth?::Olek Tamarani'"
2586,Munto: Toki no Kabe wo Koete,"Action,Fantasy,Magic,SuperPower",movie,5,7.17,1761.0,"'A beautiful but amoral model sleeps her way to the top of the London fashion scene at the height of the Swinging Sixties.::Rick Ferncase <ferncase@chapman.edu>', 'Young, attractive and vivacious, model Diana Scott is firmly decided to become rich and famous as well. To succeed, she does not hesitate to take bold steps. After a while, she literally strikes gold: she meets Robert Gold, a well-known TV journalist, who not only introduces her into new social and professional circles, but also abandons his family to live with her. Diana seems to have happily combined success and love. However, in those roaring sixties, others are ready to offer her even more money, fame, and, seemingly, fun than Robert can...::Eduardo Casais <casaise@acm.org>', 'Twenty-something Italian Princess della Romita, better known to her British fans as Sussex born Diana Scott, is giving an interview to a reporter in which she describes her life. She is straightforward about the facts. She worked as a London based model, her most famous job being as the Honeyglow girl, and had a moderately successful stint as an actress in small roles both on film and in commercials. She married her first husband Tony Bridges when they were both quite young, but she left him when she fell into an unplanned relationship with television journalist Robert Gold, who was at the time married himself with a family. Although she and Robert never married, they lived together for some time. She and Robert split after she fell into an unplanned relationship with advertising executive Miles Brand, who was the one who discovered her as the Honeyglow girl. She met her current husband, the Prince Cesare della Romita while she was working and vacationing in Italy. But behind these facts, she is less than forthright about her emotions in each of these moves, and the motivations for them. If she was forthright, she would expose herself as the vain and self-centered person she is, who was most understood by Miles, but who Robert began to understand, albeit too late.::Huggo', 'Beautiful but easily bored Diana Scott becomes a popular model and actress in London in the 1960s while toying with the affections of two older men, married television newsman Robert Gold and public relations mastermind Miles Brand. Although Diana is the toast of swinging London, the dark side of fame and fortune begins to take its toll, but it proves harder to escape the mod scene than she expects.::Jwelch5742', ""Diana Scott is a young London model who decides to climb the social ladder quickly by jumping, rather fecklessly, in and out of assorted beds. She is a reckless seeker of self caught up in a frenzied sexcursion of jet-set Europe, in search of new experiences and finding emptiness at every level. Sardonically comic observations on various forms of self-indulgence among the wealthy emphasize the false values which have destroyed Diana's chance of genuine self-fulfillment.::alfiehitchie"""
3982,Five Star Stories,"Animation,Action,Fantasy,Romance,Sci-Fi",movie,3,5.94,694.0,"'The Joker five-star system is under Emperor Amaterasu. Mecha pilot Ladios must save his co-pilot, Fatima-class female android Lachesis, from one of many warlords, who oppose Amaterasu.'"
597,Astro Boy,"Action,Adventure,Mystery,Sci-Fi",tv series,1,7.98,92499.0,"'As the skies of Metro City fill with giant mechs, Astro, a robot with human emotions and fueled by jet-powered legs, arrives in a blaze of glory to defend all that is good.'"
2619,Shousei Shikisai Gensou,Music,tv series,26,6.76,3605.0,
9388,Zombie Clay Animation: Life of the Dead,"Comedy,Horror",tv series,1,6.07,123.0,
28591,47 Todoufuken Specials,"Comedy,Kids,Romance",tv series,26,3.98,188.0,"""Yuji disappeared the fateful night he was supposed to choose between a life combating evil by Shana's side or as a normal teenager. He returns from near-death to lead the Crimson Denizens in a dubious plot to bring peace to the universe, but Shana isn't fooled. In an explosive reunion, the fiery warrior faces her unlikeliest of foes while Flame Hazes from across the world join forces to ignite a war that will determine the fate of all supernatural kind."""
11561,Ikkitousen: Great Guardians Specials,"Comedy,Ecchi",movie,1,6.3,406.0,"'Rafal takes care of his dysfunctional carefree mother who is more interested in men, pills and alcohol than in the problems of her young yet very mature son.::kinoholik'"
23661,Kataribe Shoujo Honoka,"SliceofLife,Supernatural",movie,1,6.61,148.0,'The movie is about a girl named Hiromi Nozawa and her dog Junkers. Hiromi is having troubles at home mainly because her parents wanting to separate. Junkers tries to comfort her in ways no other dog can. He can talk and grant her 3 wishes.::anonymous'
8574,Kasimasi: Girl Meets Girl,"Animation,Comedy,Fantasy,Romance,Sci-Fi",tv series,2,5.11,303.0,"'After being rejected by the girl he loves, Hazumu goes to the mountains to console himself. A crashing alien spaceship lands on him. The aliens regenerate his body. However, they could only make him into a girl.::ley-moon'"
2162,DC I&amp II PSP Re-Animated,"Drama,Harem,Magic,Romance",tv series,25,6.41,6544.0,"'Follow the journey of a mysterious girl, as she must complete her given task to fulfill her wish. To obtain her wish she must pass the test within four seasons.'"
8609,Red Garden,"Animation,Drama,Horror,Mystery,Thriller",tv series,1,7.95,7757.0,"'Kate, Claire, Rose, and Rachel once explored the streets of New York with the promise of limitless futures unfolding before them. But now, murdered and resurrected as killers, they must hunt demonic beasts no ordinary weapon can destroy.'"
13439,terebisuta degojaruyono hanashi/puroresura degojaruyono hanashi,,tv series,1,5.37,1100.0,
12455,Naruto: Shippuuden Movie 4 - The Lost Tower,"Action,Comedy,MartialArts,Shounen,SuperPower",tv series,4,6.81,3670.0,
2486,Zou no Senaka: Tabidatsu Hi,"Drama,Seinen,SliceofLife",tv series,13,7.39,3420.0,"'Chuuta Kokonose has been hearing voices in his head since childhood. One day, he gets taken and transported to a space police station, filled with mysterious creatures and given a test, to check his ability to become a member of eLDLIVE.'"
5941,Idol Incidents,Music,tv series,50,8.53,53108.0,"'The increase in income disparity, progressive environmental pollution, unresolved waste problems, waiting lists for child care, corruption continues. The government, stained by personal interests, does not can do nothing against the many problems. In this situation, with Japan cornered, the idols rise to save the day. The Heroine Party, Sunlight Party, Starlight Party, Bishoujo Party, Wakaba Party, New Subculture Party, and SOS Party, of these seven idol political parties, the idols that have become members of the legislature and representatives of each prefecture, will break the stalemate that covers Japan, using the power of song and dance. They will bring back the smiling faces of the people, and they will envelop Japan in a bright aura.'"
22975,Hikiko: urban legend story,"Animation,Short,Horror",movie,1,5.88,93.0,
3414,Go Go Toraemon,"Comedy,Sports",movie,78,6.09,168.0,"'During the course of one day, a group of students at a school in Los Angeles find themselves caught up in a plot of sex, lies and dead bodies.::Anonymous'"
24231,Sangokushi Daiichibu Eiyuu-tachi no Yoake,Historical,movie,10,7.33,91049.0,
6566,Oz no Mahoutsukai no Koutsuu Anzen no Tabi,"Drama,Fantasy,Kids",movie,1,7.05,2087.0,"'The artificial sun that lights the frozen planet La Metalle is dying, threatening to extinguish what little life is left there.::Sinedd'"
974,Super Short Comics,"Comedy,Parody",movie,1,7.28,40717.0,"""When Natsumi's father dies she return to the forest which she had visited with him with his motorcycle. She meets and decides to stay with a family who also own a store nearby.::aghaemi"""
1763,Shikabane Hime: Puchitto,Comedy,tv series,2,5.84,1144.0,"""After Araragi Koyomi graduated from high school, Kanbaru Suruga feels lonely because there's no one to talk about Oddities anymore. One day, she heard a rumor about Mr. Devil, who can realize people's wishes. She comes to meet that person, but it turns out to be Numachi Rouka - an old basketball rival of her. What can Kanbaru do to help Numachi?"""
34148,Nodame Cantabile Special,"Comedy,Josei,Romance,SliceofLife",tv series,0,0.0,1335.0,"'As the skies of Metro City fill with giant mechs, Astro, a robot with human emotions and fueled by jet-powered legs, arrives in a blaze of glory to defend all that is good.'"
11521,Doll Saaya,Hentai,tv series,13,5.84,201.0,
9325,Yûwaku Count Down: Kagami Akira,"Animation,Drama,Romance",movie,2,6.0,543.0,"""Akira is beautiful-so much so that he can have any girl...or guy that he lays eyes on. Unfortunately, the only woman he has ever wanted is the one woman he could never have-his own sister. When he first met Kaname-innocent to the ways of the world-his own world slowly began to change. The realization of the reality that his sister can never be his and that he can never find true comfort in her arms devastates him. There, from the depths of his despair, he finds salvation in Kaname's loving embrace.::animenewsnetwork.com"""
317,Shijou Saikyou no Deshi Kenichi OVA,"Action,Comedy,MartialArts,School,Shounen",movie,1,7.94,138659.0,"'Set of rapid telescopic images of a gym, in fast forward, traveling through itself, space and time.::Alp'"
28221,Ucchare Goshogawara,"MartialArts,School,Shounen,Sports",movie,12,7.04,36463.0,"'During the course of one day, a group of students at a school in Los Angeles find themselves caught up in a plot of sex, lies and dead bodies.::Anonymous'"
1088,SF Saiyuuki Starzinger (Movie),"Adventure,Mecha,Sci-Fi,Shounen",movie,36,8.07,44157.0,
1792,Eikou e no Spur: Igaya Chiharu Monogatari,"Drama,Historical,Sports",tv series,26,7.0,6551.0,"'After passing her entrance exam, Yuno enrolls at Yamabuki High School as part of an art degree. She stays at the Hidamari Apartments along with best friend Miyako, and seniors Hiro and Sae.'"
9130,Legend of the Moles: The Treasure of Scylla,"Animation,Adventure",movie,13,8.36,27532.0,"""The story of the happy, brave and peace-loving moles defeating evils and protecting their home continues. This time they have to protect the secret treasure of the mysterious sirens. They venture onto the ocean to stop the evil magician Kula from destroying all children's dreams.::Anonymous"""
