anime_id,name,genre,type,episodes,rating,members,overview
12711,Animal Sumo,"Animation,Short",movie,13,7.53,66671.72367839939,"'A monkey participates in a tournament of sumo fighting a pelican, a rabbit, a goat, a pig and a bear.'"
10346,Die Liebhaber meiner Mutter,Drama,movie,6,6.96,-18048.64813102943,"'Rafal takes care of his dysfunctional carefree mother who is more interested in men, pills and alcohol than in the problems of her young yet very mature son.::kinoholik'"
8149,Midoriyama Koukou Koushien-hen (Movie),"Comedy,School,Sports",movie,1,6.37,1281.013941230769,"'The story revolves around a race that seeks to dominate the galaxy. A lone mysterious female warrior, known to others as Emeraldas sails the endless planets of the universe- in her Seas of Star ship- fighting the tyranny of that merciless race. She is tormented by the memory of her lost love.::Sinedd'"
2779,Tanaka-kun wa Kyou mo Kedaruge,Comedy,tv series,2,5.68,2613.7067897761576,
9548,Kaitouranma The Animation,"Action,Adventure,MartialArts,Samurai",movie,1,6.67,-2391.4463058644933,"'This story involves the shopkeeper Suzuri of Kokumondou who sells historic books and Mizuki, granddaughter of the land owner. When Mizuki releases a somewhat cute young spider demon out of a sealed book, the pair investigate the origins behind it::bbcgjg'"
20113,Mokke,"Animation,Comedy,Drama,Fantasy,Horror,Mystery",tv series,1,4.74,-8879.484573108453,
498,Sonic X,"Animation,Action,Adventure,Comedy,Drama,Family,Fantasy,Sci-Fi,Thriller",tv series,3,6.27,-4930.547617119794,"'A slight malfunction causes Chaos Control, and sends Sonic the Hedgehog to Earth. While there, Sonic meets Chris Thorndyke, who aids at collecting the Chaos Emeralds, so Sonic and friends can go home.::sheldonandres'"
3070,Kamakura kibun,Drama,movie,1,5.7,-3284.422878178778,
21821,Aoki Honô,"Animation,Drama,Romance",movie,12,5.82,20498.977301899802,"'The story of Ryuuichi a man trying to get ahead in life, and make a name for for himself, along the way he meets (and sleeps with) many women. Based a manga by Kimio Yanagisawa.::Shadowjac'"
8285,Seikon no Qwaser Picture Drama,Ecchi,movie,22,7.05,2841.3087439219557,
430,Ojamanga Yamada-kun,"Animation,Comedy,Family",tv series,1,7.74,184874.5420268004,
29491,My Neighbor Totoro,"Animation,Family,Fantasy",movie,1,5.0,13035.953243622225,"'When two girls move to the country to be near their ailing mother, they have adventures with the wondrous forest spirits who live nearby.::Kenneth Chisholm', 'Two young girls, 10-year-old Satsuki and her 4-year-old sister Mei, move into a house in the country with their father to be closer to their hospitalized mother. Satsuki and Mei discover that the nearby forest is inhabited by magical creatures called Totoros (pronounced toe-toe-ro). They soon befriend these Totoros, and have several magical adventures.::Christopher E. Meadows <cmeadows@nyx.cs.du.edu>'"
22563,"Violence Jack, Part 3: Hell's Wind","Animation,Action,Drama",tv series,1,5.91,2343.3098910535577,"'The survivors of Kanto\'s Hell Earthquake built a new city and christened it ""Hope Town"". However, this peaceful town becomes a nightmare when it\'s raided by the motorcycle gang, ""Hell\'s Wind"". They abduct the women while the remaining townsfolk are left helpless against them. Meanwhile, a boy, Saburo, meets Jun. Jun\'s lover was previously murdered, and the duo help one another to fight against Hell\'s Wind. The battles are getting more and more difficult, but with the appearance of Violence Jack, the citizens seem to gain the upper hand against Hell\'s Wind.'"
31517,The Legend of Snow White,,tv series,475,5.5,7049.511720922709,
24847,Karo & Piyobupt: Imagination,"Animation,Short",movie,1,5.0,-2623.348147664266,"'Karo was hurrying to his house on a rainy day. Then he met a fish swimming in the air. He talked about the fish to Piyobupt but he laughed at Karo. So they started to imagine. And outside of the window, flying fishes were enjoying the rain.'"
22535,Kitten's Studio,"Animation,Short",movie,24,8.59,428160.3757811101,"'The kitten from Yasuji Mori\'s earlier ""Koneko no Rakugai"" returns, this time putting his talents toward directing a samurai film starring his mouse friends.'"
9163,Muumindani no Suisei,"Adventure,Comedy,Fantasy,Kids",movie,1,6.45,4288.350233502684,"'Lena is a lonely, plump adolescent girl. Much to her surprise she gets a relationship with the popular but unreliable Daan. Lena moves in with Daan and his strange father Tom and is willing to do a lot for his love. More than a lot.::Isabella Films'"
28647,Jibun no Mune ni te wo Atete,"Drama,Kids",tv series,1,4.71,12775.570854315189,
28755,Robot Girls Z Specials,"Comedy,Mecha,Parody",movie,1,8.03,80113.17422062327,"'Biographical account of singer and composer Cornelis Vreeswijk including his breakthrough and his marital problems.::Mattias Thuresson', ""Cornelis is the unique chronicle about one of Sweden's greatest music legends - Cornelis Vreeswijk. An honest and gripping account of an exceptionally talented, but self-destructive artist's intense life both on and behind the stage. A man who during his whole life was searching for love and confirmation.::SF International"", ""In 1964, Cornelis Vreeswijk, a 27 year old mental care student, attends a party where he performs a song he has written. One of the guests is the artist Fred Åkerström who brings Cornelis with him to a record company, Metronome. The company is immediately attracted to his songs and soon after Cornelis' first album is released. He becomes a national sensation, frequently on tour and recording new albums. But his successful career with staying away from home, excessive drinking and his stint in prison puts a strain on his marriage.::Mattias Thuresson"""
29910,Two Down Full Base,"Kids,Sports",tv series,1,6.91,4121.977728722339,"'Common people discover that they have super powers. Their lives intertwine as a devastating event must be prevented.', 'People all over the U.S start to realize they have special abilities, like telekinesis, healing abilities, flying powers, time travel, invisibility, and the ability to absorb other\'s abilities. One man, known as Sylar, wants to gain all the power of these ""heroes"" so he can be the most powerful and evolved human of all, and stops at nothing to gruesomely kill these people. In order to protect themselves from him, these people must help one another before Sylar can destroy them all, while they each deal with problems of their own.::Patrick Ozzy Lauzier', 'It starts with ""Save the Cheerleader, Save the World,"" but soon spirals into a never ending battle for right and wrong, life and death. As people across the U.S. discover and use their special abilities in this NBC hit series, their world and lives are turned upside down as a serial killer named Sylar tries to hunt them all and make sure no one becomes as powerful as him. But it\'s not so simple. Sylar isn\'t in control of his hunger for power. Nobody knows when he will strike, or change, or strengthen. Unpredictable is this new world of heroes. And as time goes by, they each learn what the can do for the world. And it\'s not always good.::cippy-cp'"
7468,Strike Witches,"Animation,Action,Comedy,Fantasy,Sci-Fi",tv series,6,6.27,3474.2849239873835,"'The story takes place in year 1944 and the world lives in fear of unidentified flying objects called neuroi. A young heroine Named Yoshika miyafuji joins the 501st joint wing, known as the strike witches to fight and defeat the neuroi so that way she can protect the world.'"
4101,Miboujin: Numeriau Nikuyoku to Midara ni Nureru Mitsusubo,Hentai,tv series,51,6.81,8830.156146666875,
18085,Ponsuke no udekurabe,"Animation,Short",movie,1,6.26,10127.969560650872,
19391,Oni Chichi: Refresh♥,Hentai,tv series,9,6.81,30301.34392299169,
6437,Toppuku Kyousou Kyoku,"Comedy,Shounen",tv series,9,6.38,7586.420924208346,"""Now there's no need to wait for individual volumes - you can get the entire epic all at once! Narue is an adorable school girl with a secret. She's really an alien with powers right out of a sci-fi comic book. Join our spunky heroine as she faces androids, alien invaders, and her first date with the boy next door. It's the sci-fi comedy that's a direct hit to your heart.::CPM"""
2687,Wie der Wind sich hebt,"Animation,Biography,Drama,History,Romance,War",movie,39,6.53,-5265.9645474115005,"'A look at the life of Jiro Horikoshi, the man who designed Japanese fighter planes during World War II.::Anonymous', ""Jiro dreams of flying and designing beautiful airplanes, inspired by the famous Italian aeronautical designer Caproni. Nearsighted from a young age and unable to be a pilot, Jiro joins a major Japanese engineering company in 1927 and becomes one of the world's most innovative and accomplished airplane designers. The film chronicles much of his life, depicting key historical events, including the Great Kanto Earthquake of 1923, the Great Depression, the tuberculosis epidemic and Japan's plunge into war. Jiro meets and falls in love with Nahoko, and grows and cherishes his friendship with his colleague Honjo.::Official site"", ""An aviation-obsessed engineer named Jirô Horikoshi (Hideaki Anno) has loved the aesthetics, spirit, and science of flight for as long as he can remember. For years he's been designing and building his dream plane, the Mitsubishi A6M Zero, and it's finally completed. But Jiro's dreams come crashing down when he learns, to his horror, that his creation will be used for combat in World War II.."""
3153,Shikatte Ingo: Misaki Shunin no Buka Kyouiku-hen,Hentai,tv series,1,6.54,8369.30985738233,"'The series follows an epidemic that breaks out in Atlanta, leaving the large city quarantined and those stuck on the inside fighting for their lives. The drama tells the story of loved ones torn apart, and how the society that grows inside the cordon reveals both the devolution of humanity and the birth of unlikely heroes.::Patricia Peña Hdez.'"
2112,Kero Kero Keroppi no Christmas Eve no Okurimono,"Fantasy,Kids",movie,26,7.78,13978.774994274358,"""A 'movie' version of several Gatchaman episodes."""
2803,Onmyouji: Youen Emaki,"Demons,Hentai",movie,46,7.34,311.90806014447526,"'A follow up to the television series ""Kimagure Orange Road"" that wraps up loose ends. Kyosuke must deal with the fact that his, Hikaru and Madoka\'s friendship is falling apart.::Anonymous'"
7334,Heisei Inu Monogatari Bow,"Animation,Comedy",tv series,39,6.32,19382.646582856876,
22583,3x3 Eyes,"Animation,Fantasy,Horror,Romance",tv series,1,7.22,4230.233712252831,"""A demon girl's quest to become human, with the help of an unwitting boy named Yakumo.::Anonymous"", 'Pai, a demon in the form of a young, naive girl, is on a quest to become human with the Statue of Humanity. Yakumo, as a favor to his departed father, leaves his job as a waiter to help her. Along the way they must battle with mysterious forces who wish to use the Statue for their own purposes.::Anonymous'"
1807,Senran Kagura: Estival Versus - Shoujo-tachi no Sentaku,"Action,Comedy,Ecchi",tv series,12,6.6,14.079677109439217,
3384,Abe George Kattobi Seishun Ki: Shibuya Honky Tonk,"Drama,Ecchi",tv series,3,5.88,-8220.555911772339,'A defunct high school basketball team finds a new student and things may start looking up for them.'
953,Choco Taco,Comedy,tv series,11,7.41,33268.469521644045,
1712,Etsuraku no Tane The Animation,Hentai,movie,13,5.88,-2115.558200513855,"""Dr. Raichi, a survivor of the Tuffle race that was eliminated from Planet Vegeta by the Saiyans, is trying to take revenge on the surviving Saiyans by killing them and Earth's population. Goku, Gohan, Piccolo, Trunks, and Vegeta must find and destroy generators emitting deadly Destron Gas before all life on Earth is extinguished, then find Raichi and stop him.::page8701"""
9106,Grimm Masterpiece Theatre,"Animation,Family,Fantasy",tv series,26,6.42,10335.961465078466,'An animated series retelling a different folk or fairy tale in each episode.::Nick J. Phillips'
8523,Katte ni Kaizou Specials,"Comedy,Parody,School,Sci-Fi,Shounen",movie,3,5.77,748.1729622009661,
28545,Shingeki no Kyojin Movie 1: Guren no Yumiya,"Action,Drama,Fantasy,Shounen,SuperPower",movie,1,5.67,8842.640878632512,"'The movie will compile the episodes from the second season of the anime, and will also have new cuts of animation.::myanimelist'"
22689,Battle Athletess Daiundoukai,"Action,Comedy,Ecchi,Sci-Fi,Shounen,Space,Sports",tv series,2,7.27,24747.877548141667,"'Hime, a seemingly normal girl, has her life forever changed when she witnesses the birth of an antibody (a type of mecha) and becomes its pilot. A new life full of danger, excitement, and intrigue awaits. But is that what she wants?::Anonymous'"
2521,Jikuu Tantei Genshi-kun,"Adventure,Comedy,Fantasy,Mystery,Sci-Fi,Shounen",tv series,13,5.52,3153.1782363161096,
1628,Oz,"Crime,Drama,Thriller",tv series,13,6.31,-8470.948756059875,"'A series chronicling the daily activities of an unusual prison facility and its criminal inhabitants.::MonkeyKingMA', 'OZ chronicles the attempts of McManus (Terry Kinney) to keep control over the inmates of Em(erald) City as well as the drug trade and the violence. There have been many groups of inmates during the run of the show and not everybody makes it out alive. There\'s the gangstas (Adebisi, Wangler, Redding, Poet, Keene, Supreme Allah), Muslims (Said, Arif, Hamid Khan), Italians (Pancamo, Nappa, Schiebetta), bikers (Hoyt), Aryans (Schillinger, Robson, Mark Mack), Christians (Cloutier, Cudney), Latinos (Alvarez, Morales, Guerra, Hernandez), gays (Hanlon, Cramer) and a whole pile of others (the O\'Riley brothers, Keller, Stanislovsky, etc.). And there\'s a great ""everyman"" character called Beecher who gives a good look at a normal man who made one tragic mistake. Besides the regular inmates, there\'s guest stars such as Method Man, Luke Perry, Master P, Treach, etc. and a bunch of prison staff doctors (Dr. Nathan), a nun/psychologist (Sister Peter Marie), a bunch of guards some honest, some crooked and of course the warden Leo Glynn. The whole thing is narrated and held together by inmates Augustus Hill, who provides the show with some context, some sense of theme, etc. and ties everything together really nicely.::LorgSkyegon'"
5733,Eiga Kureyon Shinchan: Otakebe! Kasukabe yasei-oukoku,Animation,movie,1,5.52,6688.790986199951,
33339,"Grendizer, Getter Robo G, Great Mazinger: Decisive Battle! Great Sea Beast","Animation,Short,Action,Adventure,Sci-Fi",movie,63,6.96,12125.21389168946,"'When a mysterious gigantic monster, called Dragosaur, appears from the depth of the oceans and threatens the world, a team of super-robots from Japan is activated and sent out to defeat it: Grendizer, The Great Mazinger and Getter G.::Luigi Marcucci'"
77,JoJo no Kimyou na Bouken: Adventure,"Adventure,Drama,Fantasy,Horror,Shounen,Supernatural,Vampire",movie,13,8.1,41070.96394962627,
5564,Uchuu Senshi Baldios (Movie),"Action,Mecha,Sci-Fi,Space",movie,1,5.27,17395.322266796025,'The rabbits versus the foxes is the big match-up at the baseball stadium.::Richard Dominguez'
20057,Hawaiian Rockn Roll,"Kids,Music",movie,13,7.86,130075.54193529033,"""A nerd gets himself in hot water with the new bully, a quiet bad boy who challenges him to fight on the grounds of their high school after the day's end.::mystic80"", 'A high school nerd, Jerry Mitchell (Siemaszko) is assigned to write a piece for the school paper about new boy Buddy Revell (Tyson), who is rumored to be a psychopathic nutcase. When Jerry accidentally touches Buddy, he says that they must fight in the parking lot at 3pm. Jerry will just about do anything to avoid the confrontation.::Corey Semple (AdamSandlers8SexyNights)'"
839,Pokemon: Pikachu no Kirakira Daisousaku!,"Adventure,Comedy,Fantasy,Kids",tv series,2,6.3,-3029.314986982443,"""2019, Divergence Ratio 1.048596. The near future, where a device popularly called the PokeCom, packaged with PhoneDroid OS, spreads, bringing the Augmented Reality world close to existence. Central Tanegashima High School's Robot Research Club is in danger of losing its club status. Kaito Yashio, one of only two members, is only obsessed with robot fighting games, showing no interest in the Robo Club even in this situation. The reckless, useless club head, Akiho Senomiya, aims to complete a giant robot, struggling hard to avoid losing the club's status. Then, one day, Kaito discovers the A.R. annotation that becomes the Kimijima Report. Written in that report is the indictment of someone named Kou Kimijima's conspiracy involving the world. (Source: VNdb)"""
10790,Usagi-chan de Cue!,"Animation,Short,Action,Comedy,Romance",movie,10,7.78,182378.01356968808,
6802,Precure All Stars Movie: Minna de Utau♪ - Kiseki no Mahou,"Action,Comedy,Fantasy,Magic,Music,Shoujo",tv series,12,7.6,55068.25066802129,"'A demon lord commands his forces from a tower. During the ""Summer of Anu"", they lose their power and human army invades the tower to end their threat. Adventurers who have heard about a priceless treasure hidden in the tower join the fight.::Anonymous'"
29653,Ippatsu Kiki Musume,"Animation,Comedy",tv series,1,4.82,12028.303053447988,"'A young Chinese woman named Kunyan finds herself subjected to a variety of bizarre, life-threatening situations. She must act quickly if she hopes to escape her plight in one piece.::Akira (akira625@comcast.net)'"
13927,Gunslinger Stratos: The Animation - Kikan/Kaze no Yukue,"Action,Sci-Fi",movie,2,6.22,-12778.939553305701,'A homeless wanderer just happens across various articles of clothing that make him resemble Charlie Chaplin much to the amusement of passersby.'
24417,Vampiyan Kids Specials,"Comedy,Fantasy,Kids",tv series,25,6.29,10421.044520314465,
2232,Code Geass: Soubou no Oz Picture Drama,"Action,Drama,Mecha,Military,School,Supernatural",tv series,12,5.13,-13042.226525395863,
34060,Project A-Ko 2: Daitokuji zaibatsu no inbô,"Animation,Comedy,Sci-Fi",movie,0,3.89,13503.588924409834,"""It's summer in Graviton City, and the girls all have a break from school! A-Ko decides to lose a few inches, C-Ko makes a list of all the cool things that she'll buy, and B-Ko vows to get A-Ko out of the way once and for all so that she can have C-Ko to herself. To this end, she designs a new giant mecha, better than all the others. But her father steals her designs and uses them to attack the crashed alien spacecraft (now high-class restaurant) in an attempt to steal the advanced technology of the aliens.::Parsifal-2 <jehrich@macalester.edu>"""
22043,Storm Rider Clash of the Evils,"Animation,Action,Adventure",movie,102,8.25,249246.13463967064,"""When some of the greatest swordsmen in the world are brutally murdered, Wind, Cloud, and the massacre's only survivor, Ngou, battle for a blood that holds powerful gifts."""
25689,Lupin III (2015) Specials,"Action,Adventure,Comedy,Shounen",tv series,2,6.8,18760.406640743084,"""The Seven Deadly Sins were once an active group of knights in the region of Britannia, who disbanded after they supposedly plotted to overthrow the Liones Kingdom. Their supposed defeat came at the hands of the Holy Knights, but rumors continued to persist that they were still alive. Ten years later, the Holy Knights staged a coup d'état and captured the king, becoming the new, tyrannical rulers of the kingdom. The third princess, Elizabeth, then starts out on a journey to find the Seven Deadly Sins and enlist their help in taking back the kingdom.::ForLand Hucy"", ""The Seven Deadly Sins were once a group of knights in the region of Britannia, who disbanded after they supposedly plotted to overthrow the Liones Kingdom. Their supposed defeat came at the hands of the Holy Knights, but rumors continued to persist that they were still alive. Ten years later, the Holy Knights staged a coup d'etat and captured the king, becoming the new, tyrannical rulers of the kingdom. The third princess, Elizabeth, then starts out on a journey to find the Seven Deadly Sins and enlist their help in taking back the kingdom.::Travis Moore"""
25967,Soreike! Anpanman: Tsumikijô no himitsu,Animation,movie,52,6.21,-12968.999459579958,
33118,Shinzou Ningen Casshern,Action,movie,2,6.65,-8562.909450507334,'Pikachu and friends play peek-a-boo.'
21077,Koume-chan ga Iku!,"Comedy,Romance,SliceofLife",tv series,3,6.39,24943.41219533673,
33362,Chuunibyou demo Koi ga Shitai!: Kirameki no Slapstick Noel,"Comedy,School",tv series,0,0.0,13635.153913630867,"'Attending the private school Suzaku High Ryu Yamada is a student completely bored with his surroundings. One day while following the honor student Urara Shiraishi up the stairs falls down on her waking up to have switched bodies by accidentally kissing. Finding out their ability to to swap bodies Toranosuke Miyamura, the student councils president discovers their abilities to go into one and others bodies offering them the abandoned supernatural studies club and clubroom.'"
3392,Ginga Tetsudou 999: Jikuu wo Koeta Energy no Tabi,"Adventure,Drama,Sci-Fi",movie,1,7.59,27848.373472949417,"'Based on a legendary Japanese charismatic comic! ""Oh! Invisible Man"" of the sexy comedy has been miraculously adapted to the screen again! ! Gene of salmon roe has been passed on the daughter from her father, and now both of them have the ability to be invisible... The hilarious comedy has been back!(C)2014 YASUHIRO_NAKANISHI/SHONEN-GAHOSHA/INTERFILM'"
13117,Shachiku: Kuruma no Naka de Kattemasu,Hentai,tv series,1,7.94,22136.34027356741,"'Sato Yo is an ordinary high school boy who likes playing games on his SEGA console. One day when he decided to buy bento for dinner at the local grocery store, he suddenly lost consciousness. When he finally came to, he had no memory of what happened and no idea his life was about to change.::mpasd'"
12877,Shusaku Replay,"Hentai,School",tv series,1,6.26,-5161.154985549994,"""Jeff comes ashore with his family in Tokyo, Japan where they visit a world famous fish market and make perfect sushi hand rolls. Then, they visit the Mt. Fuji area's glittering ice caves before ending their Japanese adventure dressed in kimonos learning a traditional fan dance."""
7583,Ganbare! Kickers Specials,"Drama,Shounen,Sports",tv series,2,6.55,28200.52873702997,
16786,Dirty Pair Flash,"Animation,Short,Action,Comedy,Sci-Fi",tv series,1,3.11,-1073.3955942957998,'Yuri and Kei are given accommodations at an all-girls boarding school from the 20th century. Yuri finds the life as an exchange student a lot of fun.::Anonymous'
1091,RockmanEXE Beast,"Action,Adventure,Game,Mecha,Sci-Fi,Shounen",movie,1,7.56,19889.34760642409,
2072,Alps no Shoujo Heidi,"Drama,Historical,SliceofLife",movie,4,5.99,-2320.257197549154,
4463,Kien: rurou no senshi,"Animation,Action,Adventure,Comedy,Drama,Fantasy",tv series,1,5.33,-4864.4875076215385,
5162,Kodai Ouja Kyouryuu King: Yokuryuu Densetsu,"Action,Adventure,Game,Kids,Sci-Fi",tv series,13,7.65,31744.82495835575,"'Set in the world of Korean entertainment production, the drama series depicts the hopes and dreams of a group of young Korean, Japanese and Thai women as they embark on a career in the entertainment industry.'"
8057,Rouge: Ladys Comic Video,"Drama,Josei,Romance",movie,12,7.15,-8312.235102044702,
34363,Chinpui Specials,Comedy,tv series,13,8.0,-10020.422339105975,"'An intelligent high school student goes on a secret crusade to eliminate criminals from the world after discovering a notebook capable of killing anyone whose name is written into it.::Anonymous', 'After an intelligent yet cynical high school student begins to cleanse the world from evil with the help of a magical notebook that can kill anyone whose name is written on it, international authorities call upon a mysterious detective known as ""L"" to thwart his efforts.::Paleman', 'A battle of wits between a high school student and a mysterious detective known as ""L"" where the student looks to cleanse the world of evil criminals with the help of a supernatural notebook while the detective wants to stop all these killings of criminals.', ""After the smart and brilliant Light Yagami discovers this book, he soons yet to realize it has a secret power. He looks like an average, top of the class, student. But in reality he's way more than that, in his eyes, he's a god. The savor of the earth and will kill anyone who will get in the way."", ""Light Yagami, after finding a book that kills people whose names are written in it, developps a God complex. His own father being the chef of Tokyo police, he fights against the world's best detective, L, to bring the world to his own idea of utopia.::Pel Par"", ""An intelligent high schooler who wants justice in the world and wants to be God of the new world he has created by destroying all evil. He plans on achieving this by using a strange supernatural book that fell from another realm onto earth. He tries to cleanse the world from all darkness but he runs into obstacles with the police and a strange mysterious detective known as 'L'"""
1942,Kero Kero Keroppi no Sanjuushi,"Fantasy,Kids",tv series,12,7.03,-12901.6255839006,"'A teenage girl divides her time between working in London for the famed Belgian sleuth, Hercule Poirot, and staying in the countryside with her shrewd great-aunt, Jane Marple.::L. Hamre', ""1930s England; spirited teenager Mabel West is determined to live her life on her own terms. Her father agrees to let her leave her stuffy boarding school and seek employment in London. In the city, she works as a junior assistant to the famous Belgian detective, Hercule Poirot. Also accompanied by Poirot's assistant Hastings, secretary Miss Lemon, and Inspector Sharpe, the formidable team solve numerous exciting mysteries. However, Mabel does not forget her family and often travels to the countryside to stay with her great-aunt Marple. This shrewd older woman also has a reputation for solving puzzling mysteries.::L. Hamre"""
