anime_id,name,genre,type,episodes,rating,members,overview
5941,Idol Incidents,Music,tv series,50,8.53,47557.02225061547,"'The increase in income disparity, progressive environmental pollution, unresolved waste problems, waiting lists for child care, corruption continues. The government, stained by personal interests, does not can do nothing against the many problems. In this situation, with Japan cornered, the idols rise to save the day. The Heroine Party, Sunlight Party, Starlight Party, Bishoujo Party, Wakaba Party, New Subculture Party, and SOS Party, of these seven idol political parties, the idols that have become members of the legislature and representatives of each prefecture, will break the stalemate that covers Japan, using the power of song and dance. They will bring back the smiling faces of the people, and they will envelop Japan in a bright aura.'"
16514,Ikusa Otome Valkyrie Shinshou,Hentai,movie,1,6.19,-4049.340988062021,"""Akira is beautiful-so much so that he can have any girl...or guy that he lays eyes on. Unfortunately, the only woman he has ever wanted is the one woman he could never have-his own sister. When he first met Kaname-innocent to the ways of the world-his own world slowly began to change. The realization of the reality that his sister can never be his and that he can never find true comfort in her arms devastates him. There, from the depths of his despair, he finds salvation in Kaname's loving embrace.::animenewsnetwork.com"""
430,Ojamanga Yamada-kun,"Animation,Comedy,Family",tv series,1,7.74,193289.40837889045,
34213,Amagi Brilliant Park,"Animation,Comedy,Fantasy,Romance",tv series,12,6.56,18910.943634669056,"'The ""slapstick drama"" begins with Seiya Kanie, a high school boy who is invited on a date in an amusement park by a mysterious beautiful transfer student named Isuzu Sento. He is introduced to Ratifa, a ""real"" princess and the park\'s manager, and is asked to be the acting manager of this ""disappointing amusement park in the Tokyo suburbs.""::Ghassan Ben Moussa'"
29910,Two Down Full Base,"Kids,Sports",tv series,1,6.91,7633.419929003926,"'Common people discover that they have super powers. Their lives intertwine as a devastating event must be prevented.', 'People all over the U.S start to realize they have special abilities, like telekinesis, healing abilities, flying powers, time travel, invisibility, and the ability to absorb other\'s abilities. One man, known as Sylar, wants to gain all the power of these ""heroes"" so he can be the most powerful and evolved human of all, and stops at nothing to gruesomely kill these people. In order to protect themselves from him, these people must help one another before Sylar can destroy them all, while they each deal with problems of their own.::Patrick Ozzy Lauzier', 'It starts with ""Save the Cheerleader, Save the World,"" but soon spirals into a never ending battle for right and wrong, life and death. As people across the U.S. discover and use their special abilities in this NBC hit series, their world and lives are turned upside down as a serial killer named Sylar tries to hunt them all and make sure no one becomes as powerful as him. But it\'s not so simple. Sylar isn\'t in control of his hunger for power. Nobody knows when he will strike, or change, or strengthen. Unpredictable is this new world of heroes. And as time goes by, they each learn what the can do for the world. And it\'s not always good.::cippy-cp'"
28157,Chein kuronikuru: Hekuseitasu no hikari,Animation,tv series,1,7.22,-932.5131565996567,
2740,Ryuseiki Gakusaver,"Short,Sci-Fi",movie,25,6.55,221.63036994244948,
10755,.Hack//The Movie,"Animation,Action,Sci-Fi",movie,1,6.39,-5124.296210038369,"'In 2024, the computer network prevails throughout daily life. Sora Yuuki is a 14-year-old girl. One day, she is invited to an online game ""The World"". After an accident in the game, the real world begins to deform.::http://myanimelist.net'"
33693,Yes! Precure 5 GoGo! Movie: Okashi no Kuni no Happy Birthday,"Fantasy,Kids,Magic,Romance,Shoujo,SuperPower",movie,1,5.43,-310.18731070373354,
30449,"It's the Akane-iro ni Somaru Saka Hardcore OVA, Big Brother!","Animation,Comedy,Drama,Romance",tv series,1,6.7,-9210.182244416916,
33831,Chironup no Kitsune,"Animation,Drama",movie,1,4.5,-18278.30042863618,"'Foxes Ken and Chin become the proud parents of cubs, Koro and Kan, who enjoy a carefree life on the northern Japanese island of Chironup. They befriend a fisherman and his wife but are forced to run for their lives when soldiers on a military exercise decide to take home some fox pelts as souvenirs.::Anonymous'"
15037,Millennium Actress,"Animation,Drama,Fantasy,Romance",movie,4,7.12,117142.473955211,"'A TV interviewer and his cameraman meet a former actress and travel through her memories and career.::rgoes', ""A movie studio is being torn down. TV interviewer Genya Tachibana has tracked down its most famous star, Chiyoko Fujiwara, who has been a recluse since she left acting some 30 years ago. Tachibana delivers a key to her, and it causes her to reflect on her career; as she's telling the story, Tachibana and his long-suffering cameraman are drawn in. The key was given to her as a teenager by a painter and revolutionary that she helped to escape the police. She becomes an actress because it will make it possible to track him down, and she spends the next several decades acting out that search in various genres and eras.::Jon Reeves <jreeves@imdb.com>"""
287,Yami Shibai 2nd Season,"Dementia,Horror,Supernatural",movie,24,7.41,9943.222684226082,"""Princess Rangiku lost her entire family to Lord Karimata, who invaded her home seeking her father's life work, puppets with unique capabilities. As her duty, Rangiku sets out with three of her father's greatest puppet warriors to seek revenge. She can manipulate these to battle the strongest of warriors, however manipulating the puppets leaves her own self vulnerable to direct attacks, so she seeks a ninja warrior named Manajiri to aid and protect her in her quest.::Anonymous"""
3676,Trick or Treat or Die!,Comedy,tv series,47,6.48,3095.9824493926626,
5153,Anne of Green Gables: Road to Green Gables,"Animation,Drama,Family",movie,25,6.64,8285.436213247616,"""Anne is an orphan full of imagination. When she arrives at her new home she learns that sometimes you have to be a sensible person too; at the same time her unique character changes, or at least attracts, the people around her. The story covers Anne's growth from about eleven to seventeen years old as she makes friends, goes to school and studies. At a difficult point in her life, Anne will have to make a hard choice and perhaps find a new dream.::Anonymous"""
3837,With You: Mitsumeteitai,"Drama,Fantasy,Mystery,Romance,School",movie,45,7.11,-4690.2353643237575,
2063,Lady Bird,"Comedy,Drama",movie,1,6.53,-3485.194151683262,"'In 2002, an artistically inclined seventeen-year-old girl comes of age in Sacramento, California.::Anonymous', 'Christine ""Lady Bird"" MacPherson is a high school senior from the ""wrong side of the tracks."" She longs for adventure, sophistication, and opportunity, but finds none of that in her Sacramento Catholic high school. LADY BIRD follows the title character\'s senior year in high school, including her first romance, her participation in the school play, and most importantly, her applying for college.::Dehlia', ""Christine McPherson's senior year of high school in 2002/03 is presented, she the second of two offspring of Larry and Marion McPherson. Outwardly, she hates most aspects of her life. She hates that they have long lived a life of barely scraping by, their situation all the worse now as they as a collective are a victim of the poor economy. That economic reality has led to Larry recently being laid off, Marion needing to work double shifts as a counselor at a psychiatric hospital just to keep their head above water, and Christine's brother Miguel and his girlfriend Shelly moving back home in the McPhersons' small and already overcrowded house with one bathroom now for five people. She hates that what her parents have decided to spend on her within their already tight budget is an expensive Catholic private school education at Immaculate Heart, solely because Miguel witnessed long ago some violence outside Sacramento High, where she would have gone otherwise. At Immaculate Heart, she has only two friends, equally poor Julie Steffans, they playing upon their outsider status. She hates living in Sacramento, she who is determined to go to a liberal arts college back east, preferably New York City, using financial aid rather than go to a California college such as nearby UC-Davis for which she would eligible for an in-state reduction in tuition, that option already barely affordable. Whether she will even get into college is questionable as she has placed little effort into her school work despite being bright, except perhaps in math. But arguably what she hates the most is her strained relationship with her mother, Marion who is always bad cop to Larry's good cop in the parenting role. Marion and Christine's strained relationship is exacerbated by both being strong willed people. Christine believes that her mother may love her because she has to, but truly doesn't like her. In not wanting to take things from her mother out of a natural course of family, Christine has decided to rename herself Lady Bird, something she wants everyone to call her from now on. As Lady Bird goes through some major events her senior year - from discovering a new school extracurricular activity which includes boys from neighboring St. Francis Xavier, to testing the waters of dating, possible first love and the prospect of sex, to wanting to be part of the in-crowd, to truly placing some effort into her short term post-secondary dreams - she and Marion may only have a short period of time to express their true love for each other, family or not, before it's too late.::Huggo"", 'Going by the name of ""Lady Bird"", the outspoken Catholic high school senior student, Christine McPherson, is dreaming big of finally leaving her hometown of Sacramento, practically on pins and needles to attend a sophisticated New York City college. However, with her average grades and her family struggling to keep afloat, attending a public university closer to home would be a lot cheaper and safer, especially after last year\'s devastating 9/11 attack. In the end, amid grades, numerous college applications, a blooming teenage sexuality, and a strong-willed mother who is a real mother hen, Lady Bird must find a way to make her dreams happen. Can she survive life\'s bumps and cracks?::Nick Riganas', 'Sacramento, 2002. Christine ""Lady Bird"" McPherson is in her final year of high school. She longs to leave Sacramento and go to college on the East Coast. However, her protective, obsessive mother, pessimistic at her chances, is determined to keep her in California, and ideally nearby to home. Lady Bird\'s final year of school will be one of discovery, new experiences and finding herself.::grantss'"
6095,Geori-eui Mubeopja,"Action,MartialArts",tv series,1,6.3,20947.911214533036,"""A girl named Miaka Yuuki and her friend Yui Hongo are taken into the book called The Universe of the Four Gods. There they battle many hardships including each other in order to become the priestess of Suzaku and Seiryuu and summon them. What they didn't expect was to fall in love and watch their comrades die.::Kandace Galyen"""
1668,Hanoka Recap,Sci-Fi,tv series,52,7.02,22335.822664678657,'Black Cat DVD only episode.'
28145,Zoku sayonara zetsubô sensei,"Animation,Comedy",tv series,130,6.86,-2093.515296131389,'The continuing adventures of the inconsolable teacher Nozomu Itoshiki and his class of insane students.::Anonymous'
24231,Sangokushi Daiichibu Eiyuu-tachi no Yoake,Historical,movie,10,7.33,91692.5602771491,
1861,Uchuu Enban Dai-Sensou,"Action,Mecha,Romance",movie,1,7.66,13297.068418655344,'Pepe Benengeli and his team participate in the Japanese Cup.'
6380,Guren,"Animation,Adventure,Sci-Fi",tv series,1,7.4,21145.562356495662,
10703,PostPet Momobin,"Comedy,Kids",movie,1,7.51,1837.0399044412106,
5895,4-Day Weekend,"Short,Music",movie,1,7.1,723.1911498584045,
17439,Jinki: Extend,"Animation,Sci-Fi",tv series,1,6.13,-6624.097170298919,"'A 12-episode mecha anime series that aired on TV Asahi in 2005. It detailed the lives of two pilots of special robots called ""jinki"", and the manipulation behind the scenes that drew them inexorably together in a final battle.::Danny Lilithborne <dannysl@grex.cyberspace.org>'"
9760,Doraemon: Doraemon Comes Back (Movie),"Comedy,Fantasy,Kids",tv series,1,7.81,73579.67941735007,
18149,Mamono Hunter Yôko no jijô,"Animation,Action,Comedy,Horror,Music",tv series,1,5.04,-2381.735687419414,
1026,Mim Mam Mint,Comedy,movie,2,6.25,20985.684134810057,
3267,Rozen Maiden: Meitantei Kunkun - Duell Walzer,"Comedy,Mystery",movie,4,6.02,-2188.333317339188,
24459,EX Season,"Animation,Comedy",tv series,1,7.52,32246.28759812854,"'Caren Ortensia attempts to control the world using money with varying degrees of success, Phantas-Moon receives a movie adaption of her T.V. show, and Shiki is involved in a love plot that spans years.'"
12671,Orenchi no Furo Jijou,"Animation,Comedy,Fantasy",tv series,1,6.68,18684.949240308535,"""Tatsumi is a high school boy who lives by himself. However, a devastatingly handsome merman named Wakasa moves into the bathtub in Tatsumi's home. Wakasa is a bit self-centered but cute, while Tatsumi is cool but a busybody."""
33524,Noragami,"Animation,Adventure,Comedy,Fantasy",tv series,1,6.8,48577.48845478101,"'A minor god seeking to gain widespread worship teams up with a human girl he saved to gain fame, recognition and at least one shrine dedicated to him.::Anonymous'"
6794,Feelings of Mountains and Waters,"Animation,Short,Drama,Music",movie,1,6.99,18467.907303391417,'A short film about a young girl who cares for a wise old scholar in exchange for guqin lessons.::Simba63'
387,Doraemon Movie 29: Shin Nobita no Uchuu Kaitakushi,"Adventure,Comedy,Fantasy,Kids",tv series,13,8.07,113024.81880994429,"""Yuuta Takemoto is a poor college student who lives in a dilapidated apartment building with his two friends, Shinobu Morita and Takumi Mayama. The series chronicles the students' story as they struggle through life and love.::dxg"""
7367,Isshoni Training 026: Bathtime with Hinako & Hiyoko,"Animation,Short",movie,1,6.95,21834.36496755964,"'Hinako does some bath stretches, and Hiyoko joins her.'"
2186,DD Fist of the North Star,"Animation,Action,Comedy",tv series,2,5.61,-12800.094195772688,"'A parody of the post-apocolyptic anime, ""Fist of the North Star"", wherin the nuclear holocaust never happens, and so Kenshiro and his brothers have to settle into a regular society and find jobs!'"
6481,Agatha Christie's Great Detectives Poirot and Marple,"Animation,Adventure,Crime,Mystery",tv series,26,5.88,-17238.94396411787,"'A teenage girl divides her time between working in London for the famed Belgian sleuth, Hercule Poirot, and staying in the countryside with her shrewd great-aunt, Jane Marple.::L. Hamre', ""1930s England; spirited teenager Mabel West is determined to live her life on her own terms. Her father agrees to let her leave her stuffy boarding school and seek employment in London. In the city, she works as a junior assistant to the famous Belgian detective, Hercule Poirot. Also accompanied by Poirot's assistant Hastings, secretary Miss Lemon, and Inspector Sharpe, the formidable team solve numerous exciting mysteries. However, Mabel does not forget her family and often travels to the countryside to stay with her great-aunt Marple. This shrewd older woman also has a reputation for solving puzzling mysteries.::L. Hamre"""
2144,Usagi in Tears! Glass Shoes for Her Birthday,"Animation,Action,Adventure,Comedy,Drama,Fantasy,Romance",tv series,1,6.95,75175.42279450901,"""Usagi is furious when Mamoru forgets her birthday. When Mamoru buys her an expensive pair of glass slippers to make up for it, he fails to realize that they have been implanted with a Daimon's Egg.::Mark Riquelme"""
2497,Ponsuke no haru,"Animation,Short",movie,8,6.73,4607.051912423043,
1844,Garden of Sinners 5 - Paradoxe Helix,"Animation,Action,Crime,Drama,Horror,Mystery,Thriller",movie,26,7.05,29995.69646880529,"""November 1998: A young man swears he committed a heinous crime, he looks in the news, but nobody talks about what happened, even when the police find the alleged victims ... alive and unharmed. He says that he has done it and wants the aid of Shiki. Behind this seemingly senseless event, there is a large apartment building in which is woven a very convoluted plot in which Touko's past is involved. Will Shiki and Mikiya discover the truth? Can all of them escape from the spiral?::Nolberto Roa"""
33102,Initial D: Battle Stage,"Short,Action,Sport",movie,1,6.54,8806.917567488032,
29974,Ero Manga! H mo Manga mo Step-up♪,Hentai,movie,12,6.13,42609.54173182344,"'The all-powerful Monkey King once roamed freely between Heaven and Earth, but after angering the gods, he was imprisoned within an ice cage deep within the mountains. Five hundred years later, monsters attack a small village and a child flees to the mountains. Unknowingly, the child releases the Monkey King from his curse. With the help and encouragement from this special child, Monkey King saves the village from the evil monsters.::SC Films International'"
2701,Zettai Karen Children: The Unlimited - Hyoubu Kyousuke,"Animation,Action,Drama,Sci-Fi",tv series,104,6.69,7869.198617531614,"'An ex-soldier attempts to infiltrate P.A.N.D.R.A., a supposed criminal organization run by ESPers.'"
7759,Barakamon: Mijikamon,Comedy,tv series,7,6.34,-5851.8169358810665,
16552,Itohan monogatari,Drama,movie,1,4.5,11016.482047508156,
33535,Sekai no Fushigi Tanken Series,"Adventure,Fantasy,Historical",tv series,1,4.7,-5359.293970339335,
30984,Gran Torino,Drama,movie,1,7.25,587.9686860338911,"""Disgruntled Korean War veteran Walt Kowalski sets out to reform his neighbor, a Hmong teenager who tried to steal Kowalski's prized possession: a 1972 Gran Torino.::Anonymous"", ""Walt Kowalski is a widower who holds onto his prejudices despite the changes in his Michigan neighborhood and the world around him. Kowalski is a grumpy, tough-minded, unhappy old man who can't get along with either his kids or his neighbors. He is a Korean War veteran whose prize possession is a 1972 Gran Torino he keeps in mint condition. When his neighbor Thao, a young Hmong teenager under pressure from his gang member cousin, tries to steal his Gran Torino, Kowalski sets out to reform the youth. Drawn against his will into the life of Thao's family, Kowalski is soon taking steps to protect them from the gangs that infest their neighborhood.::alfiehitchie"", ""Walt Kowalski is an embittered Korean War veteran who has just lost his wife. The world has changed around him as well. His once all-white neighborhood is now mostly Southeast Asian and he has a Hmong family living next door. He doesn't get along with his sons and is out of touch with his grandchildren, all of whom seem more interested in getting his house than anything else. His pride and joy, however, is his mint condition 1972 Gran Torino. When the Hmong teenager who lives next door, Thao, is challenged by his cousin and other local gang members to steal it, Walt almost shoots him. Gradually, however, he realizes he has more in common with his neighbors than his own family and becomes something of a neighborhood hero when he prevents the gangbangers from forcing Thao into their car. He gradually takes Thao under his wing, teaching him a few things about life and helps getting him a job. Walt's intervention has a price, however, when the gang shoots up Thao's house and attack his sister Sue. For Walt, it's time to take action, though not in a way you would expect.::garykmcd"", ""Walt Kowalski is a retired auto worker and Korean War veteran living in Detroit. Recently widowed, Walt lives alone with his dog in a crime-infested neighborhood and has a strained relationship with his family. A Hmong family moves next door to Walt but he wants nothing to do with them. One night, one of the members of the family, Thao, is coaxed by his cousin 'Spider', a gang member, to steal Walt's prized Gran Torino. Thao botches the theft after getting caught by Walt. However, the duo reluctantly start a friendship as Walt seeks to straighten out Thao. As Walt's relationship with Thao extends to Thao's family, Walt is forced to defend them from Spider and his gang who begin to routinely attack Thao and his family.::Sam"", ""Elderly Walt Kowalski is recently widowed. Much of Walt's views of life are shaped by his time in the Korean War. On strained relations with his grown sons and not wanting the advice of the priest of his wife's church, Walt is a gruff man who has few friends. As such, he lives a solitary life with his pet Labrador retriever Daisy in the same house he has lived in for years, which is located in a working class Highland Park, Michigan neighborhood. Recently, the neighborhood has gone through changes where it is now racially mixed. The Lor family, of ethnic Hmong descent, move into the house next door to Walt's, the family which includes two teenagers, streetwise Sue and shy Thao. Initially Walt wants nothing to do with his new foreign neighbors. Slowly, Walt does get involved in Sue and Thao's lives, despite Thao having once tried to steal Walt's beloved 1972 Gran Torino. That attempted theft was a Hmong gang initiation ritual, a gang to which Thao does not want to belong. Walt sees that Sue and Thao will never be able to live in peace as long as that gang exists. As his teen-aged neighbors' unofficial protector, Walt has to figure out how best to restore his sense of right in the neighborhood.::Huggo"", 'In Michigan, the grumpy widower Walt Kowalski is a Korean War veteran full of prejudice that has just lost his beloved wife Dorothy. He is one of the last Caucasian Americans in his neighborhood and does not have good relationship with his sons and their families; therefore he is a lonely man. When his teenager neighbor Thao Vang Lor is pressed by his cousin Smokie to join his Hmong gang, he is assigned to steal the Gran Torino of Walt as part of his initiation in the gang. However, he is surprised by the old man and his traditional family feels ashamed with the incident. Later Walt saves Thao first and his sister Sue Lor from gangs and he has the gratitude of his next door neighbors and the neighborhood. On the day of his birthday, Walt is invited by Sue to join her family reunion and he begins a relationship with his neighbors, helping Thao to get a job. However, he realizes that the Hmong gang disturbs the neighborhood and after a coward attack of the gangster, Walt decides to take an ultimate attitude.::Claudio Carvalho, Rio de Janeiro, Brazil'"
1210,Gregory Horror Show: The Last Train,"Comedy,Demons,Horror,Mystery,Supernatural,Vampire",tv series,24,8.4,284535.9426350728,
3511,The Tower of DRUAGA:the Aegis of URUK,"Animation,Action,Adventure,Comedy,Fantasy,Romance",tv series,1,5.67,2717.97292874285,"'A demon lord commands his forces from a tower. During the ""Summer of Anu"", they lose their power and human army invades the tower to end their threat. Adventurers who have heard about a priceless treasure hidden in the tower join the fight.::Anonymous'"
1264,Skinless Night - Nacht ohne Reue,Drama,movie,39,7.21,11229.529545237687,
562,Raldessia Chronicles,"Action,Adventure",tv series,3,6.59,-18975.330379828625,
19191,Yuujou no Kickoff,"Drama,Kids,Sports",movie,1,7.7,35021.99106931502,"'Dolph Lundgren plays Jack Devlin, a U.S Marshal who protects high-profile clients when it comes to a matter of security.::DropZone <peeri@actcom.co.il>', ""After saving Casey, a daughter of his friend, from hired assassins, Jack Devlin is hit with a strange phobia - fear of white color. But when his other friend, who works as a bodyguard for a supermodel, is wounded, Jack decides to step in for him. Now he must confront his fear and the assassin, who seems to be well aware of Jack's problem::Boris Shafir <shafir@hsi.com>"""
866,Lupin III: Walther P-38,"Action,Adventure,Comedy,Mystery,Shounen",movie,1,7.32,33652.297473778715,
3271,Guardian Hearts-Power UP!,"Action,Comedy,Ecchi,Fantasy,Harem,Magic,Romance",movie,39,6.79,2766.251210678357,
6437,Toppuku Kyousou Kyoku,"Comedy,Shounen",tv series,9,6.38,-3766.7766978518675,"""Now there's no need to wait for individual volumes - you can get the entire epic all at once! Narue is an adorable school girl with a secret. She's really an alien with powers right out of a sci-fi comic book. Join our spunky heroine as she faces androids, alien invaders, and her first date with the boy next door. It's the sci-fi comedy that's a direct hit to your heart.::CPM"""
1302,Qi ren yan fu,,movie,1,7.45,7096.917684303484,
7004,The Monkey King and the Fruit of Immortality,Adventure,movie,52,6.18,-1804.9081840815575,
30519,Futari wa Precure: Splash☆Star Movie - Tick Tack Kiki Ippatsu!,"Fantasy,Kids,Magic,Shoujo",tv series,36,6.28,-10714.555198931368,
557,Yurûi Gegege no Kitarou: Youkai dotabata daisensou,Action,tv series,4,6.85,23382.08648582192,
