anime_id,name,genre,type,episodes,rating,members,overview
6733,Furusato saisei: Nihon no mukashi banashi,Animation,tv series,1,6.81,-6851.915155984306,"'Anime television series that adapts various traditional stories from Japan.', 'A Japanese anime television series that adapts various traditional stories from Japan. The narration and all character voices of ""Hometown Rebuilding: Folktales from Japan"" are provided by veteran Japanese film actors Akira Emoto and Yoneko Matsukane.'"
24807,G-on Riders,Animation,tv series,1,5.21,-273.1646097096323,
2874,Classical Sex-Zone,"Hentai,School",movie,1,5.57,14610.725076508359,"'A widower takes an offer to screen girls at a special audition, arranged for him by a friend to find him a new wife. The one he fancies is not who she appears to be after all.::<rag@kabelfoon.nl>', 'In Tokyo, Shigeharu Aoyama is a widower that grieves the loss of his wife and raises his son Shigehiko Aoyama alone. Seven years later, the teenage Shigehiko asks why his middle-aged father does not remarry and Shigeharu meets his friend Yasuhisa Yoshikawa, who is a film producer, and tells his intention. However, Shigeharu has difficulties to approach to available women to date and Yasuhisa decide to organize a sham audition for casting the lead actress for the fake movie. They receive several portfolios of candidates and Shigeharu becomes obsessed by the gorgeous Asami Yamazaki. Despite the advice of the experienced Yasuhisa, Shigeharu calls Asami to date and he falls for her. But who is the mysterious Asami?::Claudio Carvalho, Rio de Janeiro, Brazil', 'A lonely Japanese widower whose son is planning to move out of the house soon expresses his sadness to a friend and fellow film producer, who becomes inspired to hold an audition for a non-existent film so that the widower can select a new potential bride from the resulting audition pool. The widower ultimately becomes enamored with and fascinated by one particular young woman...but first impressions can often be horribly wrong....::deusdiabolus'"
1260,Shinichi Hoshi's Short Shorts,Animation,tv series,1,7.07,1618.114084404997,
6856,Soul Link,"Animation,Adventure,Comedy,Drama,Romance,Sci-Fi",tv series,1,5.33,9412.26798832168,
15577,Daily Lives of High School Boys,"Animation,Comedy,Drama",tv series,1,6.13,8490.360372511977,"'A sketch comedy about three friends attending an all boys school.::Mattias1', ""High school boys are really simple and curious creatures. They want one and only one thing: girls. But they haven't got a clue about them. Male teenagers are dumbfounded by the girls' thought process, actions, appearance and everything in between. They spend countless hours amongst themselves discussing and arguing their theories which are usually completely off base. If only they had the courage to ask them instead of screwing around and talking about nonsensical things, they might get somewhere.::baka-updates"""
33279,Shitai wo Arau The Animation,Hentai,tv series,2,4.5,7609.682394254105,"'A young Chinese woman named Kunyan finds herself subjected to a variety of bizarre, life-threatening situations. She must act quickly if she hopes to escape her plight in one piece.::Akira (akira625@comcast.net)'"
1275,Puppet Princess,"Animation,Short,Action",movie,6,6.39,13282.834915526242,"""Princess Rangiku lost her entire family to Lord Karimata, who invaded her home seeking her father's life work, puppets with unique capabilities. As her duty, Rangiku sets out with three of her father's greatest puppet warriors to seek revenge. She can manipulate these to battle the strongest of warriors, however manipulating the puppets leaves her own self vulnerable to direct attacks, so she seeks a ninja warrior named Manajiri to aid and protect her in her quest.::Anonymous"""
19831,Shounen Sunday CM Gekijou: InuYasha-hen,"Action,Demons,Fantasy",movie,36,7.13,22934.747532845835,"""Steven Gold is a stand-up comedian who is flat broke and has recently dropped out of medical school. He and several others work regularly at the Gas Station, a New York comedy club. The wages are lousy and everybody hopes for the big break. Lilah Krytsick is housewife with an ambition to be a stand-up comedian, however she doesnt seem to have the talent. Steven takes her under his wings and teaches her the art of comedy and humour. But when a TV station arranges a comedy evening at the club, Steve sees his opportunity for fame and stardom. Their friendship seems quickly forgotten and now it's every man and woman for him- or herself!::Mattias Pettersson <seaman@sbbs.se>"""
5369,Sanzoku Diary,"Seinen,SliceofLife",movie,1,6.34,13265.82785554446,"'In the distant future, humans are declared ""illegal residents"" and hunted to near extinction by murderous robots. One day, a group of human scavengers come across a strange man named Killy, who may be the key to humanity\'s survival.', 'In the distant technological future, civilization has reached its ultimate Net-based form. An ""infection"" in the past caused the automated systems to spiral out of order, resulting in a multi-leveled city structure that replicates itself infinitely in all directions. Now humanity has lost access to the city\'s controls, and is hunted down and purged by the defense system known as the Safeguard. In a tiny corner of the city, a little enclave known as the Electro-Fishers is facing eventual extinction, trapped between the threat of the Safeguard and dwindling food supplies. A girl named Zuru goes on a journey to find food for her village, only to inadvertently cause doom when an observation tower senses her and summons a Safeguard pack to eliminate the threat. With her companions dead and all escape routes blocked, the only thing that can save her now is the sudden arrival of Kiri the Wanderer, on his quest for the Net Terminal Genes, the key to restoring order to the world.'"
659,3-gatsu no Lion meets Bump of Chicken,"Animation,Short,Drama,Music",movie,1,7.11,18474.040082650503,
3385,Denkou Chou Tokkyuu Hikarian,"Action,Adventure,Kids",movie,3,6.37,4548.478646247572,'Nobita with Doraemon and others fight a robot army to save earth for alien invasion.::mahade047'
6524,Digimon Adventure tri. 2: Bestimmung,"Animation,Action,Adventure,Fantasy,Sci-Fi",movie,1,5.44,11152.85070704501,"""The DigiDestined go to a nearby hot springs theme park and everyone has a good time, but Joe doesn't show up because he wants to study for his exams. Another infected Digimon, Ogremon, attacks Odaiba. Gomamon runs away from home while Mimi faces problems with the other DigiDestined and her classmates because of her selfish ideas. Would Joe accept his responsibilities as a DigiDestined before it's too late?::Rahspot"""
6811,Gokyodai Monogatari,"Animation,Comedy",tv series,26,8.37,87912.16689978784,
32322,Shakugan no Shana Movie Special,"Adventure,Comedy,Fantasy,Parody",movie,1,4.67,-17106.486659461603,"""A retired pop singer turned actress' sense of reality is shaken when she is stalked by an obsessed fan and seemingly a ghost of her past.::Kenneth Chisholm"", 'Mima leaves the idol group CHAM, in order to pursue her dream as an actress. Mima climbs up the rocky road to success by performing as rape victims and posing nude for magazines, but is haunted by her reflections of the past.::<H@jime>'"
26313,Bug tte Honey: Megarom Shoujo Mai 4622,"Adventure,Comedy",movie,1,9.25,2273.0192964996218,"""This extraordinarily complex film is not only a send-up of every samurai film ever made, it is also an extrapolation of the value of life. The Yamatai, represented by Prince Susano-O and elderly advisor Sumuke, hire Yumihiko of Matsuro to hunt the phoenix so that Queen Himiko, sister of Susano-O can have eteranal life. Matsuro is then destroyed by the Takamagahara, who have mastered the art of horseback riding, which is foreign to all other western Japanese tribes. One of their number, Uzume uses makeup to appear ugly and avoid rape, though her dancing induces Jingi to spare her. Queen Himiko's apprentice, Iyo, orders the execution of an innocent based on her magical observation, so Susano-O sides with the people. A Yamatai doctor named Guzuri washes up from a shipwreck in the country of Kumaso, where Hinaku, daughter of the chief, is dying. Urusni, her husband, is killed hunting the phoenix to save her, but Guzuri gives her penicillin, which saves her, so the chief marries him to her. The Yamatai army, led by Sarutahaiko, destroys the entire village, but Guzuri, who is initially blamed, and Hinaku escape, and Nagi, the son of the chief, is spared because he knows where the phoenix lives. Initially enraged, Hinaku eventually makes Sarutahaiko take charge of Nagi, who trains him to fight animated foxes, but he is thrown in a pit of wasps when Nagi teams up with Oro, daughter of the innocent man who was executed, in attempt to kill the queen, though Nagi hits a servant, instead. The three attempt to escape during an eclipse which terrorizes the people, but Oro is killed. Sarutahaiko and Nagi float to what remains of Kumaso, Sarutahaiko's nose permanently swollen to great size. In an earthquake Guzuni and new mother Hinaku are trapped at the bottom of a crater, where they will spend the rest of their lives, while Nagi and Sarutahaiko find a horse (Nagi briefly turning into an animation of Astro Boy when kicked), and then the Takamagahara. Jingi has no interest in living forever, but in immortalizing himself through history, and sets out to conquer Yamatai, sparing the two only because Uzume wishes to marry Sarutahaiko.::Scott Hutchins <scottandrewh@home.com>"""
33735,Mahou shoujo Meruru,"Short,Action",movie,0,0.0,-4194.664868061632,
15933,Muteki Koujin Daitarn 3,"Mecha,Sci-Fi",tv series,1,7.11,16404.4303025118,
9561,Shichinin no Nana: Oshougatsu Da yo! 7 x 7 = 49-nin no Nana?,"Adventure,Comedy,Magic",tv series,12,5.8,8231.202456171584,
28405,Generator Gawl,"Animation,Adventure,Action,Comedy,Sci-Fi",tv series,1,7.42,20318.306308600644,"""Gawl, Koji, and Ryo, three young scientists from the future, time travel to early 21st-century Japan to stop a terrible threat from undoing civilization. As they fight against time, their quest disrupts the lives of the townspeople, and the trio must use their incredible intelligence, along with Gawl's unique abilities, to protect their identities, their friends, and their future."""
3407,Binetsu Shoukougun,Hentai,movie,24,7.07,47781.39714512802,"'During a random night, the two brothers Mutta Nanba and Hibito witness what seems to be a UFO flying to the moon and they both vow to eventually become astronauts. 19 years later, Mutta has the opportunity to follow his brother and fulfill his promise.::Dielson Sales'"
12729,Clannad: Mô hitotsu no sekai - Tomoyo hen,"Animation,Short",movie,2,7.47,104412.22161902286,"'In an alternate universe to the original Clannad anime, Okazaki Tomoya is dating Sakagami Tomoyo in the 24th and final episode of Clannad.', ""When Tomoyo is elected Student Council President, her dream to save the school's cherry blossom trees from being cut down begins to come to fruition. However, her never-ending duties and bad rumors about their relationship spread by fellow students due to Tomoya's reputation as a delinquent create a rift between the two. As Tomoya watches Tomoyo rise higher and higher into the distance, their relationship is stretched to the limit by a society that threatens to break them apart."""
4923,Akko's Secret,"Comedy,Fantasy,Romance",movie,4,5.94,-3026.6744654294034,'Young Atsuko Kagami comes into possession of a magical mirror that lets her transform into anything she wishes. Atsuko Kagami then attempts to save a company which is about to be sold by using her transformation abilities. She also falls in love as a 22-year-old college student.::anonymous'
30095,Stardom,"Drama,Comedy",movie,1,6.78,15830.982727691942,"'A young girl is plucked from small-town obscurity and thrust into the spotlight of the glamorous world of super-models.::Anonymous', 'A sports photographer in rural Canada sends a picture of a high school athlete, Tina Menzhal, to a Montréal fashion agency. This starts Tina on a career taking her from Canada to Paris to Montréal again, to Manhattan, to the world, and then home, through two boyfriends, two husbands, and innumerable TV interviews, either with nasty smiling scandalmongers or with gushing witless twits. In nearly every case, Tina never gets to finish a sentence. She has a suave agent, paparazzi are everywhere (""What the celebs forget, there\'s always a camera,"" says one), and a documentary filmmaker is on hand as well. What is it that Tina thinks, feels, and wants: will we ever find out?::<jhailey@hotmail.com>'"
7745,"Rebiya Kadeer, Uyghurs Mother (China) #3",Documentary,tv series,1,7.36,12626.01964091898,
545,Bôken shitemo iikoro,,movie,12,6.18,21277.714598575916,
9349,"Satto Anshin, SAT x Peeping Life","Comedy,SliceofLife",movie,1,5.67,4422.099827103631,"""A high school student's father re-enters his life and brings along his famous new wife and daughter.::Anonymous"""
23149,Seihou Bukyou Outlaw Star Pilot,"Action,Sci-Fi,Space",movie,12,5.81,399.3176381565873,
33572,Nabari no Ou,"Animation,Action,Comedy,Drama",tv series,12,5.31,9609.457908088843,"""In the shadows of this world, ninjas fight for control of an ancient technique which holds untold strength. This coveted power dwells within apathetic Miharu, a fact the guy really couldn't care less about - until the rival clans bring their battle to him. Now, he must choose a side if he hopes to survive - but when conflict is waged in secret, friend and foe prove difficult to tell apart."""
1678,Yurusarezaru mono,"Short,Drama",movie,52,7.36,10911.438053065074,
2864,Tenjou Tenge: The Ultimate Fight,"Adventure,Drama,MartialArts,Romance,Shounen,Supernatural",tv series,2,5.44,19395.92986029696,"""With aims to one day reach out into the stars, humanity has colonized all the planets of the solar system. This story of young high school hopefuls is set in Fourth Tokyo in a Japanese Martian prefecture. Iris Shirasaki is a third year student/aspiring test pilot. Mizuki Sera is her peer/mechanic and Mizuki's brother Kaito is their homeroom teacher and the young director of the program developing their talents.::Crunchyroll"""
32473,Blood Blockade Battlefront,"Animation,Action,Adventure,Fantasy",tv series,1,4.75,11686.828681658399,"'In a city where the paranormal and ordinary co-exist, the Libra organization battles to ensure peace and order.', ""A breach between Earth and the netherworlds opened up over the city of New York, trapping New Yorkers and creatures from other dimensions in an impenetrable bubble. Over time, this bubble became Jerusalem's Lot, a homeworld of wondrous beings and crazy sci-fi sensibilities. Now someone is threatening to sever the bubble and unleash chaos across the dimensions, and it's up to a special group of superhumans to preserve Jerusalem's Lot."""
18139,Dragon Ball Z: Bardock - The Father of Goku,"Animation,Drama,Fantasy,Sci-Fi",movie,21,7.69,80085.09217321158,"'The tale of Bardock, the father of Goku, and his rebellion against his master the mighty Frieza.', ""A prequel to the original Dragonball series, this TV movie tells the story of Son Goku's father Bardock and his futile attempt to stop Freeza from destroying his planet Vegeta. It also shows how little Kakarotto (Son Goku) ends up on earth!::Anonymous"""
30437,Bishoujo Yuugi Unit Crane Game Girls,"Comedy,Game,Space",tv series,12,6.67,35033.245970451855,"""Rookie literary editor Onodera Ritsu finds himself working for the Marukawa Publishing Company. To his surprise the only job available is in the Shojo Manga division of the company. The editor and chief of the manga division, Masamune Takano, can't help but feel that he knows his newest editor. After spending many hours at work together, Takano realizes that his new editor is actually his high-school sweetheart. Masamune Takano confronts his former lover Onodera-san about their former relations. Takano is now bound and determined to make Ritsu fall in love with him yet again. Refusing, Onodera rushes home and can't help but recall those years in high school with his former love. Masamune in convinced that he can spark a new love with his long lost love. The world's greatest first love....::Jake Kling"""
23871,Gintama x Mameshiba,"Comedy,Parody",tv series,1,6.85,13050.017033261507,"'A pretty schoolgirl hides a secret: she is actually a boy who got turned into a girl and is looking for a way to change herself back.', 'Megumi-chan is a teen-aged girl with a secret past. She used to be a boy until she saved a magician from a gang of boys and was given a magical book. As a boy when he bled into the book a genie appeared to grant one wish. Megumi wished to be a man, but the genie granted the wish backwards so he turned into Megumi-kun, a girl. Years pass and Megumi grows up to be the most beautiful of girls but still acts and fights like the boy that she really is. Upon entering High School she immediately beats up the school bully who falls in love with her. Thus begins her adventures looking for that book to change her back and fighting off both admirers and her on-coming femininity.::laird-3'"
30481,Witch Hunter Robin,"Animation,Action,Adventure,Drama,Fantasy,Mystery",tv series,1,6.8,6633.802585053822,"""Witches exist, and it is the mysterious organization STNJ's job to hunt them down. Robin is a recent trainee who joins up, and begins unravelling the secrets of both the witches and STNJ...::Snowinferno"""
3411,Toki-iro Kaima,"Horror,Shounen",movie,2,5.9,-2166.097929659976,"""Based on the comic book by the creator of Ghost in the Shell, a young female soldier Deunan and her cyborg partner Briareos survive through the post World War 3 apocalyptic New York in search of human's future hope, the legendary city of Olympus.::SAI"""
1043,Juushin Enbu: Hero Tales,"Action,Fantasy,Shounen",movie,2,6.82,10626.749276783848,"'The Joker five-star system is under Emperor Amaterasu. Mecha pilot Ladios must save his co-pilot, Fatima-class female android Lachesis, from one of many warlords, who oppose Amaterasu.'"
22455,"Machine Robo: Leina, The Legend of Wolf Blade","Action,MartialArts,Mecha,SuperPower",movie,1,6.51,5698.145308297023,"'A small group squad of American soldiers find horror behind enemy lines on the eve of D-Day.::Chockys', ""Night of the 5 to the 6 June, 1944. On the eve of D-Day, several American paratroopers are dropped behind enemy lines to carry out a mission crucial to the invasion's success: destroy a radio tower built in a little castle of an old French town that it's close to Normandy's beaches, and that Third Reich uses as straight communication between Berlin and beaches' bunkers. Due to the intense enemy fire caused by cannons and machine guns, all the planes are shoot down and the most of the soldiers die in the landing or they are killed by Nazis' night patrols after to take land. However, a private named Ed Boyce survives to meet Corporal Ford, a last-minute incorporation from Italy and a veteran expert in bombs and explosives; Tibbet, a rogue sniper; Chase, a war photographer; and finally private Dawson. After to watch the killing of their superior Sargeant Eldson by a Nazi night patrol, Ford assumes the mission as leader of the group and they try to get the town when Dawson dies after to step a landmine. Burying him in the forest, they meet Chloe, a villager who refugees the soldiers in her house where she lives with her old and ill aunt and her elder brother, child Paul. But the mission complicates when by chance Boyce get into the Nazi radio tower, just to find a horrible secret experiment with human beings that it could bring the victory to Hitler and would change the fate of the world forever. With D-Day approaching, Boyce and the others begin to realize there is more going on in this Nazi-occupied village than a simple military operation, having to fight against supernatural forces not only to destroy the radio tower, but destroy the own experiment before Hitler's gets his Third Reich of thousand years he promised.::Chockys"""
4150,Puka Puka Juju,"Animation,Short,Adventure,Comedy",tv series,1,5.71,3114.7909797499533,
34119,Nick News: Nick's Big Green Challenge,News,movie,1,3.33,4484.934401025641,'10 children set out to get things changed which are threatening climate change for our planet. Presented by David De Rothschild'
31851,Seitokai yakuindomo,"Animation,Comedy,Drama",tv series,1,6.75,-1457.488776758074,"'Takatoshi Tsuda joins Ousai Academy, a co-ed high school that until recently had been an all-girl school, where he is asked to join the student council as vice-president and a male representative.::Nolberto Roa'"
18819,What Is It?,"Animation,Short",tv series,56,6.13,14179.288264116849,"""A short TV featuring a small green pig with enormous eyes. The title Nandarou implies that even its creators didn't really know what kind of creature it was supposed to be. However, NTV (Nihon TV) chose it as their station's mascot."""
30428,Hashire! Shiroi Ookami,Drama,movie,1,5.49,2669.3117467206025,
15925,Yoroiden Samurai Trooper: Message,"Animation,Action,Fantasy",movie,1,7.47,5360.44916665892,
9274,Tiger &amp  Bunny Pilot,"Action,Comedy,SuperPower",movie,1,6.05,-5746.741290651642,
1048,La Vilaine LuLu,Comedy,tv series,13,6.5,4260.046683139481,
3776,Perman,"Animation,Adventure,Family",tv series,50,6.59,-14183.67081216795,"'A clumsy boy, Mitsuo is chosen as apprentice to a powerful superhero.::Swarup Basak', 'Superman (later ""Birdman"") gives a clumsy human boy, Mitsuo Suwa, three items to help him as Paman, Superman/Birdman\'s apprentice: A helmet which multiplies the wearer\'s physical strength by 6600, A cape that allows the wearer to fly at a speed of 119 km/h, A badge which enables the wearer to communicate with other Perman and to breathe underwater, In addition, he gives him a copy-robot which transforms into an identical clone to help him keep his secret identity during missions. However, if his secret identity becomes known to others, his brain will be destroyed for betraying the secret of Perman. This penalty is reduced to being turned into an animal in later chapters of the manga and in the anime. Mitsuo begins by rescuing people who are victims of crimes or disasters, so as Paman he is admired. He is, however, often troubled by his dual life as a both brilliant superhero and as an unrewarded ordinary boy. He wishes to abandon his role as Perman, but he continues to be Paman out of a desire to help people caught in disasters. Soon, he meets other Pamen and teams with them. The other Pamen are: Paman 2: A monkey named Buuby Paman 3: A girl named Perko/Sumire Hosino Paman 4: A boy named Peryan Paman 5: A baby boy named Koichi In the end of the original story, he achieves the status of Superman and leaves to a planet for Supermen to become a superhero team. He returns shortly later. In the TV series, he stays on earth his whole life.::Swarup Basak'"
2410,Iblard jikan,"Animation,Short,Fantasy",movie,3,6.74,996.1280703639104,"'A fantastical city portrayed in artful pictures that come to life through animation, music and background sounds.'"
8057,Rouge: Ladys Comic Video,"Drama,Josei,Romance",movie,12,7.15,-10985.54210315557,
2132,Salad Juu Yuushi Tomatoman,"Adventure,Comedy",movie,1,7.17,27186.669477151452,
1820,Chicchana Yukitsukai Sugar Specials,"Comedy,Magic,Shoujo,SliceofLife",tv series,2,5.65,3026.2144550196026,"'Commonly known as the ""Dungeon,"" the city of Orario possesses a huge labyrinth in the underground. Its strange name attracts excitement, illusions of honor, and hopes of romance with a pretty girl. In this city of dreams and desires, new adventurer Bell Cranel has his fateful encounter with the tiny Goddess Hestia. Thus begins the story of a boy striving to become the best adventurer and a lonely goddess searching for followers both hoping to reach their goals and perhaps have some romance on the side.'"
1973,Four Seasons: Fuuka to Nanami,Cars,movie,1,5.91,7229.515007631881,
2495,Haru wo Daite Ita,"Drama,Romance,Yaoi",tv series,13,6.77,23433.34730863414,'The legendary burglar Lupin III sets off on an adventurous trip across Italy and San Marino.'
4901,Kakumeiki Valvrave,"Animation,Action,Drama,Romance,Sci-Fi,Thriller",tv series,5,8.15,129894.43977945493,"'True Calendar year 71-a new age where 70% of the human population lives in space thanks to the development of ""Dyson Sphere"", a city in space. The world is divided into two main powers: The Dorssia Military Pact Federation, a power which grew out of a military alliance, and the Atlantic Rim United States (ARUS), which grew in power as it expanded its trade agreements. The minor nation of JIOR has declared neutrality between these two forces and maintains its peace through economic prosperity. Within the JIOR\'s Sphere, Haruto Tokishima lived an ordinary life as a high school student in the division known as ""Module 77""-until the Dorssian military begins their sudden invasion.::Anonymous'"
11457,Inmu 2,Animation,movie,75,6.86,17657.347715500648,
6122,Zoku zubekô tenshî: nana iro hanâyomê,Crime,movie,2,6.76,10828.9599487014,
329,Neko hiki no Oruorane,"Animation,Short,Fantasy",movie,26,8.38,105394.84659386847,
6425,Amagami SS,"Animation,Drama,Romance",tv series,16,6.33,16254.700243573057,"'High school student Junichi Tachibana attempts to find love once again after having his heart broken last Christmas. This series follows his romantic endeavors in a sequence of six separate arcs, each involving a different heroine.'"
