anime_id,name,genre,type,episodes,rating,members,overview
31181,Daitoshokan no Hitsujikai Picture Drama,"Comedy,Ecchi",tv series,12,8.43,117970.55404941722,"'A white ermine escapes from an exotic pet store, and is found unconscious by a college student, who takes him home to his apartment complex. Now named ""Kojopî"", he struggles to adapt to his new life in the building; where he encounters the oft-eccentric human tenants, and their pets.::Akira (akira625@comcast.net)'"
5529,Mouryou Senki Madara,Action,tv series,1,6.72,-42605.9868132983,
28927,Detective Conan OVA 07: A Challenge from Agasa! Agasa vs Conan and the Detective Boys,"Adventure,Comedy,Mystery,Police,Shounen",tv series,12,7.84,269316.70476105576,
7844,Chibinacs 20,Comedy,tv series,1,6.15,-127952.9302213755,
31223,Sankarea OVA,"Comedy,Ecchi,Horror,Romance,Shounen,Supernatural",movie,12,6.5,-78837.28655031158,"'He trusts no one, only his sword.::Anonymous', 'This arc is a flashback showing Guts\' youth and what led him to become the ""Black Swordsman"". Guts grows up as a young mercenary until his enrollment in the Band of the Hawk. He develops complex relationships with Casca and Griffith, the Band\'s charismatic leader and holder of the Crimson Behelit, who leads the Band to its rise to prominence within the Midland army. Griffith is elevated from his commoner status to the nobility, causing some resentment, and after sleeping with the King\'s daughter, Griffith is imprisoned, and the Hawks are declared outlaws. The Hawks manage to rescue Griffith, only to find him broken mentally and physically. From a conventional medieval European background, the story shifts to fantasy and horror, with the apparition of the Eclipse ceremony that ends with the destruction of the Band, as per Griffith\'s sacrifice in order to become Femto, the fifth member of the God Hand, and reclaim his path towards his dream. Only with help from the enigmatic Skull Knight, were Guts and Casca able to survive. Unbelievably distraught over what transpired, Guts vows vengeance against Griffith and commits to his own personal war against the entities known as Apostles that slaughtered the Band of the Hawk.::http://en.wikipedia.org/wiki/Berserk_(manga)', ""Mercenary Guts, infamously known as The Black Swordsman, is defeated in combat by the skilled and charismatic Griffith. Afterwards, he's forced to join Griffith's group, The Band of the Hawk, and undertake many dangerous missions that soon turn bizarre."""
7709,Chiisana Itsutsu no Ohanashi,Kids,tv series,1,5.24,-10648.039757658122,
18095,Touch: Cross Road,"Animation,Drama,Sport",movie,12,6.98,126991.9732115512,"'Trying to find his own game of baseball, and not that of his brothers, Tatsuya moves to America and pitches for a poor, struggling minor league baseball team called the Emeralds. Meanwhile, Minami is still in Japan, trying to find her own path after quitting gymnastics. Inspired by a photograph of her final performance, she becomes the photographers assistant.::animenewsnetwork.com'"
13073,Hello Kitty no Fushigi na Mizuumi,"Fantasy,Kids",tv series,2,7.35,-108554.51157474531,"'An anthology series centering on different characters and locations, including a house with a murderous past, an insane asylum, a witch coven, a freak show, a hotel, a possessed farmhouse, a cult, and the apocalypse.', 'Both physical and psychological horrors affect a decomposing family, workers and residents of an insane asylum, a coven of witches, a cast of circus freaks, the employees and guests at a struggling hotel, a family who moved into a mysterious farmhouse, and the members of a small suburb in Michigan in this haunting anthology series, focusing on the themes of infidelity, sanity, oppression, discrimination, addiction, and exploitation.', 'American Horror Story is a horror series in which every season tells a different story. The first season is about a haunted house, and the family that has moved into it. The second season centres around an insane asylum and a man who is wrongly accused of murdering several women, including his wife. The third season tells the story of a coven of witches trying to figure out who their new ""supreme"" is. The fourth season is about a ""Freak Show"" and the lives of its performers. The fifth season is about the employees and guests at the Hotel Cortez, a building made as a secret torture chamber in the 1920s. The sixth season is about a farmhouse near Roanoke, North Carolina that is besieged by the ghosts of the infamous lost colonists and other strange happenings.::Erica Adina Amaral', 'American Horror Story is an horror television anthology series. Each season is conceived as a self-contained miniseries, following a disparate set of characters and settings, and a story-line with its own beginning, middle, and end. While some actors appear for more than one year, they usually play completely different roles in each season.::ahmetkozan', 'A house haunted by murderous spirits, a catholic insane asylum from the 60s, a coven of witches, a freak show starring some truly twisted characters, a hotel filled with serial killers run by a vampire countess, an isolated haunted shack that may hold the secrets to the disappearance of the Roanoke colony, a cult on the rise after the 2016 Presidential election and an outpost that hides the few survivors of the apocalypse. Every new season comes all new, wholly American terrors in this interconnected modern horror anthology series.'"
31642,Trinity Seven,"Animation,Action,Comedy,Fantasy,Romance",tv series,1,6.25,142294.92298136375,"'In this ""romantic comedy but sometimes serious magical school story,"" life as Arata Kasuga knows it is wiped out by a bizarre incident known as ""Collapse Phenomenon,"" which causes worldwide destruction and takes his cousin Hijiri Kasuga to the next world. To resolve the ""Collapse Phenomenon"" and bring back Hijiri, Arata enrolls in the Royal Biblia Academy. Waiting in the school are seven beautiful female magic users-The Trinity Seven.::Shakti Prasanna Mishra'"
10920,Miss Cinterrier's Groom,"Animation,Short",movie,4,6.19,214151.52863370976,"'The beautiful girl Cinterrier (like the terrier version of Cinderella), was proposed to by many dogs. Who finally got her heart?'"
3649,Robotics;Notes,"Animation,Action,Comedy,Drama,Mystery,Sci-Fi",tv series,1,5.8,155244.5925217442,"""2019, Divergence Ratio 1.048596. The near future, where a device popularly called the PokeCom, packaged with PhoneDroid OS, spreads, bringing the Augmented Reality world close to existence. Central Tanegashima High School's Robot Research Club is in danger of losing its club status. Kaito Yashio, one of only two members, is only obsessed with robot fighting games, showing no interest in the Robo Club even in this situation. The reckless, useless club head, Akiho Senomiya, aims to complete a giant robot, struggling hard to avoid losing the club's status. Then, one day, Kaito discovers the A.R. annotation that becomes the Kimijima Report. Written in that report is the indictment of someone named Kou Kimijima's conspiracy involving the world. (Source: VNdb)"""
7211,Suki ni Naru Sono Shunkan wo: Kokuhaku Jikkou Iinkai,"Comedy,Drama,Romance,School",tv series,26,6.4,108780.62221164454,"'Three sisters are bound to a mysterious house capable of teleporting through time and space. In their travels through twentieth century Japan with their robotic maid, they encounter the harsh realities of separation and loneliness as they are torn from the friends they unsuccessfully try to avoid making.::Teacakes'"
6277,Pica Don,"Animation,Short",movie,1471,6.48,-114413.22609500667,"'An animation documentary describing the tragic consequences of the A-bomb explosion in Hiroshima on August 6th, 1945. The flash of the A-bomb, 100 times brighter than the sun, is called ""PICA"", and the enormous shock wave which came right after the flash is called ""DON"". At the time this film was completed, it was the very first attempt in the world to deal with such a sensitive subject of Hiroshima using animation media. Because of this short film, the City of Hiroshima decided to establish the Hiroshima International Animation Festival in 1984, appreciating animation art as an effective medium.'"
20755,Elmer no Bouken: My Fathers Dragon,"Adventure,Fantasy,Kids",movie,26,6.13,242624.26383963556,"""A retired pop singer turned actress' sense of reality is shaken when she is stalked by an obsessed fan and seemingly a ghost of her past.::Kenneth Chisholm"", 'Mima leaves the idol group CHAM, in order to pursue her dream as an actress. Mima climbs up the rocky road to success by performing as rape victims and posing nude for magazines, but is haunted by her reflections of the past.::<H@jime>'"
5273,Shakugan no Shana S Specials,"Comedy,Parody",movie,49,7.46,86096.57334395997,
23593,Kamiwaza Wanda,"Kids,Sci-Fi",tv series,1,6.0,59847.98524249154,
31189,One Piece Movie 2: Nejimaki-jima no Daibouken,"Action,Adventure,Comedy,Fantasy,Shounen,SuperPower",tv series,2,6.87,102020.38791581651,'Sea Pirate Harlock and Tochiro try to find a lost clan of Japanese immigrants in this Westerns style version spin off.'
107,KO Seiki Beast Sanjuushi,"Adventure,Comedy,Fantasy,Mecha,Shounen,Supernatural",movie,13,7.34,207775.87539992752,
17987,Fairy Tactician,"Animation,Action,Adventure,Comedy,Fantasy",tv series,1,6.49,139799.3082065985,"""Mavis reveals her incredible skill as a strategist as the final event of the Grand Magic Games begins. Meanwhile, Natsu's squad tries to rescue Lucy."""
1007,Himekishi Olivia,Hentai,movie,6,7.87,202957.26677924205,'Pikachu and friends play peek-a-boo.'
9395,Mobile Suit Gundam: Zeonic Front - Indignation of Zeon,"Mecha,Military",tv series,20,6.58,205449.46848215422,"'A humorous and highly unpredictable animated series following a group of high school girls and their teachers.::Anonymous', 'An animated series based off of the four panel managa of the same name, Azumanga Daioh is a whimsical, hilarious and very cute look at the lives of an ecclectic group of high school girls and their teachers at a Tokyo high school. As the series progresses, small bits of their lives are shown, slowly painting a bigger picture as the cast shares the ups and downs of high school life, revolving around a close-knit friendship and a lot of silliness.::Anonymous', 'Azumanga Daioh, based on the 4-panel manga of the same name by Kiyohiko Azuma, is a charming and funny series that focuses on a group of girls - each with their own distinct personalities - at a high school in Japan. There\'s Chiyo, the adorable 10-year-old prodigy; Sakaki, the quiet girl who loves cute things but has trouble with a particularly vicious kitty; Tomo, the loud and energetic but untalented one; Kagura, a competitive and athletic girl; Yomi, the relatively level-headed member of the group; Kaorin, a shy girl with an unusual admiration for Sakaki; and Ayumu, a.k.a. ""Osaka"", a kind girl who just happens to always have her head in the clouds. The series also pays attention to a group of teachers at the school: Yukari, the English teacher with some rather juvenile tendencies; Minamo, Yukari\'s longtime friend/rival who teaches physical education; and Mr. Kimura, a creepy-looking, slack-jawed classic literature teacher who\'s not afraid to admit that he only became a teacher because he has a fetish for high school girls.::Anonymous'"
31749,Zeno: Kagiri naki ai ni,"Animation,Drama",movie,3,4.86,-88548.25635124971,
3817,Noroi no houteishiki,"Animation,Comedy,Drama",tv series,1,5.55,-125971.29454151221,
2952,Musekinin Kanchou Tylor,"Comedy,Military,Parody,Sci-Fi,Space",movie,1,8.17,-57238.602445079596,"""When Natsumi's father dies she return to the forest which she had visited with him with his motorcycle. She meets and decides to stay with a family who also own a store nearby.::aghaemi"""
31658,Boku wa Kimi wo Warawanai,Music,tv series,1,0.0,-51166.25185089267,
21161,Anime de Wakaru Shinryounaika,"Comedy,Seinen",tv series,1,6.57,27107.747118881358,"""Now there's no need to wait for individual volumes - you can get the entire epic all at once! Narue is an adorable school girl with a secret. She's really an alien with powers right out of a sci-fi comic book. Join our spunky heroine as she faces androids, alien invaders, and her first date with the boy next door. It's the sci-fi comedy that's a direct hit to your heart.::CPM"""
23225,Betterman,"Animation,Action,Horror,Mystery,Sci-Fi",tv series,1,7.95,63009.08553734691,"'A deadly virus known as has attacked humanity with vicious meaning. At the forefront of the battle is the mystifying Akamatsu Industries - disguised as a heavy machine factory in Tokyo, this undercover organization uses neural enhanced weapons known as NeuroNoids to battle Algernon. Also helping with their secret efforts is the mysterious mutant who is only known as ""Betterman"".::anonymous'"
4107,Duel Masters Cross Shock,"Action,Adventure,Comedy,Shounen",tv series,1,8.22,99103.68505183709,"""Yuuta Takemoto is a poor college student who lives in a dilapidated apartment building with his two friends, Shinobu Morita and Takumi Mayama. The series chronicles the students' story as they struggle through life and love.::dxg"""
2501,Tennis no Ouji-sama OVA Another Story II ~Ano Toki no Bokura,"Animation,Short,Sport",movie,26,7.02,61604.304626652316,
3151,Oppai Heart: Kanojo wa Kedamono Hatsujouki!?,Hentai,movie,26,6.29,12305.661364116148,"'A collection of short stories, all of which are perverted to various degrees.::Moh X'"
32788,Genji monogatari sennenki: Genji,"Animation,Drama,History,Romance",tv series,1,4.68,-181584.10939813365,"'The life of a handsome Japanese prince, and his various love affairs with several different women.::Q. Leo Rahman', ""Born from a much-loved but lowly ranked concubine, Genji Hikaru is called the Shining Prince and is the beloved second son of the Emperor. Although he cannot be an heir to the throne of his father, Genji spends his life surrounded by every pleasure and preference available. And yet, his fulfillment in love is something that even an Emperor's power can never grant him...::Genji"""
5581,Saint Seiya: Soushuuhen,"Adventure,Fantasy,Sci-Fi,Shounen",tv series,1,6.03,-9016.807250943597,"'Ten years ago, a child wished for the destruction of the world. Now, a group of people has the ability to grant their wishes depending on their power. They are called ""Order User. Before these great people who have the power of ""Order,"" one person excels the most with the ability to rule and conquer the world and turn people into puppets when it is in his jurisdiction. This power belongs to Hoshimiya Eiji, who is also responsible for the destructive phenomena that happened exactly ten years ago.'"
2392,Chii-chan no Kageokuri,"Drama,Historical",tv series,1,7.56,176986.74029755837,'A 11-year-old boy who loves soccer and soccer balls.::gazyzz'
3846,Sojunghan Nal-ui Kkum,"Comedy,Drama,Romance",movie,26,6.08,18098.63689267459,"'A small group squad of American soldiers find horror behind enemy lines on the eve of D-Day.::Chockys', ""Night of the 5 to the 6 June, 1944. On the eve of D-Day, several American paratroopers are dropped behind enemy lines to carry out a mission crucial to the invasion's success: destroy a radio tower built in a little castle of an old French town that it's close to Normandy's beaches, and that Third Reich uses as straight communication between Berlin and beaches' bunkers. Due to the intense enemy fire caused by cannons and machine guns, all the planes are shoot down and the most of the soldiers die in the landing or they are killed by Nazis' night patrols after to take land. However, a private named Ed Boyce survives to meet Corporal Ford, a last-minute incorporation from Italy and a veteran expert in bombs and explosives; Tibbet, a rogue sniper; Chase, a war photographer; and finally private Dawson. After to watch the killing of their superior Sargeant Eldson by a Nazi night patrol, Ford assumes the mission as leader of the group and they try to get the town when Dawson dies after to step a landmine. Burying him in the forest, they meet Chloe, a villager who refugees the soldiers in her house where she lives with her old and ill aunt and her elder brother, child Paul. But the mission complicates when by chance Boyce get into the Nazi radio tower, just to find a horrible secret experiment with human beings that it could bring the victory to Hitler and would change the fate of the world forever. With D-Day approaching, Boyce and the others begin to realize there is more going on in this Nazi-occupied village than a simple military operation, having to fight against supernatural forces not only to destroy the radio tower, but destroy the own experiment before Hitler's gets his Third Reich of thousand years he promised.::Chockys"""
2726,Kekkai Sensen: Ousama no Restaurant no Ousama,"Action,Fantasy,Shounen,SuperPower,Supernatural,Vampire",movie,2,6.58,10815.524292259042,'Pikachu and friends play peek-a-boo.'
11447,Kero Kero Keroppi no Sora wo Tobetara,"Adventure,Kids",tv series,1,5.7,74713.91919451943,
8146,Tokimeki Memorial: Only Love,"Animation,Drama,Romance",tv series,1,6.43,50675.774625866696,"'The story revolves around a second year high school student, Riku Aoba, who has just recently transferred to Holy Cross High School, where he notices, upon joining, several unique and funny occurrences, often being the target of a series of events and races administered by the student council and its fun-seeking president.'"
10203,Mahoromatic Summer Special,"Comedy,Ecchi,Romance,Sci-Fi",movie,1,5.71,95682.67036471046,"'Recorded every day for a year at exactly the same place and same time, this experimental film-poem documents the desire to clutch and hold each moment.::Anonymous'"
23477,Yoshimune,Animation,tv series,1,6.38,24497.62703635646,
8361,Meganebu!,"Animation,Comedy",tv series,1,6.96,24054.407959365417,
99,"Kamiusagi Rope tsuka, Natsuyasumi Rasuichi tte Maji ssuka!?","Adventure,Comedy,SliceofLife",movie,26,7.4,73613.94578797583,
30641,Shin Saishuu Chikan Densha,Hentai,movie,1,7.48,-110629.70366210272,"""While serving time in a brutal women's detention center. Eva wishes away her troubles to a set of tiny Worry Dolls. The dolls crawl in her ear at night and soon Eva becomes possessed.::Zoe Ferguson"""
30984,Gran Torino,Drama,movie,1,7.25,-16171.085792909005,"""Disgruntled Korean War veteran Walt Kowalski sets out to reform his neighbor, a Hmong teenager who tried to steal Kowalski's prized possession: a 1972 Gran Torino.::Anonymous"", ""Walt Kowalski is a widower who holds onto his prejudices despite the changes in his Michigan neighborhood and the world around him. Kowalski is a grumpy, tough-minded, unhappy old man who can't get along with either his kids or his neighbors. He is a Korean War veteran whose prize possession is a 1972 Gran Torino he keeps in mint condition. When his neighbor Thao, a young Hmong teenager under pressure from his gang member cousin, tries to steal his Gran Torino, Kowalski sets out to reform the youth. Drawn against his will into the life of Thao's family, Kowalski is soon taking steps to protect them from the gangs that infest their neighborhood.::alfiehitchie"", ""Walt Kowalski is an embittered Korean War veteran who has just lost his wife. The world has changed around him as well. His once all-white neighborhood is now mostly Southeast Asian and he has a Hmong family living next door. He doesn't get along with his sons and is out of touch with his grandchildren, all of whom seem more interested in getting his house than anything else. His pride and joy, however, is his mint condition 1972 Gran Torino. When the Hmong teenager who lives next door, Thao, is challenged by his cousin and other local gang members to steal it, Walt almost shoots him. Gradually, however, he realizes he has more in common with his neighbors than his own family and becomes something of a neighborhood hero when he prevents the gangbangers from forcing Thao into their car. He gradually takes Thao under his wing, teaching him a few things about life and helps getting him a job. Walt's intervention has a price, however, when the gang shoots up Thao's house and attack his sister Sue. For Walt, it's time to take action, though not in a way you would expect.::garykmcd"", ""Walt Kowalski is a retired auto worker and Korean War veteran living in Detroit. Recently widowed, Walt lives alone with his dog in a crime-infested neighborhood and has a strained relationship with his family. A Hmong family moves next door to Walt but he wants nothing to do with them. One night, one of the members of the family, Thao, is coaxed by his cousin 'Spider', a gang member, to steal Walt's prized Gran Torino. Thao botches the theft after getting caught by Walt. However, the duo reluctantly start a friendship as Walt seeks to straighten out Thao. As Walt's relationship with Thao extends to Thao's family, Walt is forced to defend them from Spider and his gang who begin to routinely attack Thao and his family.::Sam"", ""Elderly Walt Kowalski is recently widowed. Much of Walt's views of life are shaped by his time in the Korean War. On strained relations with his grown sons and not wanting the advice of the priest of his wife's church, Walt is a gruff man who has few friends. As such, he lives a solitary life with his pet Labrador retriever Daisy in the same house he has lived in for years, which is located in a working class Highland Park, Michigan neighborhood. Recently, the neighborhood has gone through changes where it is now racially mixed. The Lor family, of ethnic Hmong descent, move into the house next door to Walt's, the family which includes two teenagers, streetwise Sue and shy Thao. Initially Walt wants nothing to do with his new foreign neighbors. Slowly, Walt does get involved in Sue and Thao's lives, despite Thao having once tried to steal Walt's beloved 1972 Gran Torino. That attempted theft was a Hmong gang initiation ritual, a gang to which Thao does not want to belong. Walt sees that Sue and Thao will never be able to live in peace as long as that gang exists. As his teen-aged neighbors' unofficial protector, Walt has to figure out how best to restore his sense of right in the neighborhood.::Huggo"", 'In Michigan, the grumpy widower Walt Kowalski is a Korean War veteran full of prejudice that has just lost his beloved wife Dorothy. He is one of the last Caucasian Americans in his neighborhood and does not have good relationship with his sons and their families; therefore he is a lonely man. When his teenager neighbor Thao Vang Lor is pressed by his cousin Smokie to join his Hmong gang, he is assigned to steal the Gran Torino of Walt as part of his initiation in the gang. However, he is surprised by the old man and his traditional family feels ashamed with the incident. Later Walt saves Thao first and his sister Sue Lor from gangs and he has the gratitude of his next door neighbors and the neighborhood. On the day of his birthday, Walt is invited by Sue to join her family reunion and he begins a relationship with his neighbors, helping Thao to get a job. However, he realizes that the Hmong gang disturbs the neighborhood and after a coward attack of the gangster, Walt decides to take an ultimate attitude.::Claudio Carvalho, Rio de Janeiro, Brazil'"
11689,Galaxy Angel,"Animation,Comedy,Sci-Fi",tv series,1,3.68,152510.9464415925,"'The astronomical adventures of the Angel Brigade, a squad of females dispatched to retrieve powerful objects scattered around the Milky Way.::Serena Tsukino', 'The Angel Brigade is a five team members military branch of Transbaal Empire military. There mission is to track down and find the ""Lost Technology"". Somehow they most of the time mess up on the mission by getting into trouble and weird situations.::David'"
