anime_id,name,genre,type,episodes,rating,members,overview
31223,Sankarea OVA,"Comedy,Ecchi,Horror,Romance,Shounen,Supernatural",movie,12,6.5,32470.0,"'He trusts no one, only his sword.::Anonymous', 'This arc is a flashback showing Guts\' youth and what led him to become the ""Black Swordsman"". Guts grows up as a young mercenary until his enrollment in the Band of the Hawk. He develops complex relationships with Casca and Griffith, the Band\'s charismatic leader and holder of the Crimson Behelit, who leads the Band to its rise to prominence within the Midland army. Griffith is elevated from his commoner status to the nobility, causing some resentment, and after sleeping with the King\'s daughter, Griffith is imprisoned, and the Hawks are declared outlaws. The Hawks manage to rescue Griffith, only to find him broken mentally and physically. From a conventional medieval European background, the story shifts to fantasy and horror, with the apparition of the Eclipse ceremony that ends with the destruction of the Band, as per Griffith\'s sacrifice in order to become Femto, the fifth member of the God Hand, and reclaim his path towards his dream. Only with help from the enigmatic Skull Knight, were Guts and Casca able to survive. Unbelievably distraught over what transpired, Guts vows vengeance against Griffith and commits to his own personal war against the entities known as Apostles that slaughtered the Band of the Hawk.::http://en.wikipedia.org/wiki/Berserk_(manga)', ""Mercenary Guts, infamously known as The Black Swordsman, is defeated in combat by the skilled and charismatic Griffith. Afterwards, he's forced to join Griffith's group, The Band of the Hawk, and undertake many dangerous missions that soon turn bizarre."""
759,Ghost in the Shell Arise: Alternative Architecture,"Animation,Action,Drama,Sci-Fi",tv series,1,8.32,89424.0,'A recompilation of the 4 original Ghost in the Shell: Arise movies plus 2 episodes that tie in the story with Kôkaku Kidôtai (2015).'
24197,Newest Coast Guard Ship/Carrier Battle Group/Tanks/XM-29 Rifle,"Documentary,Comedy,History,War",tv series,1,5.65,360.0,
27663,Apo Apo World: Giant Baba 90-bun 1-hon Shoubu,"Comedy,Sports",tv series,25,8.2,36251.0,
19021,Saint Seiya: The Hades,Action,tv series,1,7.37,34272.0,
975,Itazura post,"Animation,Short",movie,2,7.37,12389.0,
7021,Antique Heart,"Animation,Short,Mystery",movie,1,5.16,344.0,"""There's an old decrepit building at the edge of the school grounds that hasn't been used for years, and it falls apart a little bit more each day. But the little house holds a secret, as Takahiro and his friends are soon to find out...they wind up making contact with a mysterious entity known as Saki. Can Takahiro save Saki's world from destruction."""
13365,Appleseed Alpha,"Animation,Action,Sci-Fi",movie,1,4.3,94.0,"""Based on the comic book by the creator of Ghost in the Shell, a young female soldier Deunan and her cyborg partner Briareos survive through the post World War 3 apocalyptic New York in search of human's future hope, the legendary city of Olympus.::SAI"""
2045,Dragon Quest Great Adventure of Dai! Destroy!! The Reborn 6 Commanders,"Animation,Short,Action,Adventure,Fantasy",movie,1,6.58,498.0,"'The Kingdom of Papunika is being rebuilt with the help of all the inhabitants, including the heroes. On the other side Hadler is in a delicate situation because Freizard has been destroyed and now there are only three generals of his army of the darkness. Out of surprise appears Galvass, a demon who came to get rid of Fly and his friends instead.'"
32228,Tomato ni Natta Otokonoko,Kids,tv series,12,6.82,5990.0,
11699,Akatsuki no Yona OVA,"Animation,Action,Comedy,Fantasy,Romance",tv series,1,6.37,1747.0,
195,The 15:17 to Paris,"Biography,Drama",movie,12,7.35,99558.0,"'Americans discover a terrorist plot on a Paris-bound train.', ""In the early evening of August 21, 2015, the world watched in stunned silence as the media reported a thwarted terrorist attack on Thalys train #9364 bound for Paris--an attempt prevented by three courageous young Americans traveling through Europe. The film follows the course of the friends' lives, from the struggles of childhood through finding their footing in life, to the series of unlikely events leading up to the attack. Throughout the harrowing ordeal, their friendship never wavers, making it their greatest weapon and allowing them to save the lives of the more than 500 passengers on board."""
15815,Mecha Afro kun,Animation,movie,1,6.92,88.0,
2745,Robin-kun to 100 nin no Otomodachi Season 2,Kids,tv series,3,7.3,1426.0,'The legendary burglar Lupin III sets off on an adventurous trip across Italy and San Marino.'
2249,Master Blaster,Short,movie,1,5.6,2781.0,
1190,Jigoku Sensei Nube OVA,"Animation,Action,Thriller",movie,1,7.48,11817.0,"'Nube fights a demon who resides inside walls, confronts a young spirit who wants her harmonica back, and in the end he must battle a powerful demon named Zekki - brother of Baki, demon that resides within Nueno.::animenewsnetwork.com'"
4565,Sailor Suit and Machine Gun: Graduation,"Action,Romance",movie,1,8.64,82253.0,"'Yakuza underboss and schoolgirl Hoshi Izumi intends to become a regular student once again following a period of unleashing bloody revenge upon those who murdered the former yakuza boss. However, the fix is in when a classmate dies in a haze of drug-related circumstances. Izumi is compelled to redraw her machine gun and train it on a cadre of unsavoury businessmen, politicians and yakuza.::aghaemi'"
1302,Qi ren yan fu,,movie,1,7.45,4199.0,
30751,Ore no Imouto ga Konnani Kawaii Wake ga Nai: SD Chara ni Yoru Character Commentary,Comedy,movie,13,6.4,619.0,"""The short film's main character is a water spider who seems to have fallen in love with a water strider. Though she is scared of him at first, the water strider soon gets used to the presence of the spider.::Wikipedia"""
3463,Bakemonogatari,"Animation,Action,Comedy,Drama,Fantasy,Romance",tv series,1,5.38,1034.0,"'Third-year high school student Koyomi Araragi is human again. Cured of his vampirism, he seeks to help other supernaturals with their problems. Koyomi becomes involved in their lives, revealing secrets in people he once knew.::TheUnbeholden', ""Follows the adventures of Koyomi Araragi, a former vampire. One day, a classmate named Hitagi Senjougahara, a loner, falls down the stairs into Koyomi's arms. Hitagi appears to weigh next to nothing, defying physics. Despite being threatened by her to keep away, Koyomi offers his help, and introduces her to Meme Oshino, a strange middle-aged man living in an abandoned building, who cured him of vampirism. Koyomi becomes gradually more involved in cases related to unusual supernatural creatures, meeting new people and discovering secrets in the people he thought he knew.::TheUnbeholden"""
17439,Jinki: Extend,"Animation,Sci-Fi",tv series,1,6.13,109.0,"'A 12-episode mecha anime series that aired on TV Asahi in 2005. It detailed the lives of two pilots of special robots called ""jinki"", and the manipulation behind the scenes that drew them inexorably together in a final battle.::Danny Lilithborne <dannysl@grex.cyberspace.org>'"
13311,Tottoko Hamtarou Movie 4: Hamtaro to Fushigi no Oni no Emon Tou,"Adventure,Comedy,Kids",tv series,1,4.19,269.0,'A defunct high school basketball team finds a new student and things may start looking up for them.'
1808,Nichiro sensô hyaku nen ni maru san kôchi no higeki ha naze okita no ka,History,tv series,26,7.51,30747.0,
6117,Wolf's Rain,"Action,Sci-Fi,Animation,Fantasy,Adventure,Drama",tv series,51,6.73,4162.0,"'In a post-apocalyptic future where humans live in domed cities surrounded by wasteland, wolves are assumed to be two hundred years extinct.::Anonymous', 'In a post-apocalyptic future where humans live in domed cities surrounded by wasteland, wolves are assumed to be two hundred years extinct. Yet wolves do walk among them, disguising themselves as humans in order to survive in the human world. Now four young wolves will follow the scent of Lunar Flowers on a dangerous quest to find that which legend promises them: Paradise.::Anonymous'"
5029,Circuit Angel: Ketsui no Starting Grid,Action,tv series,1,8.16,9943.0,
5031,Gakuen no Shuryousha,Hentai,tv series,2,7.09,2155.0,
2523,Hatsukoi Monster,"Animation,Comedy,Drama",tv series,12,6.38,7748.0,"""Nikaido Kaho is a daughter of a rich family and her whole life everyone's been nice to her. When moving to her new high school dormitory, she almost gets hit by a truck but is saved by a boy. It's love at first sight for Kaho but when asking him his name, he tells her she's weird. Kaho is shocked since it's the first time anyone's ever said mean things to her. Soon enough, she finds out that the boy who saved her lives in the same dormitory and so she bravely confesses her love. The boy says his name is Kanade and agrees to go out with her. Unfortunately, the following day Kaho finds out that her first boyfriend is a 5th grader."""
2870,HORIZON feat. Hatsune Miku,"Animation,Short,Music",movie,1,6.57,3770.0,
28761,Shuangsheng Lingtan,"Mystery,Psychological",tv series,1,5.21,2386.0,
1284,Ao no 6-gou,"Action,Adventure,Mecha,Military,Sci-Fi",movie,3,6.12,945.0,"""Steven Gold is a stand-up comedian who is flat broke and has recently dropped out of medical school. He and several others work regularly at the Gas Station, a New York comedy club. The wages are lousy and everybody hopes for the big break. Lilah Krytsick is housewife with an ambition to be a stand-up comedian, however she doesnt seem to have the talent. Steven takes her under his wings and teaches her the art of comedy and humour. But when a TV station arranges a comedy evening at the club, Steve sees his opportunity for fame and stardom. Their friendship seems quickly forgotten and now it's every man and woman for him- or herself!::Mattias Pettersson <seaman@sbbs.se>"""
387,Doraemon Movie 29: Shin Nobita no Uchuu Kaitakushi,"Adventure,Comedy,Fantasy,Kids",tv series,13,8.07,120731.0,"""Yuuta Takemoto is a poor college student who lives in a dilapidated apartment building with his two friends, Shinobu Morita and Takumi Mayama. The series chronicles the students' story as they struggle through life and love.::dxg"""
26085,Future GPX Cyber Formula Sin,"Drama,Sci-Fi,Shounen,Sports",movie,12,5.91,19761.0,
32039,Yoru no okite,"Animation,Short",movie,12,6.29,5672.0,
34009,Oh! Toumei ningen,"Comedy,Sci-Fi",movie,12,6.61,14718.0,"'Based on a legendary Japanese charismatic comic! ""Oh! Invisible Man"" of the sexy comedy has been miraculously adapted to the screen again! ! Gene of salmon roe has been passed on the daughter from her father, and now both of them have the ability to be invisible... The hilarious comedy has been back!(C)2014 YASUHIRO_NAKANISHI/SHONEN-GAHOSHA/INTERFILM'"
13349,"Kemeko Deluxe!: Izumi-chan, Fukenkou yo! (Kari)",Ecchi,tv series,13,7.54,15661.0,
3451,Sea Prince and the Fire Child,"Animation,Drama,Family,Fantasy,Romance",movie,26,6.25,151.0,"'A prince of the sea and a child of fire engage in a tragic forbidden romance.::aerith of the slums', 'Years after the war between the Children of Water and the Children of Fire, Oceanus, a god of the sea, presents Prince Sirius with the eye of Algarock, thereby putting him in charge of those that dwell under the waves. But when Sirius encounters a beautiful Fire Child named Malta (the daughter of the Queen of Fire), he is lost in love and defies the law that states that Children of Water and Children of Fire must forever remain separate to prevent war from breaking out once more. Sirius and Malta struggle to be together while running into obstacles and suffering great losses along the way. But in the end, are the echoes of history too loud to overcome, or can the two lovers be united and bring peace to the land?::Bones729 <outerlimitsbab@hotmail.com'"
3034,Daisuki! Hello Kitty,"Fantasy,Kids",movie,2,5.93,2004.0,"'A group of friends were separated when one of them died in an accident. Later on she comes back as a ghost trying to get into heaven but to do that her friends must grant her a wish.', 'A group of friends were together forever until one of them died and they all went there separate ways. One day the leader of the group was able to see the girl that died and what has to do is grant her, her wish so she can rest in peace but this means that he must regroup all of his childhood firends'"
5475,Tezuka Osamu ga Kieta?! 20 Seiki Saigo no Kaijiken,Mystery,tv series,26,6.35,305.0,
12181,Bernard,"Animation,Comedy,Family",tv series,12,6.67,131.0,'Meet this curious polar bear that travels around the world learning about us. If anything can go wrong for him - it will go from bad to worse.::E-boy'
28157,Chein kuronikuru: Hekuseitasu no hikari,Animation,tv series,1,7.22,2935.0,
5640,Crayon Shin-chan Manatsu no Yoru ni Ora Sanjou! Arashi wo Yobu Den-O vs Shin-O 60-bu Special!!,"Action,Comedy,Kids,Shounen,SuperPower",movie,1,6.07,402.0,
27951,Moyashimon CGI Anime,"Comedy,School,Supernatural",movie,1,4.95,168.0,
985,"Love, Chunibyo & Other Delusions!","Animation,Comedy,Drama,Fantasy,Romance",tv series,1,7.82,43673.0,"'Yuuta suffered from ""chuunibyou"" while he was in middle school. When he graduated, he try to forgot about it but he accidentally got into a contract with Rikka and disrupts his desperately ordinary life.::anonymous'"
30095,Stardom,"Drama,Comedy",movie,1,6.78,82.0,"'A young girl is plucked from small-town obscurity and thrust into the spotlight of the glamorous world of super-models.::Anonymous', 'A sports photographer in rural Canada sends a picture of a high school athlete, Tina Menzhal, to a Montréal fashion agency. This starts Tina on a career taking her from Canada to Paris to Montréal again, to Manhattan, to the world, and then home, through two boyfriends, two husbands, and innumerable TV interviews, either with nasty smiling scandalmongers or with gushing witless twits. In nearly every case, Tina never gets to finish a sentence. She has a suave agent, paparazzi are everywhere (""What the celebs forget, there\'s always a camera,"" says one), and a documentary filmmaker is on hand as well. What is it that Tina thinks, feels, and wants: will we ever find out?::<jhailey@hotmail.com>'"
17875,Gun Frontier,"Animation,Action,Comedy,Drama,Sci-Fi,Western",tv series,2,7.45,19904.0,'Sea Pirate Harlock and Tochiro try to find a lost clan of Japanese immigrants in this Westerns style version spin off.'
28067,Angélique,"Adventure,Drama,History,Romance",movie,1,3.57,104.0,"'In the first of the Angélique series, the beautiful feisty teenage heroine becomes entangled in a political assassination plot and is betrothed to a stranger who is twelve years her senior and a reputed sorcerer.::L. Hamre', ""In this first part of the Angélique cycle, set in Mid-17th century France under the young Sun King Louis XIV, still struggling for his throne, while beggars and brigands roam the country, Angélique de Sancé de Monteloup, fifth child of an impoverished country nobleman in the Poitou marshlands, expected to struggle for a meager subsistence, educated in a nunnery, is betrothed at 17 to Joffrey de Peyrac, the 12 years older rich but cripple Comte de (count of) Peyrac de Morens and seigneur (Lord) of Toulouse, scarred in the face and said to be a sorcerer, in fact practicing oriental mining techniques which make his vast fortune. For the sake of her family, Angélique reluctantly agrees to the match but refuses the advances of her husband, who does not enforce his conjugal rights, wishing only to win her heart. As Angelique gradually discovers virtuous Peyrac's remarkable talents as scientist, musician and philosopher, she falls passionately in love with him. Joffrey's unusual way of life is threatened by the ambitious Archbishop of Toulouse, and soon the jealous young king Louis XIV: Joffrey is arrested for 'sorcery'. Angélique single-handedly faces the royal court, surviving murder and poison attempts on herself in a fruitless effort to save Joffrey from the stake. Intent on revenge and survival on her own, Angélique desperately joins the dark Paris underworld, finding it now ruled by her youth friend, farmer's son Nicolas, whose true love she had forsaken for her arranged marriage.::KGF Vissers"""
20541,Kyouryuu no jidai,Documentary,tv series,12,7.59,133385.0,
8862,Corporal Norakuro,"Animation,Short,Comedy",movie,1,6.06,128.0,"'The Fierce Canine Army has been given the day off, but Norakuro has no home to return to. After he goes to a yakitori (fried chicken) shop for a drink, he goes to the park to take a short nap. Just then, soldiers from the Mountain Monkey Army, who have stolen some secret documents, make their appearances and Norakuro goes after them in hot pursuit. When the Mountain Monkey troops appear to have made their escape in a hot air balloon, Norakuro, as a last desperate measure, climbs into a tube designed for launching fireworks and blasts himself right into the balloon. He retrieves the stolen documents, but the plot unfolds in an unexpected manner.'"
31201,Haou Daikei Ryuu Knight: Adeu Legend II,"Action,Adventure,Fantasy,Mecha",movie,1,7.27,408.0,
723,Orange,"Animation,Drama,Romance,Sci-Fi",tv series,1,6.84,2110.0,"""One day, Naho Takamiya receives a letter written to herself from ten years in the future. As Naho reads on, the letter recites the exact events of the day, including the transfer of a new student into her class named Kakeru Naruse. The Naho from ten years later repeatedly states that she has many regrets, and she wants to fix these by making sure the Naho from the past can make the right decisions, especially regarding Kakeru. What's more shocking is that she discovers that ten years later, Kakeru will no longer be with them. Future Naho asks her to watch over him closely."""
5298,Future Card Buddyfight,"Animation,Action,Sci-Fi",tv series,1,7.12,5176.0,"'It is the year 2030, and the stage is the capital of Japan, Chou-Tokyo. Through ""Buddyfight"", humans have started cultural interactions with residents from other worlds called ""Affinity Dimensions"". Buddyfight is a game with selected humans as the ""Buddyfighter"", and residents from the other world as the partner (known as ""Buddy Monster""). These battles have high significance and sometimes it is even used to decide the fate of a nation, and naturally there are those who seek to use the Buddy Monsters for evil purposes.::Crunchyroll'"
4730,The Tale of Japanese Envoys to Tang Dynasty China,"Animation,Short",movie,1,5.96,2238.0,
5931,Shiroishi no Yousei Pichi,"Fantasy,Historical,Kids",movie,1,6.07,348.0,
27457,China Moon,"Crime,Mystery,Romance,Thriller",movie,26,5.25,65.0,"""Detective Kyle Bodine falls for Rachel Munro who is trapped in a violent marriage. After shooting her husband, Kyle reluctantly agrees to help hide the body, but Kyle's partner is showing an unusual flair for finding clues.::Rob Hartill"""
31894,Beyond,"Drama,Fantasy,Mystery",tv series,1,6.52,658.0,'A young man wakes up from a 12 year coma to discover new abilities that come to propel him into the middle of a dangerous conspiracy.::Camila Nicole Aldebol'
11711,Cardfight!! Vanguard Movie: Neon Messiah,"Action,Adventure,Demons,Game,Shounen",tv series,1,5.67,69.0,"'When evil awakes, the deity of Fate will choose six heroes to save the world from ruination.::Mattias1'"
15439,Muteki Robo Trider G7,"Comedy,Mecha,Sci-Fi,Space",tv series,1,7.75,14775.0,"'Fujita Reiji is the owner of an art gallery, Gallery Fake. He deals with fake items, and is also familiar with the black market. However, he has a special talent for art, and used to work for the Metropolitan Museum of Art in New York as a curator.::https://myanimelist.net/anime/364/Gallery_Fake?q=Gallery%20Fake'"
679,Imawa no Kuni no Alice (OVA),"Action,Psychological,Shounen,Supernatural,Thriller",movie,3,6.75,3210.0,
33572,Nabari no Ou,"Animation,Action,Comedy,Drama",tv series,12,5.31,5027.0,"""In the shadows of this world, ninjas fight for control of an ancient technique which holds untold strength. This coveted power dwells within apathetic Miharu, a fact the guy really couldn't care less about - until the rival clans bring their battle to him. Now, he must choose a side if he hopes to survive - but when conflict is waged in secret, friend and foe prove difficult to tell apart."""
3105,Morita-san wa Mukuchi,"Comedy,School,SliceofLife",tv series,1,6.2,2068.0,"'The survivors of Kanto\'s Hell Earthquake built a new city and christened it ""Hope Town"". However, this peaceful town becomes a nightmare when it\'s raided by the motorcycle gang, ""Hell\'s Wind"". They abduct the women while the remaining townsfolk are left helpless against them. Meanwhile, a boy, Saburo, meets Jun. Jun\'s lover was previously murdered, and the duo help one another to fight against Hell\'s Wind. The battles are getting more and more difficult, but with the appearance of Violence Jack, the citizens seem to gain the upper hand against Hell\'s Wind.'"
22345,YAT Anshin! Uchuu Ryokou 2,"Adventure,Comedy,Sci-Fi,Shounen",movie,12,3.92,77.0,"'Minky Momo travels through time and teams up with her previous magical princess self to help an old man.', 'It is said that train stations are not only an end and a beginning for many, but also are a place for lost and forgotten objects - and for those who are forgotten. On a rain-soaked day, Minky Momo rides the train towards her final destination and converses with an old man who is trying to reunite with someone very important to him. After discovering he left his passport on the train, Momo embarks to try to find him and consequently runs into both her parallel self, and a young girl who is in need of both of their help.::Tenchi'"
5578,The Scribbling Kitten,"Animation,Short",movie,7,7.41,2177.0,"""Yasuji Mori's short about a kitten drawing pictures on a wall."""
19023,Active Raid: Kidou Kyoushuushitsu Dai Hachi Gakari 2nd,"Comedy,Mecha,Police,Sci-Fi",tv series,12,7.04,29679.0,
23581,Classroom Crisis,"Animation,Drama,Sci-Fi",tv series,2,6.7,297.0,"""With aims to one day reach out into the stars, humanity has colonized all the planets of the solar system. This story of young high school hopefuls is set in Fourth Tokyo in a Japanese Martian prefecture. Iris Shirasaki is a third year student/aspiring test pilot. Mizuki Sera is her peer/mechanic and Mizuki's brother Kaito is their homeroom teacher and the young director of the program developing their talents.::Crunchyroll"""
6909,"Yakushiji Ryouko no Kaiki Jikenbo: Hamachou, Voice &amp  Fiction","Mystery,Police,Supernatural",tv series,1,7.19,1163.0,"'The increase in income disparity, progressive environmental pollution, unresolved waste problems, waiting lists for child care, corruption continues. The government, stained by personal interests, does not can do nothing against the many problems. In this situation, with Japan cornered, the idols rise to save the day. The Heroine Party, Sunlight Party, Starlight Party, Bishoujo Party, Wakaba Party, New Subculture Party, and SOS Party, of these seven idol political parties, the idols that have become members of the legislature and representatives of each prefecture, will break the stalemate that covers Japan, using the power of song and dance. They will bring back the smiling faces of the people, and they will envelop Japan in a bright aura.'"
9959,Channel 55 4th Season,"Comedy,Parody",tv series,1,7.51,465.0,"'In a city where the paranormal and ordinary co-exist, the Libra organization battles to ensure peace and order.', ""A breach between Earth and the netherworlds opened up over the city of New York, trapping New Yorkers and creatures from other dimensions in an impenetrable bubble. Over time, this bubble became Jerusalem's Lot, a homeworld of wondrous beings and crazy sci-fi sensibilities. Now someone is threatening to sever the bubble and unleash chaos across the dimensions, and it's up to a special group of superhumans to preserve Jerusalem's Lot."""
31578,Kanojo ga Kanji wo Suki na Riyuu,"School,SliceofLife",movie,26,4.71,7131.0,
34367,Toulouse,,tv series,1,5.97,582.0,
1138,Charlotte the Young Shoot,,tv series,52,7.13,30148.0,
31258,Innocent Venus,"Animation,Sci-Fi",tv series,1,3.61,98.0,
1502,Blade Dance of the Elementalers,"Animation,Action,Comedy,Fantasy,Romance",tv series,26,6.93,3501.0,"""In a world where spirits exist and only pure maidens have the privilege of contracting with the spirits maidens from noble families gather at Areishia Spirit Academy where they are trained and given an Elite's education in order to qualify to become an elementalist. Enter Kamito Kazehaya."""
5670,Hundred,"Animation,Action,Romance,Sci-Fi",tv series,12,7.23,12825.0,"'Hundred is the only weapon that can counter the mysterious Savage life form attacking Earth. To become a Slayer who wields this Hundred, Hayato Kisaragi successfully enrolls in the marine academy city ship Little Garden. However he feels a strange yet familiar sense of incongruity towards Emil Crossford, his roommate who somehow knows him from somewhere. On top of that, as soon as he enters the school, he is challenged to a duel by the ""Queen"" and the school\'s most powerful Slayer, Claire Harvey.'"
3615,Dragon Ball Z: Dead Zone,"Animation,Short,Action,Adventure,Fantasy,Sci-Fi",movie,13,7.01,24149.0,"""In order to wish for immortality and avenge his father, Garlic Jr. collects the dragon balls, kidnapping Goku's son Gohan in the process. Goku, Kami, Piccolo, and Krillin unite to rescue Gohan and save the world from being sucked into a dead zone.::page8701"""
25085,AfterBuzz TV's Transformers: Robots in Disguise After Show,Talk-Show,tv series,2,6.38,69.0,
