anime_id,name,genre,type,episodes,rating,members,overview
3793,Nogsaegjeoncha Haemosu,"Action,Adventure,Fantasy,Shounen",tv series,2,5.48,43039.58709273302,"""Usavich is a series about an odd pair of rabbits imprisoned in a Soviet Gulag. Shows the absurd everyday occurrences of the two rabbits' prison life, and the the two rabbits' life on the run from law enforcement."""
1642,Manga Doushite Monogatari,"Adventure,Comedy,Kids",tv series,51,7.56,137602.6480021921,"""Elected as student council president with 98% of votes, Medaka is a brilliant students who will help students any way she can. This leads to the introduction of a suggestions box, which will later be given the nickname of 'Medaka Box'. Some of the suggestions therein, however, will provide some tough challenges for her and her student council friends.::Mattias1"""
5449,Busou Shoujo Machiavellianism,"Action,School,Shounen",movie,1,6.62,16884.130436946936,"'Set of rapid telescopic images of a gym, in fast forward, traveling through itself, space and time.::Alp'"
29766,"Ano Natsu de Matteru: Bokutachi wa Koukou Saigo no Natsu wo Sugoshinagara, Ano Natsu de Matteiru","Comedy,Drama,Romance,Sci-Fi,SliceofLife",movie,1,5.11,-195661.06215309305,
2467,Eightman,"Action,Sci-Fi",tv series,35,6.74,-4233.527337524914,
1784,Nyaruko: Crawling with Love,"Animation,Action,Comedy,Fantasy,Romance,Sci-Fi",tv series,2,5.6,-139149.75971282617,"""Actual H.P. Lovecraft's alien god of chaos from Cthulhu Mythos appears to a high school boy in the form of a whimsical girl Nyaruko claiming that it's there to protect him from other alien godlike races who want to abduct him.::Anonymous"""
3414,Go Go Toraemon,"Comedy,Sports",movie,78,6.09,7980.626173758377,"'During the course of one day, a group of students at a school in Los Angeles find themselves caught up in a plot of sex, lies and dead bodies.::Anonymous'"
11319,Ef: A Tale of Melodies.,"Animation,Drama,Romance",tv series,12,7.77,53262.871075452655,"'In a story set years in the past, Himura Yuu is a studious and diligent young man intent solely on maintaining his top academic position at Otowa Academy. One day, he meets a mysterious girl named Amamiya Yuuko, who, to his surprise, recognizes him. Memories of a distant childhood, memories rather left forgotten - meeting Yuuko again will force Yuu to confront the regrets and sorrows of their collective pasts and presents. In the present, Kuze Shuuichi may seem like a womanizer, but upon closer inspection, is a man who would rather be left alone. Hayama Mizuki, however, is not the type of girl who would let him be, especially after hearing the beautiful sounds of his violin performance. As Mizuki attempts to become closer to him, Kuze attempts to push her away - the tale of their budding relationship is darkened with undertones of an imminent tragedy.'"
10683,Toushindai no watashi,Short,movie,4,7.24,83074.94378762951,
2779,Tanaka-kun wa Kyou mo Kedaruge,Comedy,tv series,2,5.68,-220927.1529293153,
2579,Hentai Ouji to Warawanai Neko: Henneko BBS,Comedy,tv series,26,6.86,-38072.74909524308,"'In mystical times, Kingdom of Mongaul conquers the kingdom of Parro. Only princess Rinda and prince Remus escape destruction of the palace. In jungle, they meet and befriend an amnesiac warrior with body of a man and head of a leopard.::Anonymous'"
9824,Ashiaraiyashiki no Juunin-tachi,"Action,Fantasy,Seinen,Supernatural",movie,1,6.49,11152.419641036859,
839,Pokemon: Pikachu no Kirakira Daisousaku!,"Adventure,Comedy,Fantasy,Kids",tv series,2,6.3,111492.95827494204,"""2019, Divergence Ratio 1.048596. The near future, where a device popularly called the PokeCom, packaged with PhoneDroid OS, spreads, bringing the Augmented Reality world close to existence. Central Tanegashima High School's Robot Research Club is in danger of losing its club status. Kaito Yashio, one of only two members, is only obsessed with robot fighting games, showing no interest in the Robo Club even in this situation. The reckless, useless club head, Akiho Senomiya, aims to complete a giant robot, struggling hard to avoid losing the club's status. Then, one day, Kaito discovers the A.R. annotation that becomes the Kimijima Report. Written in that report is the indictment of someone named Kou Kimijima's conspiracy involving the world. (Source: VNdb)"""
8176,Binetsu Hime: Zange no Shou,Hentai,movie,8,6.05,146569.2530701777,"'Earth has been attacked by the Black Nebula Empire and is threatening to blow up the planet if they are counterattacked, The Yamato crew try to defuse the bomb.'"
18007,Nisekoi: False Love,"Comedy,Drama,Romance",movie,0,6.47,126092.72095876036,"'Two children of rival gangster families are betrothed to each other to ensure a truce. They dislike each other in the beginning, but over time they start to like each other.'"
24839,Seimei no Kagaku: Micro Patrol,Adventure,movie,7,4.21,183911.2132318827,"'Ken wants justice for his brother Bill, who was killed by a notorious gunman named Stevens for a goldmine map. The gunman is arguing with gangster Malone about the map. A deadly cat and mouse game between the three men ensues.', 'Ken wants justice for his brother Bill, who was killed by a notorious gunman named Stevens for a goldmine map. The gunman is arguing with gangster Malone (Horst Frank) about the map. A deadly cat and mouse game between the three men ensues.'"
2264,Ribbon no Kishi Pilot,Adventure,tv series,1,7.25,-166791.24083947798,
1741,Vampire Knight Guilty,"Animation,Action,Horror,Romance",tv series,4,5.63,45216.019919842205,'Vampire Knight is a story about how Vampires Survive without drinking blood::Amalee Woolman'
21831,Medaka no Gakkou,Comedy,movie,1,5.01,72332.12526738468,
2866,Saru to kani saru to kani no gassen,"Animation,Short",movie,4,6.96,48811.82871863947,
22473,Genroku koimoyo Sankichi to Osayo,"Animation,Short",movie,1,5.54,932.1951839424886,
30958,Ryoujoku Hitozuma Onsen,Hentai,tv series,5,5.0,-12444.560551403703,
4067,Xiong Chu Mo Zhi Conglin Zhongdongyuan,"Comedy,Kids",tv series,50,6.63,-4793.191135276465,"'20 young entrepreneurs compete in several business tasks, and must survive the weekly firings in order to become the business partner of one of the most successful businessmen.', ""Sir Alan Sugar - the £700m owner of AMSTRAD, is presented with 14 candidates, he must split the candidates up into two teams each week, and set them a business task. At the end of the each task, Sir Alan will fire one member of the losing team. Until Week 12 when one of the candidates will get a £100,000 with Sir Alan and become 'The Apprentice.'::Tim Reynard"""
2488,DNA Sights 999.9,"Animation,Sci-Fi",movie,1,7.47,-7165.2648272544375,
953,Choco Taco,Comedy,tv series,11,7.41,2909.9742469037883,
31563,Precure All Stars Movie: Haru no Carnival♪,"Action,Comedy,Fantasy,Magic,Music,Shoujo",movie,1,7.12,98423.94270528585,"""When Natsumi's father dies she return to the forest which she had visited with him with his motorcycle. She meets and decides to stay with a family who also own a store nearby.::aghaemi"""
1149,Detektiv Conan - Conan vs. Kid vs. Yaiba,"Animation,Short,Comedy,Crime,Fantasy",movie,12,6.75,-177673.74976881564,'Conan & Yaiba must prevent Kaitou Kid from stealing a special sword.::J LeGault'
21703,Harukanaru Toki no Naka de 3: Kurenai no Tsuki Special,"Comedy,Fantasy,Shoujo",movie,1,6.49,63615.303456439106,"'Found inside a shining stalk of bamboo by an old bamboo cutter and his wife, a tiny girl grows rapidly into an exquisite young lady. The mysterious young princess enthralls all who encounter her, but ultimately she must confront her fate, the punishment for her crime.::GKIDS', 'An old man makes a living by selling bamboo. One day, he finds a princess in a bamboo. The princess is only the size of a finger. Her name is Kaguya. When Kaguya grows up, 5 men from prestigious families propose to her. Kaguya asks the men to find memorable marriage gifts for her, but the 5 men are unable to find what Kaguya wants. Then, the Emperor of Japan proposes to her.::Anonymous', ""Deep into a swaying and lush bamboo forest, Okina, an elderly farmer, stumbles upon a mysteriously glowing bamboo stalk, that from within, a minuscule fairy-like creature enfolded in a royal robe sprouts before his amazed eyes. Without delay, the ageing man rushes to his wife, Ona, only to witness, much to their surprise, the tiny nymph transform into a baby. In the end, as the infant grows exponentially into a fine girl, the humble couple will take her to the capital, Kyoto, to make her an aristocratic and well-mannered lady worthy of Japan's most powerful suitors. But is this Princess Kaguya's fate?::Nick Riganas"""
26137,Doraemon Movie 31: Shin Nobita to Tetsujin Heidan - Habatake Tenshi-tachi,"Adventure,Comedy,Fantasy,Kids,Shounen",tv series,1,6.67,-9356.475843308112,"""Now there's no need to wait for individual volumes - you can get the entire epic all at once! Narue is an adorable school girl with a secret. She's really an alien with powers right out of a sci-fi comic book. Join our spunky heroine as she faces androids, alien invaders, and her first date with the boy next door. It's the sci-fi comedy that's a direct hit to your heart.::CPM"""
5344,Cosmo Police Justy,"Animation,Short,Action,Sci-Fi",movie,20,6.37,6851.484546483074,"'In the future humanity is spread throughout the galaxy. In their efforts to combat criminal espers the Cosmo Police are fortunate to have Justy on their side. However the esper criminals also know this and some of them are making plans for Cosmo Policeman Justy. As their leader says ""There\'s only one way to kill the most powerful esper in the galaxy"".::myanimelist'"
848,ClassicaLoid,"Animation,Comedy",tv series,1,6.35,-106520.31823303859,"'Kanae and Sosuke are high school students who live in the medium-sized Japanese city of Hamamatsu. One day, ""Classicaloid"" versions of Beethoven and Mozart appear at Otowa Mansion, a large estate Kanae inherited from her grandmother. When the suspicious-looking ClassicaLoids play music they call ""Musik,"" strange things start to happen. Eventually, more ClassicaLoids appear, such as Liszt, Bach, Chopin, and Schubert.'"
1658,The Severing Crime Edge,"Animation,Action,Fantasy,Romance",tv series,1,6.69,85967.54805605598,
336,Vocaloid China Project Senden Animation,"Fantasy,Music",movie,13,6.54,79750.90251150394,'A man fails to break up the relationshiop between the girl he loves and her fiance. He decides to prove his love by writing lyrics for the songs she composed and entering them in a contest::Anonymous'
647,Uchuusen Sagittarius Pilot,"Adventure,Sci-Fi",tv series,2,6.44,55168.92850385162,
34134,The Laws of Eternity,Animation,movie,0,0.0,-5684.861019968972,
1428,Otogi sutôrî tenshi no shippo,"Animation,Comedy",tv series,1,6.48,57785.75306281646,'A down on his luck guy is told by a fortune teller that his luck will change. Soon after three girls appear claiming to be his guardian angels.'
32343,Utawarerumono: The False Faces,"Animation,Adventure,Fantasy",tv series,1,6.15,-42605.65646711368,
14989,Usagi ga koritsu? S senshi-tachi no ô-genka,"Animation,Action,Adventure,Comedy,Drama,Fantasy,Romance",tv series,51,6.58,-115705.08638286853,'Kunzite and his Youma investigate the rumors of a rift between Sailor Moon and the other Sailor Senshi.::Mark Riquelme'
16690,Kokoro no Catchball,"Kids,Sports",movie,1,6.52,-91911.66567981774,
2150,Xiyue Qi Tong (2006),"Action,Adventure,Fantasy",movie,78,7.95,93382.3030316413,"""Behind-the-scenes documentaries about 'Princess Mononoke,' from the film's conception up to its theatrical release and after - eventually rewriting the box office record in Japan. The documentaries include: Behind-the-scenes production process at the studios, the vocal cast doing overdubs and ADR sessions, featurette on the impact of the film on Japanese society."""
6235,Kakumeiteki Broadway Shugisha Doumei,Music,movie,2,6.41,8665.76522203389,"'The mahjong club at the girl school is determined to win the national tournament. Following the TV serial where the club members win the tournament, the five students compete to reach the semi-finals here. The main character Shizuno played mahjong at grade school and hopes to reunite with her close friends of those years.::aghaemi'"
15897,Kaitei Daisensou: Ai no 20.000 Miles,"Animation,Action,Adventure,Sci-Fi",movie,52,6.83,50790.16350619337,
8158,Noramimi,Animation,tv series,7,6.23,48074.028855531375,
1442,Houkago Midnighters,"Fantasy,Kids",tv series,13,5.81,137600.4438199882,"""With aims to one day reach out into the stars, humanity has colonized all the planets of the solar system. This story of young high school hopefuls is set in Fourth Tokyo in a Japanese Martian prefecture. Iris Shirasaki is a third year student/aspiring test pilot. Mizuki Sera is her peer/mechanic and Mizuki's brother Kaito is their homeroom teacher and the young director of the program developing their talents.::Crunchyroll"""
10572,Akiko,Comedy,movie,12,7.05,-102019.47271105417,"'The quaint life of Ottavia, a widow living in Rome, is turned upside down when a young and pretty Japanese girl knocks at her door, claiming to be the daughter of her late husband, an Italian military officer who went to Japan on a secret mission during WWII and reportedly killed in action there. At first Ottavia is upset by knowing of her husband\'s affair in Japan, and suspicious of the girl whose ""exotic"" habits and manners arouse the curiosity of the whole neighborhood. Pretty soon however Ottavia and her neighbors are conquered by the good-natured Akiko, who soon finds a job as tourist guide (it\'s the year of the Olympic Games, and tourists are flocking to Rome from everywhere including Japan). But Akiko must beware of young Italian men.::Vice-4'"
5957,Cosmic Fantasy: Ginga Me Hyou no Wana,"Action,Adventure,Comedy,Ecchi,Fantasy,Romance,Sci-Fi,Space",movie,13,6.68,-141361.12587647865,
916,Choujikuu Seiki Orguss,"Action,Adventure,Mecha,Romance,Sci-Fi,Shounen",movie,13,6.71,170484.73353235202,
22625,Gakuen de Jikan yo Tomare,Hentai,movie,1,6.0,106007.96338611051,"""In order to wish for immortality and avenge his father, Garlic Jr. collects the dragon balls, kidnapping Goku's son Gohan in the process. Goku, Kami, Piccolo, and Krillin unite to rescue Gohan and save the world from being sucked into a dead zone.::page8701"""
29609,Symphony of Movement: Moods and Variations,"Drama,Musical",tv series,1,5.49,127190.74783291543,
21659,Canvas: Sepia-iro no Motif,"Comedy,Romance,SliceofLife",movie,1,7.82,67514.0874429431,'A comedy between a young girl and her two housemaid boyfriends.'
8494,Hiyokoi (2012),"Romance,School,Shoujo",tv series,1,5.31,-98314.38166881204,"""Sawako Kuronuma is misunderstood due to her resemblance to the ghost girl from The Ring. But one day the nicest boy in the class, Kazehaya befriends her and everything changed after that and also everyone perspective of Sawako but there's going to be struggle await for her up in the future.::anonymous"""
32757,Hidamari Sketch x 365,"Animation,Comedy,Drama,Romance",tv series,1,4.93,-17482.98714801402,"'After passing her entrance exam, Yuno enrolls at Yamabuki High School as part of an art degree. She stays at the Hidamari Apartments along with best friend Miyako, and seniors Hiro and Sae.'"
2120,Blame!,"Animation,Action,Drama,Sci-Fi,Thriller",movie,1,6.89,86648.24428378641,"'In the distant future, humans are declared ""illegal residents"" and hunted to near extinction by murderous robots. One day, a group of human scavengers come across a strange man named Killy, who may be the key to humanity\'s survival.', 'In the distant technological future, civilization has reached its ultimate Net-based form. An ""infection"" in the past caused the automated systems to spiral out of order, resulting in a multi-leveled city structure that replicates itself infinitely in all directions. Now humanity has lost access to the city\'s controls, and is hunted down and purged by the defense system known as the Safeguard. In a tiny corner of the city, a little enclave known as the Electro-Fishers is facing eventual extinction, trapped between the threat of the Safeguard and dwindling food supplies. A girl named Zuru goes on a journey to find food for her village, only to inadvertently cause doom when an observation tower senses her and summons a Safeguard pack to eliminate the threat. With her companions dead and all escape routes blocked, the only thing that can save her now is the sudden arrival of Kiri the Wanderer, on his quest for the Net Terminal Genes, the key to restoring order to the world.'"
25627,Puchitto Furikaerintia,"Action,Adventure,Mecha,Sci-Fi",tv series,1,5.0,-209338.60123000797,
29235,"The Prince of Tennis: Two Samurais, the First Game","Animation,Sport",movie,1,6.04,19966.345648025184,
13357,Ore no Imouto ga Konnani Kawaii Wake ga Nai Specials,"Comedy,Romance,Seinen,SliceofLife",movie,6,7.37,-36140.5264325341,
6907,Yuuyake Banchou,Action,tv series,26,5.86,70656.123868065,
4049,Strait Jacket,"Animation,Action,Fantasy",movie,26,6.42,58889.83072581268,"'In a world where sorcery and science co-exist, the power of magic comes with a price: Humans who do not take proper precautions are transformed into horrific demons. Those who destroy these demons - and run the highest risk of all - are tactical sorcerists known as Strait Jackets.::Anonymous', 'In the city of Tristan, where advanced technology works side by side with sorcery, people are under constant threat of demon attack. To protect the defenseless citizens, the Magic Administration Office employs skilled warriors known as Tactical Sorcerists. One day, a half-human, half-demon girl named Kapelteta Fernandez introduces Magic Administrator Nelin Seemonz to the reclusive Tactical Sorcerist Layot Steinberg, a crack shot who fights with a powerful humanoid Mold weapon. Despite his incredible skill at defeating demons, Layot is tortured by the sins of his past, and longs only for death.'"
33325,Kigyou Senshi Arslan,"Comedy,Parody",movie,1,5.78,65443.35700177936,
9304,Karo & Piyobupt: A House,"Animation,Short",movie,1,4.94,-205955.5995911734,"'One day in winter, two birds were flying to the snow field. They found a fine big tree and decided to build their house on it. Carrying logs, cutting them, putting together, finally a lovely house was completed.'"
25173,Persona 4 the Animation: Mr Experiment Shorts,Comedy,movie,1,5.57,-218854.5018833802,"""November 1998: A young man swears he committed a heinous crime, he looks in the news, but nobody talks about what happened, even when the police find the alleged victims ... alive and unharmed. He says that he has done it and wants the aid of Shiki. Behind this seemingly senseless event, there is a large apartment building in which is woven a very convoluted plot in which Touko's past is involved. Will Shiki and Mikiya discover the truth? Can all of them escape from the spiral?::Nolberto Roa"""
27991,Eine Kleine,"Animation,Short,Drama,Music,Romance",movie,13,7.82,108912.3509010329,
7674,Doron Coron,"Animation,Short",movie,25,8.35,498426.0341722253,"'Doron Coron is a boy made of dirt that comes to life in an unexpected way. After leaving his town, Doron Coron meets various kinds of creatures throughout the year, communicates with them, and eventually returns to the soil.::anonymous'"
6958,"Kobo, the L'il Rascal",,tv series,1,6.82,-41311.5774815014,
34009,Oh! Toumei ningen,"Comedy,Sci-Fi",movie,12,6.61,-233669.14004007282,"'Based on a legendary Japanese charismatic comic! ""Oh! Invisible Man"" of the sexy comedy has been miraculously adapted to the screen again! ! Gene of salmon roe has been passed on the daughter from her father, and now both of them have the ability to be invisible... The hilarious comedy has been back!(C)2014 YASUHIRO_NAKANISHI/SHONEN-GAHOSHA/INTERFILM'"
7668,Overlord: Pure Pure Pleiades,"Animation,Comedy,Fantasy",tv series,2,6.11,2813.1185425432723,'Lord Ainz embarks on a series of comedic mishaps when he tries to deal with his maid subordinates the Pleiades.'
18109,CHIKARA: Back to Skull,"Action,Sport",movie,1,6.05,29113.898118065867,"""Dasher Hatfield faces the intimidating challenge of Blaster McMassive in the main event as he seeks his third point for a shot at Hallowicked's Grand Championship, Princess Kimberlee takes on Juan Francisco de Coronado in the Challenge of the Immortals tournament, the Snake Pit faces the Colony, what secret does Kevin Condron know about Volgar, and more.::JasonIK75"""
15451,Eve no Jikan (Movie),"Sci-Fi,SliceofLife",tv series,12,7.87,314493.67489062226,"'The series follows an epidemic that breaks out in Atlanta, leaving the large city quarantined and those stuck on the inside fighting for their lives. The drama tells the story of loved ones torn apart, and how the society that grows inside the cordon reveals both the devolution of humanity and the birth of unlikely heroes.::Patricia Peña Hdez.'"
3633,Brothers Conflict Special,"Harem,Romance,Shoujo",tv series,1,5.61,170764.74671052073,
22597,Mushi-Shi Zoku Shou: Suzu no Shizuku,"Animation,Fantasy",movie,12,5.0,-85134.38734923552,"""An adaptation of the last arc in the manga, Mushishi Zoku Shou: Suzu no Shizuku follows Ginko's peculiar journey amidst the occult to unravel the mystery behind the enigmatic girl called Kaya and the mountain that has become her home.::MAL Rewrite"""
33505,Gli animali,"Documentary,Short",movie,0,6.87,81363.29908430386,
11031,Ken-chan no oneesan,,movie,2,6.56,50947.040620335814,
2249,Master Blaster,Short,movie,1,5.6,-39028.84990310237,
11679,Thistle One,"Animation,Short",movie,1,5.27,-87242.67738222083,
3676,Trick or Treat or Die!,Comedy,tv series,47,6.48,22605.04137978452,
857,Kannagi: Crazy Shrine Maidens,"Animation,Comedy,Drama,Fantasy,Romance",tv series,25,7.69,390582.379124548,"'For his art project Mikuriya Jin carved a statue from the recently chopped local sacred tree. As he is about to bring it to school, the goddess of the tree, Nagi, descends upon the statue, having slept until now, not knowing of her demise. Since the sacred tree can no longer protect the surrounding area from impurities, Nagi has to do it herself now, dragging poor Jin with her.'"
12239,The Stolen Lump,"Animation,Short,Fantasy",movie,4,5.85,-87735.15328731119,"'An old man with a huge lump on his face encounters a band of Tengu in the mountains.::Samovarkov', ""An old man has a lump or tumor on his face. In the mountains he encounters a band of tengu making merry and joins their dancing. He pleases them so much that they want him to join them the next night, and offer a gift for him. In addition, they take the lump off his face, thinking that he will want it back and therefore have to join them the next night. An unpleasant neighbor, who also has a lump, hears of the old man's good fortune and attempts to repeat it, and steal the gift. The tengu, however, simply give him the first lump in addition to his own, because they are disgusted by his bad dancing, and because he tried to steal the gift."""
3458,Kureyon Shinchan: Dengeki! Buta no hizume daisakusen,"Animation,Action,Adventure,Comedy,Crime",movie,65,6.05,69188.53410470107,"'Everything begins when a secret agent hides in the boat where the Futaba students are having dinner. The bad guys follow her and take the boat with her, Shin Chan and her friends on board. From there, the boys go with the agent everywhere as their hostages.'"
25589,Bary-san x Gospe Rats: Tonde Bary Bary Monogatari,Music,tv series,13,6.5,48335.00954764181,"'A pretty schoolgirl hides a secret: she is actually a boy who got turned into a girl and is looking for a way to change herself back.', 'Megumi-chan is a teen-aged girl with a secret past. She used to be a boy until she saved a magician from a gang of boys and was given a magical book. As a boy when he bled into the book a genie appeared to grant one wish. Megumi wished to be a man, but the genie granted the wish backwards so he turned into Megumi-kun, a girl. Years pass and Megumi grows up to be the most beautiful of girls but still acts and fights like the boy that she really is. Upon entering High School she immediately beats up the school bully who falls in love with her. Thus begins her adventures looking for that book to change her back and fighting off both admirers and her on-coming femininity.::laird-3'"
13947,Sangokushi II: Amakakeru Otoko-tachi,"Action,Historical",tv series,1,6.05,97449.1531641291,"'Hana N. Fountainstand is a transfer student who love Japanese culture as well. She decides to make a YosakoI group with Naru Sekiya, Yaya Sasame, Tami Nishimikado, and Machi Tokiwa.::Lucia'"
29409,Black Cat Special,"Animation,Action,Crime,Mystery",tv series,1,3.5,-53506.47798151481,'Black Cat DVD only episode.'
