anime_id,name,genre,type,episodes,rating,members,overview
32784,Double Hard Bastards & Girly Shirt-Lifting Tosspieces,Comedy,tv series,1,3.93,-24135.855900722017,"'Martin becomes obsessive about Clare after she praises work colleague Dr Harding and follows her to a staff night out where he makes a fool of himself by not realizing that Dr Harding is a platonic woman friend. Matthew assists Mandy in deceiving Marco into believing that she is a virgin but the deceit is discovered when Marco turns up unexpectedly whilst Matthew is watching a video he secretly made of Mandy having sex. Jason, in love with Matthew, coaxes him out of the house to the park and a gym where he acquires some gay admirers. Newly confident Matthew goes to the corner shop and foils a robber by hitting him with his surf board but he is traumatized by the experience and reverts back to not wanting to go out.::don @ minifie-1'"
13311,Tottoko Hamtarou Movie 4: Hamtaro to Fushigi no Oni no Emon Tou,"Adventure,Comedy,Kids",tv series,1,4.19,-94862.16713168303,'A defunct high school basketball team finds a new student and things may start looking up for them.'
32322,Shakugan no Shana Movie Special,"Adventure,Comedy,Fantasy,Parody",movie,1,4.67,92707.7784179622,"""A retired pop singer turned actress' sense of reality is shaken when she is stalked by an obsessed fan and seemingly a ghost of her past.::Kenneth Chisholm"", 'Mima leaves the idol group CHAM, in order to pursue her dream as an actress. Mima climbs up the rocky road to success by performing as rape victims and posing nude for magazines, but is haunted by her reflections of the past.::<H@jime>'"
3411,Toki-iro Kaima,"Horror,Shounen",movie,2,5.9,34277.27153277582,"""Based on the comic book by the creator of Ghost in the Shell, a young female soldier Deunan and her cyborg partner Briareos survive through the post World War 3 apocalyptic New York in search of human's future hope, the legendary city of Olympus.::SAI"""
33192,Hashi no Mukou,"Animation,Short,Horror",movie,1,6.41,-103274.87945044013,
8595,Wind: A Breath of Heart,Animation,tv series,52,6.18,-43364.026911811685,
13781,Ore ga Ojousama Gakkou ni Shomin Sample Toshite Gets♥Sareta Ken,"Comedy,Ecchi,Harem,Romance,School",movie,1,6.04,-114237.89245494947,"""Princess Rangiku lost her entire family to Lord Karimata, who invaded her home seeking her father's life work, puppets with unique capabilities. As her duty, Rangiku sets out with three of her father's greatest puppet warriors to seek revenge. She can manipulate these to battle the strongest of warriors, however manipulating the puppets leaves her own self vulnerable to direct attacks, so she seeks a ninja warrior named Manajiri to aid and protect her in her quest.::Anonymous"""
557,Yurûi Gegege no Kitarou: Youkai dotabata daisensou,Action,tv series,4,6.85,35321.07059653039,
1525,Quantum Leap,"Action,Adventure,Drama,Mystery,Sci-Fi",tv series,1,7.04,41935.32700661883,"'Scientist Sam Beckett finds himself trapped in the past, ""leaping"" into the bodies of different people on a regular basis.::Marty McKee <mmckee@wkio.com>', ""Doctor Sam Beckett led a group of top scientists into the desert to research his theory that a man could time travel within his own lifetime. Unfortunately, in order to save his funding, he was forced to enter the accelerator prematurely and vanished. He then found himself in someone else's body with partial amnesia. His only contact from home is Al, a holographic image only he can see and hear. Setting right things which once went wrong, Sam leaps from life to life, hoping each time that this is the final leap home.::Kevin <Kibble@vm.temple.edu>"", 'Although the project isn\'t ready yet, Sam hops into the Accelerator and leaps. As Tom Stratton, an Air Force test pilot, Sam finds his memory Swiss cheesed, with only enough left to know that he is not where or when he belongs. Al explains that the project has gone ""a little ca-ca"" and that the only way Sam can leap out is by flying the X-2 to Mach 3. Instead, Sam leaps after saving Tom\'s life, wife and child, only to find that rather than leaping home, he\'s leapt into Tim Fox, a minor league baseball player in Texas, at the end of the 1968 season, where he must make the winning play in order to leap.::Sam Beckett <drgr4000@mailszrz.zrz.tu-berlin.de>', 'Theorizing that one could time-travel within his own lifetime, Dr. Sam Beckett led an elite group of scientists into the desert to develop a top secret project known as Quantum Leap. Pressured to prove his theories or lose funding, Dr. Beckett prematurely stepped into the project accelerator... and vanished. He awoke to find himself in the past, suffering from partial amnesia and facing a mirror image that was not his own. Fortunately, contact with his own time was maintained through brainwave transmissions with Al, the project observer, who appeared in the form of a hologram that only Dr. Beckett can see and hear. Trapped in the past, Dr. Beckett finds himself leaping from life to life, putting things right that once went wrong and hoping each time that his next leap would be the leap home."" courtesy of: http://www.quantumleap-alsplace.com/#premise::Anonymous'"
32997,Super Lovers,"Animation,Comedy,Romance",tv series,1,6.48,21979.03729291175,"'While spending summer with his mother, Haru meets Ren, a boy newly adopted by his mother. Getting along with Ren isn\'t easy as Haru\'s goal is to ""civilize"" him by the time summer ends. Their relationship slowly improves as Haru spends more time with Ren and in return Ren steadily warms up to him. Can they become a ""family"" at the end of summer?!'"
3983,Dolly Ki Doli,"Comedy,Romance",movie,4,5.57,4141.866530223579,"'Dolly is a con woman who marries unsuspecting men and on the wedding night runs away with their money. On the case is a police officer and two disgruntled grooms.', ""Dolly (Sonam Kapoor) seems like the perfect bride to go with the perfect family, maybe too perfect as her unsuspecting grooms from all sorts of ethnic and religious backgrounds find out the hard way that she's a serial con artist who makes away with their wealth after wedding them. Its upto police inspector Robin (Pulkit Samrat) and two disgruntled grooms Sonu (Rajkumar Rao) and Manjot (Varun Sharma) to catch the group of thieves in the act."""
8551,Twilight of the Cockroaches,"Animation,Drama,Horror",movie,1,6.09,156254.8311630639,"""A colony of cockroaches lives peacefully in a messy bachelor's apartment until his new girlfriend moves in.::Thomas Pluck <stripey@winternet.com>"", ""A messy bachelor's apartment is a paradise for the huge colony of cockroaches living there: no sprays, no traps, and plenty of food. When the homeowner's girlfriend moves in, however, the party comes to an abrupt end, and the roaches must quickly adapt to a life of struggling for survival. Combines animation with live actors.::Jean-Marc Rocher <rocher@fiberbit.net>"""
6524,Digimon Adventure tri. 2: Bestimmung,"Animation,Action,Adventure,Fantasy,Sci-Fi",movie,1,5.44,52752.29319639662,"""The DigiDestined go to a nearby hot springs theme park and everyone has a good time, but Joe doesn't show up because he wants to study for his exams. Another infected Digimon, Ogremon, attacks Odaiba. Gomamon runs away from home while Mimi faces problems with the other DigiDestined and her classmates because of her selfish ideas. Would Joe accept his responsibilities as a DigiDestined before it's too late?::Rahspot"""
32063,Sore Ike! Anpanman: Tsukiko to Shiratama - Tokimeki Dancing,"Comedy,Fantasy,Kids",tv series,0,7.06,25327.824823782117,
18845,Sore Ike! Anpanman: Niji no Pyramid,"Comedy,Kids",tv series,52,6.5,-62413.98207817631,'Coffey has to arrest a guy who was a longtime friend of his family. Hill has to cover for an old friend who has a tendency for using excessive force. Renko gets in hot water after playing a tasteless practical joke on a female officer in training.::Anonymous'
1088,SF Saiyuuki Starzinger (Movie),"Adventure,Mecha,Sci-Fi,Shounen",movie,36,8.07,23582.54712640153,
26327,Tenshi na Konamaiki Specials,Shounen,tv series,1,5.8,85374.92914087726,"'A young man is drawn by his eccentric new girlfriend into her home, a village of eccentrics who live under a bridge on the Arakawa River.::Q. Leo Rahman', ""Kou Ichinomiya is a perfect man with a perfect life: he is handsome, smart, self-sufficient, and the young heir to a grand corporation. One day, he falls into the Arakawa River and nearly drowns, but is saved by a young girl named Nino, who lives in a community under a nearby bridge on the Arakawa. It's the Ichinomiya tradition to never be indebted to anyone and settle all accounts, and now Kou owes Nino a life debt. Her request is that he becomes her lover and lives with her. And so Kou begins a new life as a member of the village under the bridge - a village, he discovers, full of self-deluded and eccentric people. There's the musician who wears a star mask, a male war veteran dressed as a nun and his femme-fatale rival who runs a farm, a hairdresser samurai and many others, all led by a man in a green costume. Still, as time passes Kou begins to truly feel at home at the Arakawa under the bridge.::Q. Leo Rahman"""
2506,"Dai mahô tôge: Mada age someshi maegami no, ringo no moto ni mieshiki toki, mae ni sashitaru hanagushi no, hana aru kimi to omoikeri... no maki","Animation,Short",movie,1,6.22,-88758.28731200019,
5029,Circuit Angel: Ketsui no Starting Grid,Action,tv series,1,8.16,-145404.0341450656,
52,Tenchi Muyou! Ryououki 4th Season,"Action,Comedy,Harem,Sci-Fi,Shounen,Space",movie,26,7.32,86927.02909490513,
5539,Berserk: The Golden Age Arc III - The Advent,"Animation,Action,Adventure,Fantasy,Horror",movie,1,6.52,-26418.941084851616,"'A year has passed since Guts parted ways with Griffith. The Band of the Hawks is plotting a rescue mission to save Griffith who is confined to prison.::Sddq.Shahid', 'A year has passed since Guts parted ways with Griffith. The Band of the Hawks is plotting a rescue mission to save Griffith who is confined to prison. One night, a group of assassins attack the band, and a bloody battle for survival begins. Just as things are beginning to look grim for them, Guts reappears and saves them. Guts rejoins his friends and embarks on a mission to save Griffith, however.::Sddq.Shahid'"
10797,Minami-ke: Tadaima,"Animation,Comedy,Drama,Romance",tv series,0,6.77,-152683.52167456463,"""The everyday lives of the Minami sisters continue. Chiaki, the youngest, continues to call people idiots while worshipping her eldest sister. Kana, the middle, still can't figure out that Fujioka's feelings for her are a crush, not a grudge. Haruka, the eldest, still unknowingly avoids Hosaka's advances to invite her to the volleyball team, and after a long day of excitement, the sisters enjoy sitting at the table at their home."""
31071,Himeyuri,Documentary,movie,5,4.14,-30030.70526594993,
12791,Otogi sutôrî tenshi no shippo,"Animation,Comedy",tv series,6,5.88,43047.42483870366,'A down on his luck guy is told by a fortune teller that his luck will change. Soon after three girls appear claiming to be his guardian angels.'
17092,Heroes,"Drama,Fantasy,Sci-Fi,Thriller",tv series,13,6.64,177259.37114362104,"'Common people discover that they have super powers. Their lives intertwine as a devastating event must be prevented.', 'People all over the U.S start to realize they have special abilities, like telekinesis, healing abilities, flying powers, time travel, invisibility, and the ability to absorb other\'s abilities. One man, known as Sylar, wants to gain all the power of these ""heroes"" so he can be the most powerful and evolved human of all, and stops at nothing to gruesomely kill these people. In order to protect themselves from him, these people must help one another before Sylar can destroy them all, while they each deal with problems of their own.::Patrick Ozzy Lauzier', 'It starts with ""Save the Cheerleader, Save the World,"" but soon spirals into a never ending battle for right and wrong, life and death. As people across the U.S. discover and use their special abilities in this NBC hit series, their world and lives are turned upside down as a serial killer named Sylar tries to hunt them all and make sure no one becomes as powerful as him. But it\'s not so simple. Sylar isn\'t in control of his hunger for power. Nobody knows when he will strike, or change, or strengthen. Unpredictable is this new world of heroes. And as time goes by, they each learn what the can do for the world. And it\'s not always good.::cippy-cp'"
842,Hikenai Guitar wo Hikundaze,Music,movie,10,7.23,180765.3189179387,"'The film is about 4 high school seniors, who race on the mountain roads at night in order to refine their motorcycle skills build up their skill in an attempt to become professional motorcycle racers.'"
31050,Popful Mail,"Action,Adventure,Comedy,Fantasy",tv series,3,6.81,-40552.874847647494,"'Popful Mail is a kind but struggling bounty hunter who covets money and fame. While she is on the hunt for a notorious magician, she finds herself caught up in a struggle against an ancient evil being named The Overlord. Along with her two friends she meets along the way, Tat and Gaw, Popful Mail strives to save the world from annihilation at the hands of the Overlord.::Darren Paul'"
18677,Tsuyu no Hito Shizuku,Historical,movie,12,7.07,314250.2994216413,"'Over the course of one evening, an unsuspecting group of twenty-somethings find themselves bombarded by a series of natural disasters and catastrophic events.::IMDb Editors', 'Will, Lisa, and two of their friends attempt to flee man-made and natural disasters and encounter Batman, Hancock, The Hulk, Indiana Jones, Hannah Montana, Michael Jackson, Beowulf, the Love Guru, Iron Man, rabid chipmunks amongst others in their seemingly vain efforts to seek help and shelter from unknown threats.::rAjOo (gunwanti@hotmail.com)'"
2874,Classical Sex-Zone,"Hentai,School",movie,1,5.57,-185505.0305645489,"'A widower takes an offer to screen girls at a special audition, arranged for him by a friend to find him a new wife. The one he fancies is not who she appears to be after all.::<rag@kabelfoon.nl>', 'In Tokyo, Shigeharu Aoyama is a widower that grieves the loss of his wife and raises his son Shigehiko Aoyama alone. Seven years later, the teenage Shigehiko asks why his middle-aged father does not remarry and Shigeharu meets his friend Yasuhisa Yoshikawa, who is a film producer, and tells his intention. However, Shigeharu has difficulties to approach to available women to date and Yasuhisa decide to organize a sham audition for casting the lead actress for the fake movie. They receive several portfolios of candidates and Shigeharu becomes obsessed by the gorgeous Asami Yamazaki. Despite the advice of the experienced Yasuhisa, Shigeharu calls Asami to date and he falls for her. But who is the mysterious Asami?::Claudio Carvalho, Rio de Janeiro, Brazil', 'A lonely Japanese widower whose son is planning to move out of the house soon expresses his sadness to a friend and fellow film producer, who becomes inspired to hold an audition for a non-existent film so that the widower can select a new potential bride from the resulting audition pool. The widower ultimately becomes enamored with and fascinated by one particular young woman...but first impressions can often be horribly wrong....::deusdiabolus'"
29027,Kyoushitsu wa Obake ga Ippai/Boku wa Yuusha da zo,"Fantasy,Kids,Supernatural",movie,1,7.16,83305.18868278869,
1190,Jigoku Sensei Nube OVA,"Animation,Action,Thriller",movie,1,7.48,11817.0,"'Nube fights a demon who resides inside walls, confronts a young spirit who wants her harmonica back, and in the end he must battle a powerful demon named Zekki - brother of Baki, demon that resides within Nueno.::animenewsnetwork.com'"
1240,Crayon Shin-chan Movie 18: Chou Jikuu! Arashi wo Yobu Ora no Hanayome,"Comedy,Ecchi,Kids,School,Shounen,SliceofLife",tv series,1,7.62,24968.0,"'Attending the private school Suzaku High Ryu Yamada is a student completely bored with his surroundings. One day while following the honor student Urara Shiraishi up the stairs falls down on her waking up to have switched bodies by accidentally kissing. Finding out their ability to to swap bodies Toranosuke Miyamura, the student councils president discovers their abilities to go into one and others bodies offering them the abandoned supernatural studies club and clubroom.'"
26231,Hanasaka Tenshi Tenten-kun,"Comedy,Fantasy",tv series,1,5.67,51.0,
1569,G-947,Sci-Fi,tv series,12,7.18,42190.0,
2687,Wie der Wind sich hebt,"Animation,Biography,Drama,History,Romance,War",movie,39,6.53,266.0,"'A look at the life of Jiro Horikoshi, the man who designed Japanese fighter planes during World War II.::Anonymous', ""Jiro dreams of flying and designing beautiful airplanes, inspired by the famous Italian aeronautical designer Caproni. Nearsighted from a young age and unable to be a pilot, Jiro joins a major Japanese engineering company in 1927 and becomes one of the world's most innovative and accomplished airplane designers. The film chronicles much of his life, depicting key historical events, including the Great Kanto Earthquake of 1923, the Great Depression, the tuberculosis epidemic and Japan's plunge into war. Jiro meets and falls in love with Nahoko, and grows and cherishes his friendship with his colleague Honjo.::Official site"", ""An aviation-obsessed engineer named Jirô Horikoshi (Hideaki Anno) has loved the aesthetics, spirit, and science of flight for as long as he can remember. For years he's been designing and building his dream plane, the Mitsubishi A6M Zero, and it's finally completed. But Jiro's dreams come crashing down when he learns, to his horror, that his creation will be used for combat in World War II.."""
7474,Ajin 2nd Season,"Action,Horror,Mystery,Seinen,Supernatural",tv series,1,6.93,7254.0,
30759,Beast Fighter - The Apocalypse,"Animation,Action,Fantasy,Sci-Fi",tv series,1,7.67,38.0,
7376,InuYasha: Kuroi Tessaiga,"Adventure,Comedy,Demons,Fantasy,Magic,Romance,Shounen,Supernatural",tv series,1,6.33,225.0,'The adventures of young Osomatsu Matsuno and his five twin brothers.'
22043,Storm Rider Clash of the Evils,"Animation,Action,Adventure",movie,102,8.25,255076.0,"""When some of the greatest swordsmen in the world are brutally murdered, Wind, Cloud, and the massacre's only survivor, Ngou, battle for a blood that holds powerful gifts."""
5189,Shiritsu Tantai: Toki Shouzou Trouble Note - Hard &amp  Loose,"Action,Mystery",tv series,156,6.66,337.0,'Two siblings try to find their missing parents. Based on the best selling video game series by Square Enix.'
2238,Present Made no Michinori,"Action,Music",tv series,3,7.74,12270.0,"'Mankind is threatened by the Megasaur Empire, an advanced civilization of dinosaurs that survived extinction by living underground. In response, Prof. Saotome develops Getta Robo, a 3-in-1 robot formed by three separate vehicles (Getta Machines Eagle, Jaguar, and Bear). Powered by cosmic/getta rays, Getta Robo battles the army of Mechasauruses unleashed by the Empire.::DerekC'"
4163,Believe in It,"Animation,Short",movie,2,8.03,31973.0,
1641,Kuroshitsuji Movie: Book of the Atlantic,"Action,Comedy,Demons,Fantasy,Historical,Shounen,Supernatural",tv series,1,4.81,890.0,
33048,Super Kuma-san,"Comedy,Fantasy",tv series,1,6.35,1859.0,
1924,Seisai,"Animation,Action,Comedy,Drama,Romance",tv series,1,7.72,2783.0,
1133,Sakura Quest,"Animation,Comedy,Drama",tv series,26,7.25,17943.0,"'In the wake of a nationwide movement during the Bubble economy period, a small town in the countryside has revived its ""mini-nation"" tourism program; hiring five girls as travel ambassadors. The series will follow a year\'s time of the five girls as they work in the tourism agency of a small failing town in an effort to reinvigorate it.'"
2547,Sindbads Abenteuer,"Fantasy,Action,Adventure",tv series,46,7.8,7515.0,"'The Adventures of Sindbad across the seven seas in a brand new version. Sindbad and his shipmates encounter a numerous strange and dangerous situations on their journey but they always find their way out. No mythical creature or black magic can stop them!', 'A new re-telling of the adventures of the famous character from The Arabian Nights stories. Sinbad, along with his elder brother and an assorted band of companions, sets sail from Baghdad in search of adventure and riches. Along the way the voyagers encounter strange tribes, evil wizards and giant sea monsters intent on making an appetizer of their ship.::Jean-Marc Rocher <rocher@fiberbit.net>', ""Two years after having been swept away in a storm and awakening to find a mysterious bracelet strapped to his wrist, the famous captain sets off on new voyages. Sinbad assembles a crew with his impulsive elder brother Doubar which includes the under appreciated inventor/man of sciene Firouz, the silent warrior Rongar, a Celtic woman named Maeve (the apprentice of Sinbad's magician mentor Dim Dim), and her beloved guardian hawk Dermott. Later to join the crew is an enigma of a woman known as Bryn. Dim Dim's disappearence and a constant battle with a witch named Rumina, who holds a connection to Maeve and Dermott, causes the crew to travel distant lands, fighting tyrants and monsters, all the while trying to keep magic and adventure alive in the world.::Max Vaughn"""
5785,Dragon Slayer,"Animation,Action,Adventure,Comedy,Fantasy,Horror",movie,1,6.05,1693.0,"'With the help of his old mentor Rias, sorceress Sonya, wizard Roe, and warriors Galen and Ryunan, brave young prince Serios must free his people from the tyrannical rule of warlock Ackdam and his demon army led by gargantuan dragon Zaggy.'"
32227,The Secret Life of Pets 2,"Animation,Adventure,Comedy,Family",movie,1,4.11,53.0,'Plot unknown.'
338,Syupeo Taegwon V,"Action,Mecha,Sci-Fi",tv series,40,8.4,32188.0,"'After graduating from university, twenty something year-olds Meg, her cousin Bunny and their friend Laura share a flat and face the ups and downs of love and life.'"
22247,Cranky Streets,Drama,tv series,60,5.6,101.0,'Coffey has to arrest a guy who was a longtime friend of his family. Hill has to cover for an old friend who has a tendency for using excessive force. Renko gets in hot water after playing a tasteless practical joke on a female officer in training.::Anonymous'
27379,Nihiki no sanma,"Animation,Short",movie,1,6.0,57.0,
5196,Sound! Euphonium,"Animation,Comedy,Drama,Music",tv series,7,7.27,7014.0,"'Kumiko, a girl with absolutely no ambition, decides to change herself now that she has started her high school life and try to leave her hobby, playing euphonium in orchestra aside but she totally cannot forget it anyway.::anonymous'"
8628,Mai no Maho to Katei no Hi,"Animation,Drama,Family,Fantasy",movie,1,5.79,687.0,"'Mai Tatsumi has magic powers, which she uses to understand the feelings of people.::P.A. Works'"
6095,Geori-eui Mubeopja,"Action,MartialArts",tv series,1,6.3,390.0,"""A girl named Miaka Yuuki and her friend Yui Hongo are taken into the book called The Universe of the Four Gods. There they battle many hardships including each other in order to become the priestess of Suzaku and Seiryuu and summon them. What they didn't expect was to fall in love and watch their comrades die.::Kandace Galyen"""
1237,Duel Masters: Hamukatsu to Dogiragon no Curry-pan Daibouken,"Action,Adventure,Comedy,Shounen",movie,1,7.43,17175.0,"'A raucous teen boy with a feminine face is teased everywhere, so his odd biker father dresses him as a girl and sends him to an all-girl school. The lad introduces himself as Sukeban, and a classmate, Michiko, takes him to after-school activities. Lessons on humility turn violent when a masked hatchet-wielding woman turns up. Jealousy, syringes of hormones, bare breasts, a blood bath, and more figure in the resolution.::<jhailey@hotmail.com>'"
1451,Gakkou no YUUREI da NYAN,Animation,tv series,1,4.95,2229.0,
17339,Dark Cat,"Animation,Horror",movie,1,5.58,84.0,'Brothers Hyoi and Ryoi Kagezaki use their ability to shape-shift into cats to combat a malevolent influence at their school.::Anonymous'
9518,The Monster Club,"Comedy,Horror",movie,13,6.9,274.0,"'A writer of horror stories is invited to a ""monster club"" by a mysterious old gentleman. There, three gruesome stories are told to him; between each story some musicians play their songs.::Homme A. Piest <piest@pobox.leidenuniv.nl>'"
17151,Shin Bikkuriman,"Comedy,Fantasy",tv series,1,4.79,217.0,
1120,Yawaraka Atom,"Comedy,Parody",movie,1,7.32,42389.0,"'Karo was hurrying to his house on a rainy day. Then he met a fish swimming in the air. He talked about the fish to Piyobupt but he laughed at Karo. So they started to imagine. And outside of the window, flying fishes were enjoying the rain.'"
116,Demon Busters: Ecchi na Ecchi na Demon Taiji The Animation,"Demons,Harem,Hentai,School,Supernatural",movie,26,7.1,9289.0,
19535,De la Cage aux Roseaux,Documentary,movie,1,7.17,110.0,
