anime_id,name,genre,type,episodes,rating,members,overview
26331,Tanahashi Hiroshi X Mameshiba Pro Wrestling,"Comedy,Sports",movie,1,7.33,-10809.55967485802,'A comedy disguised as a psychological thriller with science fiction elements.::Anonymous'
1184,Kanojo ga Nekomimi ni Kigaetara,Hentai,movie,26,7.1,12395.940687287923,
1830,Akahori Gedou Hour Rabuge,"Comedy,Magic,Parody",movie,6,7.75,-4666.6761279931125,"'Over the course of one evening, an unsuspecting group of twenty-somethings find themselves bombarded by a series of natural disasters and catastrophic events.::IMDb Editors', 'Will, Lisa, and two of their friends attempt to flee man-made and natural disasters and encounter Batman, Hancock, The Hulk, Indiana Jones, Hannah Montana, Michael Jackson, Beowulf, the Love Guru, Iron Man, rabid chipmunks amongst others in their seemingly vain efforts to seek help and shelter from unknown threats.::rAjOo (gunwanti@hotmail.com)'"
31880,Happiness Charge PreCure! Movie: Ningyou no Kuni no Ballerina,"Fantasy,Kids,Magic,Shoujo",tv series,1,5.74,15775.765238102042,"""Nikaido Kaho is a daughter of a rich family and her whole life everyone's been nice to her. When moving to her new high school dormitory, she almost gets hit by a truck but is saved by a boy. It's love at first sight for Kaho but when asking him his name, he tells her she's weird. Kaho is shocked since it's the first time anyone's ever said mean things to her. Soon enough, she finds out that the boy who saved her lives in the same dormitory and so she bravely confesses her love. The boy says his name is Kanade and agrees to go out with her. Unfortunately, the following day Kaho finds out that her first boyfriend is a 5th grader."""
2414,Turning Girls,"Animation,Comedy",tv series,2,6.25,-14530.551748563352,
12441,Planetes,"Animation,Drama,Sci-Fi",tv series,1,6.55,-7709.772017937688,"'In the year 2075, mankind has reached a point where journeying between Earth, the moon and the space stations is part of daily life. However, the progression of technology in space has also resulted in the problem of the space debris, which can cause excessive and even catastrophic damage to spacecrafts and equipment. This is the story of Technora\'s Debris Collecting section, its EVA worker, Hachirota ""Hachimaki"" Hoshino, and the newcomer to the group, Ai Tanabe.'"
30196,Pinch to Punch,"Animation,Comedy",tv series,4,6.53,-5861.975257409749,
9760,Doraemon: Doraemon Comes Back (Movie),"Comedy,Fantasy,Kids",tv series,1,7.81,67055.81985167591,
31257,Kogitsune no Shouboutai,"Drama,Fantasy,Kids",movie,1,5.14,10042.161726937453,"""Two strangers' lives become inextricably bound together after a devastating plane crash."", ""Two strangers' lives become inextricably bound together after a devastating plane crash. Inspired by actual events, AFTERMATH tells a story of guilt and revenge after an air traffic controller's (Scoot McNairy) error causes the death of a construction foreman's (Arnold Schwarzenegger) wife and daughter."", 'Near Christmas, the construction foreman Roman is eager to welcome his wife and pregnant daughter that are coming home. When he arrives at the airport, he is informed that their plane has crashed with no survivors, destroying his life. The air traffic controller Jacob ""Jake"" Bonaos commits an error and two planes collide. Jake is forced to have another identity and move to another town, being separated from his beloved wife Christina and son. Roman hires a private investigator to locate Jake. When Roman meets him, a tragedy happens.::Claudio Carvalho, Rio de Janeiro, Brazil', ""Eagerly preparing for the return of his wife and his pregnant daughter from Kiev, construction manager Roman Melnyk anxiously awaits their arrival to pick them up at the airport. Instead, Roman will receive the worst news that anyone could ever receive, as well as the irrevocable certainty that his family has perished in a tragic mid-air collision with no survivors. However, in the background of this calamity, another tragedy occurs as the well-meaning air traffic controller and family man Jake who is held accountable is squashed under the weight of his actions. In the end, with so many lives lost unjustly and unexpectedly, in the aftermath of the two men's grief and sorrow, revenge might sound as a sweet alternative, but sometimes, an apology is enough.::Nick Riganas"""
30424,Kamiusagi Rope x Boruto: Naruto Next Generations,"Animation,Short,Comedy",movie,1,5.1,-576.8803404404098,
10521,Catnapped! The Movie,"Animation,Adventure,Family,Fantasy",movie,13,7.98,97550.97828420963,"""Anthropomorphic cats abduct little kids' dog to use him as a weapon for their Mistress who wants to control the fantastical cat world. Young boy and his sister must travel to this world to save their pet and the cat world.::Anonymous"""
33792,Popotan,"Animation,Comedy,Drama,Fantasy",tv series,26,8.0,8956.032794629058,"'Three sisters are bound to a mysterious house capable of teleporting through time and space. In their travels through twentieth century Japan with their robotic maid, they encounter the harsh realities of separation and loneliness as they are torn from the friends they unsuccessfully try to avoid making.::Teacakes'"
24085,Joukamachi no Dandelion,"Comedy,Seinen,SliceofLife,SuperPower",tv series,1,5.4,9279.316910508063,'Coffey has to arrest a guy who was a longtime friend of his family. Hill has to cover for an old friend who has a tendency for using excessive force. Renko gets in hot water after playing a tasteless practical joke on a female officer in training.::Anonymous'
1537,Shima Kousaku no Asia Shinseki-den,"Cars,Drama,Seinen",tv series,22,6.55,-6649.007111755043,'The legendary burglar Lupin III sets off on an adventurous trip across Italy and San Marino.'
33546,Rennyuu Tales The Animation,Hentai,movie,1,7.0,8674.398639774092,"""Lupin comes into the possession of half a diamond containing half a map, and goes in search of the other half so that he can obtain the map's treasure.::Q. Leo Rahman"", ""Internationally famous thief, Arsene Lupin the Third, receives half of the large diamond known as Twilight from old crimeboss Doruune. Doruune tells him that if he finds the other half of the diamond in Morocco, they will lead him to treasure. Lupin and his gang (Daisuke Jigen, Goemon Ishikawa, and Fujiko Mine) head to Morocco, but get caught up in the middle of a conflict between the government and Gelt rebels. Both sides want Lupin, but no one wants him more than his 'old friend' Interpol Inspector Kouichi Zenigata, who has pursued him to Morocco...::Thanos6"", 'Dolune, an old french thief who taught Lupin the basics of thievery has given Lupin a favor for fulfill. He gives him a half diamond called ""Twilight Gemini"" and wants Lupin to travel to Morocco to unlock the treasure of the Geltic Tribe. Dolune is in no condition to do it himself being in a dying state. Lupin heads out to Morocco to fulfill Dolune\'s favor. But is hunted down by Sadachiyo, a transvestite villain and a group of Assassins. And a French interpol Commissioner, Jean Pierre guides Zenigata to Morocco, who is looking forward in having Lupin taken in by hand. Eventually Lupin teams up with Lara, the young and beautiful leader of the Geltic Tribe, who fights with her people who been exiled from their homeland for a century. Along with some help with Jigen, Fujiko, and Goemon(who has a score to settle with Sadachiyo). The search is on for the other half of the Twilight Gemini and the Geltic Treasure itself.::J LeGault'"
9053,Dragonball Z - OVA: Plan zur Beseitigung der Saiyajins,"Animation,Action,Adventure,Fantasy,Sci-Fi",movie,1,5.82,8370.213608506729,"""Dr. Raichi, a survivor of the Tuffle race that was eliminated from Planet Vegeta by the Saiyans, is trying to take revenge on the surviving Saiyans by killing them and Earth's population. Goku, Gohan, Piccolo, Trunks, and Vegeta must find and destroy generators emitting deadly Destron Gas before all life on Earth is extinguished, then find Raichi and stop him.::page8701"""
3995,"Mirai e no Niji: Boku no Ojisan wa, Hansen-byou","Drama,Kids",tv series,2,6.54,3018.044552824266,"'After graduating from university, twenty something year-olds Meg, her cousin Bunny and their friend Laura share a flat and face the ups and downs of love and life.'"
23085,Mezzo DSA,"Animation,Action,Comedy,Crime,Drama",tv series,1,6.67,900.8413031471392,'Mikura and her friends are back for more danger then ever in these 13 action packed episodes.'
1275,Puppet Princess,"Animation,Short,Action",movie,6,6.39,-67.99084518821428,"""Princess Rangiku lost her entire family to Lord Karimata, who invaded her home seeking her father's life work, puppets with unique capabilities. As her duty, Rangiku sets out with three of her father's greatest puppet warriors to seek revenge. She can manipulate these to battle the strongest of warriors, however manipulating the puppets leaves her own self vulnerable to direct attacks, so she seeks a ninja warrior named Manajiri to aid and protect her in her quest.::Anonymous"""
8560,Gozonji! Gekkou Kamen-kun,"Comedy,Parody,Sci-Fi",tv series,2,6.62,8712.980136607439,"'Caren Ortensia attempts to control the world using money with varying degrees of success, Phantas-Moon receives a movie adaption of her T.V. show, and Shiki is involved in a love plot that spans years.'"
18001,Sore Ike! Anpanman: Yuuki to Honoo to Christmas,"Comedy,Fantasy,Kids",movie,12,7.1,67899.9874666415,
19995,Choujin Locke: Mirror Ring,"Action,Sci-Fi,SuperPower",tv series,26,5.0,1981.0803470919839,
11679,Thistle One,"Animation,Short",movie,1,5.27,2281.441187086472,
8422,The New York Ripper,"Horror,Mystery,Thriller",movie,1,7.04,10980.025066781025,"'A burned-out New York police detective teams up with a college psychoanalyst to track down a vicious serial killer randomly stalking and killing various young women around the city.::Matt Patay', 'Killer who talks like a duck wanders around New York City killing women by various means including slicing an eyeball with a razorblade. Detective Jack Headly is hot on his trail.::Humberto Amador'"
3776,Perman,"Animation,Adventure,Family",tv series,50,6.59,1151.1424248993285,"'A clumsy boy, Mitsuo is chosen as apprentice to a powerful superhero.::Swarup Basak', 'Superman (later ""Birdman"") gives a clumsy human boy, Mitsuo Suwa, three items to help him as Paman, Superman/Birdman\'s apprentice: A helmet which multiplies the wearer\'s physical strength by 6600, A cape that allows the wearer to fly at a speed of 119 km/h, A badge which enables the wearer to communicate with other Perman and to breathe underwater, In addition, he gives him a copy-robot which transforms into an identical clone to help him keep his secret identity during missions. However, if his secret identity becomes known to others, his brain will be destroyed for betraying the secret of Perman. This penalty is reduced to being turned into an animal in later chapters of the manga and in the anime. Mitsuo begins by rescuing people who are victims of crimes or disasters, so as Paman he is admired. He is, however, often troubled by his dual life as a both brilliant superhero and as an unrewarded ordinary boy. He wishes to abandon his role as Perman, but he continues to be Paman out of a desire to help people caught in disasters. Soon, he meets other Pamen and teams with them. The other Pamen are: Paman 2: A monkey named Buuby Paman 3: A girl named Perko/Sumire Hosino Paman 4: A boy named Peryan Paman 5: A baby boy named Koichi In the end of the original story, he achieves the status of Superman and leaves to a planet for Supermen to become a superhero team. He returns shortly later. In the TV series, he stays on earth his whole life.::Swarup Basak'"
2238,Present Made no Michinori,"Action,Music",tv series,3,7.74,4292.525786241773,"'Mankind is threatened by the Megasaur Empire, an advanced civilization of dinosaurs that survived extinction by living underground. In response, Prof. Saotome develops Getta Robo, a 3-in-1 robot formed by three separate vehicles (Getta Machines Eagle, Jaguar, and Bear). Powered by cosmic/getta rays, Getta Robo battles the army of Mechasauruses unleashed by the Empire.::DerekC'"
5539,Berserk: The Golden Age Arc III - The Advent,"Animation,Action,Adventure,Fantasy,Horror",movie,1,6.52,5868.771350164196,"'A year has passed since Guts parted ways with Griffith. The Band of the Hawks is plotting a rescue mission to save Griffith who is confined to prison.::Sddq.Shahid', 'A year has passed since Guts parted ways with Griffith. The Band of the Hawks is plotting a rescue mission to save Griffith who is confined to prison. One night, a group of assassins attack the band, and a bloody battle for survival begins. Just as things are beginning to look grim for them, Guts reappears and saves them. Guts rejoins his friends and embarks on a mission to save Griffith, however.::Sddq.Shahid'"
24151,Kingsglaive: Final Fantasy XV,"Animation,Action,Adventure,Drama,Fantasy,Sci-Fi",movie,2,7.76,56462.9480660347,"""King Regis, who oversees the land of Lucis, commands his army of soldiers to protect the kingdom from the Niflheim empire's plans to steal the sacred crystal which gives Lucis its magic and power.::Anonymous"", ""The magical kingdom of Lucis is home to the hallowed Crystal, but the menacing empire of Niflheim will stop at nothing to make it theirs. War has raged between the two for as long as most can remember. King Regis of Lucis commands an elite force of soldiers dubbed the Kingsglaive. Wielding their king's magic, Nyx Ulric and his fellow glaives stand before the crown city of Insomnia, fighting to stay the inexorable advance of Niflheim's imperial army. Before the overwhelming military might of the empire, King Regis can only salvage his kingdom by accepting an ultimatum-he must cede all lands outside the crown city, and see his son, Prince Noctis, wed to Lady Lunafreya, the former princess of Tenebrae now captive of Niflheim. As the war of wills rages, the machinations of Niflheim transform Insomnia into an awe-inspiring battleground, pulling Nyx into a struggle for the very survival of the kingdom."""
7621,Touch: Sebangou no Nai Ace,"Drama,Romance,Sports",movie,1,6.18,-1573.015140984682,"'A monkey participates in a tournament of sumo fighting a pelican, a rabbit, a goat, a pig and a bear.'"
20183,Pokemon: Pika Pika Hoshizora Camp,"Adventure,Comedy,Fantasy,Kids",tv series,46,6.87,-3293.3483364825465,"""Teppei lost his parents in a traffic accident. His grandpa Isshin adopted him by force to succeed the head of Arima Group Corporation. At Shuuhou, a high school only for wealthy students, Teppei's new life as a celebrity starts.::anonymous"""
3877,Hanaukyou Maid-tai: La Verite,"Comedy,Ecchi,Harem,Romance",movie,26,6.32,668.5176222767108,
33215,Dragon Knight: Another Knight on the Town,"Animation,Fantasy",movie,1,3.73,18120.245365114195,"'Takeru meets the boy Jodis which is in trouble for theft. Takeru saves him shares the night with him, finding out that Jodis is a girl. Later she is been kidnapped and Takeru goes to rescue her.'"
23061,Doraemon Movie 19: Nobita no Nankai Daibouken,"Adventure,Comedy,Fantasy,Kids,Sci-Fi,Shounen",movie,1,5.59,9377.244583646176,
248,Code Geass: Boukoku no Akito 3 - Kagayaku Mono Ten yori Otsu Picture Drama,"Comedy,Military",movie,12,6.84,76939.92500437741,
1370,Katta-kun Monogatari,"Adventure,Kids",movie,1,6.65,8985.329065535803,
770,Pants no Ana,"Animation,Short,Comedy",movie,1,7.53,32263.700744027916,"'A collection of short stories, all of which are perverted to various degrees.::Moh X'"
28965,Gokinjo Monogatari the Movie,"Comedy,Drama,Romance",movie,1,5.83,17196.535193489366,"'In 2002, an artistically inclined seventeen-year-old girl comes of age in Sacramento, California.::Anonymous', 'Christine ""Lady Bird"" MacPherson is a high school senior from the ""wrong side of the tracks."" She longs for adventure, sophistication, and opportunity, but finds none of that in her Sacramento Catholic high school. LADY BIRD follows the title character\'s senior year in high school, including her first romance, her participation in the school play, and most importantly, her applying for college.::Dehlia', ""Christine McPherson's senior year of high school in 2002/03 is presented, she the second of two offspring of Larry and Marion McPherson. Outwardly, she hates most aspects of her life. She hates that they have long lived a life of barely scraping by, their situation all the worse now as they as a collective are a victim of the poor economy. That economic reality has led to Larry recently being laid off, Marion needing to work double shifts as a counselor at a psychiatric hospital just to keep their head above water, and Christine's brother Miguel and his girlfriend Shelly moving back home in the McPhersons' small and already overcrowded house with one bathroom now for five people. She hates that what her parents have decided to spend on her within their already tight budget is an expensive Catholic private school education at Immaculate Heart, solely because Miguel witnessed long ago some violence outside Sacramento High, where she would have gone otherwise. At Immaculate Heart, she has only two friends, equally poor Julie Steffans, they playing upon their outsider status. She hates living in Sacramento, she who is determined to go to a liberal arts college back east, preferably New York City, using financial aid rather than go to a California college such as nearby UC-Davis for which she would eligible for an in-state reduction in tuition, that option already barely affordable. Whether she will even get into college is questionable as she has placed little effort into her school work despite being bright, except perhaps in math. But arguably what she hates the most is her strained relationship with her mother, Marion who is always bad cop to Larry's good cop in the parenting role. Marion and Christine's strained relationship is exacerbated by both being strong willed people. Christine believes that her mother may love her because she has to, but truly doesn't like her. In not wanting to take things from her mother out of a natural course of family, Christine has decided to rename herself Lady Bird, something she wants everyone to call her from now on. As Lady Bird goes through some major events her senior year - from discovering a new school extracurricular activity which includes boys from neighboring St. Francis Xavier, to testing the waters of dating, possible first love and the prospect of sex, to wanting to be part of the in-crowd, to truly placing some effort into her short term post-secondary dreams - she and Marion may only have a short period of time to express their true love for each other, family or not, before it's too late.::Huggo"", 'Going by the name of ""Lady Bird"", the outspoken Catholic high school senior student, Christine McPherson, is dreaming big of finally leaving her hometown of Sacramento, practically on pins and needles to attend a sophisticated New York City college. However, with her average grades and her family struggling to keep afloat, attending a public university closer to home would be a lot cheaper and safer, especially after last year\'s devastating 9/11 attack. In the end, amid grades, numerous college applications, a blooming teenage sexuality, and a strong-willed mother who is a real mother hen, Lady Bird must find a way to make her dreams happen. Can she survive life\'s bumps and cracks?::Nick Riganas', 'Sacramento, 2002. Christine ""Lady Bird"" McPherson is in her final year of high school. She longs to leave Sacramento and go to college on the East Coast. However, her protective, obsessive mother, pessimistic at her chances, is determined to keep her in California, and ideally nearby to home. Lady Bird\'s final year of school will be one of discovery, new experiences and finding herself.::grantss'"
20755,Elmer no Bouken: My Fathers Dragon,"Adventure,Fantasy,Kids",movie,26,6.13,-1360.508803418942,"""A retired pop singer turned actress' sense of reality is shaken when she is stalked by an obsessed fan and seemingly a ghost of her past.::Kenneth Chisholm"", 'Mima leaves the idol group CHAM, in order to pursue her dream as an actress. Mima climbs up the rocky road to success by performing as rape victims and posing nude for magazines, but is haunted by her reflections of the past.::<H@jime>'"
18469,Twinkle Nora Rock Me!,"Action,Sci-Fi",movie,26,5.75,-9428.593890698758,"'Rob Haley (Dougray Scott), an up-and-coming chef and restaurateur in London, is grief-stricken when he loses his wife. With encouragement from his infamous friend and real life TV Chef Gordon Ramsay, Rob decides to spice up his life by turning a run-down country pub into a gourmet restaurant. His food catches the eye - and taste buds - of beautiful American food critic Kate Templeton (Claire Forlani) and they soon both write a recipe for love that leaves both their hearts - and their stomachs - in full.::madjanssen', 'Rob Haley (Dougray Scott), an up-and-coming chef and restaurateur in London, is grief-stricken when he loses his wife. With encouragement from his infamous friend and real life TV Chef Gordon Ramsay, Rob decides to spice up his life by turning a run-down country pub into a gourmet restaurant. His food catches the eye - and taste buds - of beautiful American food critic Kate Templeton (Claire Forlani) and they soon both write a recipe for love that leaves both their hearts - and their stomachs - full.::madjanssen', ""This is no popcorn movie but Michelin star film cuisine. The story is about a chef, Rob Hayley (Dougray Scott) who lost his creative touch when he lost his beloved wife in a car crash. He 'retires' with his young daughter to the countryside where he meets a comely critic Kate Templeton (Claire Forlani)who challenges his life expertise. He takes interest once again in creating dishes which are unique and scrumptious to impress her, and succeeds with great flair. Soon his local pub restaurant is attracting customers from far and wide. However, nasty rival lover and cranky locals then gang up against him, threatening him with closure of his business. His only hope is to win praise on national TV from a visiting critic (Simon Callow). A taste of English country fare, but not the usual Ploughman's lunch of cheese with pickles. Instead, we are served fresh lemon sole and salmon mousse followed by that quintessentially English dessert, fruit trifle. The trifle is made with the finest sherry and topped with irresistible cream laced with Cognac. The sweet film wins all hearts and is served with a dry sense of humor and much love. Everyone including the actors enjoys this culinary treat. Best tasted with quail's eggs and a bottle of chilled Chardonnay. Bon appetite.::Christine (Starfilms)"", ""Rob Haley (Dougray Scott, Desperate Housewives), a talented chef and restaurateur in London, is grief stricken after losing his wife in an auto accident. Then one bad review from a food critic, and the customers of his once -thriving restaurant start to dry up. But a chat with his old friend and world-famous chef Gordon Ramsay (Himself, Hells' Kitchen), inspires Rob to take control and reclaim the life he once had. Rob, his daughter and his loyal staff are now determined to turn a run-down countryside pub into a local gourmet eatery. On opening day, Kate Templeton (Claire Forlani, Meet Joe Black), an American food critic with a troubled love life, enters the pub. The last thing Rob needs is an uppity critic with a bad taste for men. Attitudes clash until finally Rob's charm and magical dessert trifle wins over her taste buds - and her heart. But not all the locals are happy with the fame and the traffic the up-and-coming restaurant brings to their neighborhood, and a few try to have it closed down for good. With the help of Kate, the pub receives a visit from the world famous food critic Guy Witherspoon (Simon Callow), Rob dishes up an incredible meal and his signature dessert. They receive a fantastic review, and Rob and Kate both discover that the recipe for true happiness is a pinch of teamwork and a whole lot of love.::Vision Films"""
2933,Samchongsa: Taimmeosin 001,"Animation,Sci-Fi",movie,50,6.92,10926.711476867378,
4923,Akko's Secret,"Comedy,Fantasy,Romance",movie,4,5.94,6057.623964655046,'Young Atsuko Kagami comes into possession of a magical mirror that lets her transform into anything she wishes. Atsuko Kagami then attempts to save a company which is about to be sold by using her transformation abilities. She also falls in love as a 22-year-old college student.::anonymous'
7645,Slayers: The Motion Picture,Comedy,tv series,49,7.89,17404.21663037133,
32473,Blood Blockade Battlefront,"Animation,Action,Adventure,Fantasy",tv series,1,4.75,-4720.822746774978,"'In a city where the paranormal and ordinary co-exist, the Libra organization battles to ensure peace and order.', ""A breach between Earth and the netherworlds opened up over the city of New York, trapping New Yorkers and creatures from other dimensions in an impenetrable bubble. Over time, this bubble became Jerusalem's Lot, a homeworld of wondrous beings and crazy sci-fi sensibilities. Now someone is threatening to sever the bubble and unleash chaos across the dimensions, and it's up to a special group of superhumans to preserve Jerusalem's Lot."""
2671,Ticonderonga no Iru Umi,"Drama,Historical,Kids",tv series,1,7.32,-206.0743604342431,
6624,L'invitation aux images,Documentary,movie,1,7.75,16933.590955720807,
