anime_id,name,genre,type,episodes,rating,members,overview
28121,Kino's Journey: The Beautiful World - The Animated Series,"Animation,Adventure,Drama,Fantasy",tv series,13,7.88,442821.55318170413,"""Destination is a state of mind. A tale of one girl and her bike and the road ahead. Kino wanders around the world on the back of Hermes, her unusual, anthropomorphic motorcycle, only staying in each country for three days. During their adventures, they find happiness, sadness, pain, decadence, violence, beauty, and wisdom. But through it all, they never lose their sense of freedom. They discover that because of the world's imperfections, it is actually a thing of beauty."""
1505,Atarashii sekai,"Animation,Adventure,Fantasy",tv series,1,7.94,53099.98219524592,
19799,"Dance, Dance, Dance","Drama,Music,Romance",tv series,3,6.55,35930.64026497409,
21013,Meloetta's Moonlight Serenade,"Animation,Short,Adventure,Comedy,Family",movie,51,6.18,9788.863512457829,'Pikachu and his friends have gathered to listen to a song performed by Meloetta at the melody tree. Meloetta is soon interrupted by a Sandstorm attack which breaks the tree and causes the Melody Berries to scatter. Before the performance can continue the Pokémon must retrieve the lost berries.'
27783,Break Blade 5: Shisen no Hate,"Action,Mecha,Military,Shounen",movie,0,0.0,109057.2047942201,'A modern day adaption of the classic horror novel Dracula.::Anonymous'
31697,Screwballs II,Comedy,movie,2,4.29,14508.14374413014,"'In the original tradition of ""Screwballs,"" four horny teens try to get a shot at the sexy new French teacher.::Wallace Entertainment', ""Brad, Steve, Hue, and Marvin are four get-nowhere boys who are forced into summer school, ending up at Cockswell Academy under the supervision of Principal Arsenault. The boys play a game where they earn points for every girl with which they score. On misadventures of their own, they decide to go for the ultimate 100-point score, Mona Lott, the new French teacher. But when they're unable to get a shot at her, they end up in the unforgiving clutches of the principal. After all is lost, they take one final chance during the school's anniversary celebration.::Wallace Entertainment"""
30093,Chibikuro Sambo no tora taiji,"Animation,Short",movie,1,3.89,-68350.5876887833,
5834,High School DxD BorN: Ishibumi Ichiei Kanzen Kanshuu! Mousou Bakuyou Kaijo Original Video,"Comedy,Ecchi",movie,182,7.12,42105.23342797881,"'The Sun God Abel returns to life, bent on punishing the humans and cleansing the Earth from their presence. When Athena joins him, leaving humans to their fate, the Bronze Saints must defend the Earth in their greatest battle yet.::Mario J Ramirez', ""Abel the resurrected Sun-God has come to take her sister Athena with him and rule the world together, he plains to destroy humanity in the form of terrible natural disasters, Athena chooses freely to go with Abel. Seiya and the other bronze knights can't believe she has turned her back on them. Abel has his own group of warriors as well as some of the formerly deceased golden knights fighting on his side. The bronze knights will have to fight their way through them to find Athena and save her as well as the Earth.::MRPHANTASM - COSENTINO"""
30665,Kirameki no Kyoudai: Sex Crime,"Hentai,Yuri",movie,1,4.15,-126883.39474831331,"'A drama that follows the emotional and spiritual growth of teenage girl as she wrestles with love, family, and other matters.::Anonymous'"
10245,Uta no☆Prince-sama♪ Maji Love Legend Star,"Comedy,Harem,Music,Romance,Shoujo",movie,10,5.83,32044.63639434579,'A brief look into the life of an aspiring career musician from Hawaii and how the healing power of music combined with his perseverance and dedication has granted him and his band local success in a short period of time.'
93,Infinite Ryvius,"Animation,Adventure,Sci-Fi",tv series,50,7.93,83176.28372284598,"'Over 400 teenagers are stranded without adult supervision aboard a prototype space battleship after their astronaut training school is sabotaged by an outside group.::Axemblue', ""In the future, a solar flare called the Geduld Phenomenon spreads a vast, chaotic plasma field across the solar system, killing many but ironically bolstering humanity's drive to colonize space. Many years later, the Liebe Delta astronaut training center is established to educate teenagers in practices such as piloting, nursing and stewardship. But the center, which conceals a prototype battleship called the Black Ryvius, is sabotaged by an unknown party, and the remaining adult instructors sacrifice themselves to save the station from plunging dangerously into the Geduld field. Meanwhile, the station's 400-plus students discover the hidden battleship and are forced to remain aboard it, protecting themselves and governing the student body as best they can while searching for salvation.::Axemblue"""
5670,Hundred,"Animation,Action,Romance,Sci-Fi",tv series,12,7.23,29848.091470537547,"'Hundred is the only weapon that can counter the mysterious Savage life form attacking Earth. To become a Slayer who wields this Hundred, Hayato Kisaragi successfully enrolls in the marine academy city ship Little Garden. However he feels a strange yet familiar sense of incongruity towards Emil Crossford, his roommate who somehow knows him from somewhere. On top of that, as soon as he enters the school, he is challenged to a duel by the ""Queen"" and the school\'s most powerful Slayer, Claire Harvey.'"
248,Code Geass: Boukoku no Akito 3 - Kagayaku Mono Ten yori Otsu Picture Drama,"Comedy,Military",movie,12,6.84,40556.038301140434,
10189,Firebird: Daybreak Chapter,"Animation,Action,Adventure,Comedy,Drama,Fantasy,History,War",movie,1,7.37,141879.9992227342,"""This extraordinarily complex film is not only a send-up of every samurai film ever made, it is also an extrapolation of the value of life. The Yamatai, represented by Prince Susano-O and elderly advisor Sumuke, hire Yumihiko of Matsuro to hunt the phoenix so that Queen Himiko, sister of Susano-O can have eteranal life. Matsuro is then destroyed by the Takamagahara, who have mastered the art of horseback riding, which is foreign to all other western Japanese tribes. One of their number, Uzume uses makeup to appear ugly and avoid rape, though her dancing induces Jingi to spare her. Queen Himiko's apprentice, Iyo, orders the execution of an innocent based on her magical observation, so Susano-O sides with the people. A Yamatai doctor named Guzuri washes up from a shipwreck in the country of Kumaso, where Hinaku, daughter of the chief, is dying. Urusni, her husband, is killed hunting the phoenix to save her, but Guzuri gives her penicillin, which saves her, so the chief marries him to her. The Yamatai army, led by Sarutahaiko, destroys the entire village, but Guzuri, who is initially blamed, and Hinaku escape, and Nagi, the son of the chief, is spared because he knows where the phoenix lives. Initially enraged, Hinaku eventually makes Sarutahaiko take charge of Nagi, who trains him to fight animated foxes, but he is thrown in a pit of wasps when Nagi teams up with Oro, daughter of the innocent man who was executed, in attempt to kill the queen, though Nagi hits a servant, instead. The three attempt to escape during an eclipse which terrorizes the people, but Oro is killed. Sarutahaiko and Nagi float to what remains of Kumaso, Sarutahaiko's nose permanently swollen to great size. In an earthquake Guzuni and new mother Hinaku are trapped at the bottom of a crater, where they will spend the rest of their lives, while Nagi and Sarutahaiko find a horse (Nagi briefly turning into an animation of Astro Boy when kicked), and then the Takamagahara. Jingi has no interest in living forever, but in immortalizing himself through history, and sets out to conquer Yamatai, sparing the two only because Uzume wishes to marry Sarutahaiko.::Scott Hutchins <scottandrewh@home.com>"""
9526,The Four Seasons,"Comedy,Drama",movie,6,6.43,-106250.57949030731,"'Three middle-aged wealthy couples take vacations together in Spring, Summer, Autumn and Winter. Along the way we are treated to mid-life, marital, parental and other crises.::Robert Nolty <nolty_r@caltech.edu>', 'Middle aged couples Jack and Kate Burroughs, Nick and Anne Callan, and Danny and Claudia Zimmer are best friends who do everything together. As couples, they have weathered the flood of divorces that have beset their other friends. When one of the six decides to make a change in life, the other five are forced to examine their marriages, their friendships with each other, the true meaning of love and their own personal foibles. Over the course of one year, the movie is set against the backdrop of four vacations they take together, one in each of the four seasons, with Antonio Vivaldi\'s associated suite of music introducing each. By their fourth vacation together, Jack feels that they need to ""clear the air"".::Huggo'"
2575,Norimono Oukoku BuBu ChaCha,"Comedy,SliceofLife",movie,26,6.14,45535.46138785829,"'In the distant future, humans are declared ""illegal residents"" and hunted to near extinction by murderous robots. One day, a group of human scavengers come across a strange man named Killy, who may be the key to humanity\'s survival.', 'In the distant technological future, civilization has reached its ultimate Net-based form. An ""infection"" in the past caused the automated systems to spiral out of order, resulting in a multi-leveled city structure that replicates itself infinitely in all directions. Now humanity has lost access to the city\'s controls, and is hunted down and purged by the defense system known as the Safeguard. In a tiny corner of the city, a little enclave known as the Electro-Fishers is facing eventual extinction, trapped between the threat of the Safeguard and dwindling food supplies. A girl named Zuru goes on a journey to find food for her village, only to inadvertently cause doom when an observation tower senses her and summons a Safeguard pack to eliminate the threat. With her companions dead and all escape routes blocked, the only thing that can save her now is the sudden arrival of Kiri the Wanderer, on his quest for the Net Terminal Genes, the key to restoring order to the world.'"
3051,Dragonball Z - Movie 14: Kampf der Götter,"Animation,Action,Comedy,Fantasy,Sci-Fi",movie,1,7.42,146963.02240458387,"'The Z-Fighters must contend with Lord Beerus, the God of Destruction, but only a God can fight a God, and none of them are Gods. However with the creation of the Super Saiyan God, will the Z-Fighters be able to defeat Lord Beerus?::20th Century Fox, Toei Animations, and Funimation Studios', 'The events of Battle of Gods take place some years after the battle with Majin Buu, which determined the fate of the entire universe. Bills, the God of Destruction, is tasked with maintaining some sort of balance in the universe. After awakening from a long slumber, Bills is visited by Whis and learns that the galactic overlord Frieza has been defeated by a Super Saiyan from the North Quadrant of the universe named Goku, who is also a former student of the North Kai. Ecstatic over the new challenge, Goku ignores King Kai\'s advice and battles Bills, but he is easily overwhelmed and defeated. Bills leaves, but his eerie remark of ""Is there nobody on Earth more worthy to destroy?"" lingers on. Now it is up to the heroes to stop the God of Destruction before all is lost.::ForLand Hucy'"
4688,Kekkaishi,"Animation,Action,Adventure,Fantasy",tv series,1,6.03,132054.49735289806,"""Yoshimori and Tokine are Kekkaishi's tasked to protect the land of Karusomari. They are constantly pushed to their limits, but they always persevere.::Trevor Dey"", ""Yoshimori and Tokine are just your average kids go to the same school and they also happen to be neighbors. During the day they go their separate ways but at night they both have to go protect the land of Karosumari. A job passed down to them from generations of Kekkaishi in both of their families. The families are 'rivaling' but the two of them get along just fine. At night Yoshimori and Tokine with their demon dogs Hakubi and Madarao, do their best to rid the land of evil. But everything isn't always so simple.::Trevor Dey"""
2437,Fushigi Yûgi - The Mysterious Play,"Animation,Adventure,Drama,Fantasy,Romance",tv series,3,6.25,-83896.8191087371,"""A girl named Miaka Yuuki and her friend Yui Hongo are taken into the book called The Universe of the Four Gods. There they battle many hardships including each other in order to become the priestess of Suzaku and Seiryuu and summon them. What they didn't expect was to fall in love and watch their comrades die.::Kandace Galyen"""
28961,Flying Witch Petit 1,"Animation,Comedy,Fantasy",tv series,1,7.12,-49504.75368463201,'The first special of Flying Witch which was posted on the official YouTube channel of distributor VAP and later bundled with the Blu-Ray and DVD volumes.'
2209,Taiho Shichau zo: Second Season,"Action,Comedy,Police,Shounen",tv series,3,5.88,-58071.90060225298,'Two siblings try to find their missing parents. Based on the best selling video game series by Square Enix.'
2090,Gamba: Gamba to Nakama-tachi,"Adventure,Kids",movie,6,6.98,-170822.63846695545,"""When a boy who is in the navy college returns home for vacation he meets his young cousin who also wants to join in order to become a pilot. However, the younger man's mother is antagonistic knowing the folly of war. When the younger man recruits his cousin to speak to the mother the enlisted man is successful and the mother relents. The younger cousin is soon in the navy and training to become a pilot. He graduates too, but one night loses his friend yet has no time to reflect on the event as japan draws nearer to war with the West. The pilot and his fellow pilots are told to embark on a mission, but initially not told their purpose or destination. Only later it is revealed that the destination is Hawaii, USA. Pearl Habour looms.::aghaemi"""
21393,Maji de Otaku na English! Ribbon-chan: Eigo de Tatakau Mahou Shoujo - The TV,"Comedy,Magic",tv series,1,6.61,76403.0312189755,
13057,Yume wo Kanaeru Zou,Comedy,tv series,6,7.18,1843.0459056864047,"'A pretty schoolgirl hides a secret: she is actually a boy who got turned into a girl and is looking for a way to change herself back.', 'Megumi-chan is a teen-aged girl with a secret past. She used to be a boy until she saved a magician from a gang of boys and was given a magical book. As a boy when he bled into the book a genie appeared to grant one wish. Megumi wished to be a man, but the genie granted the wish backwards so he turned into Megumi-kun, a girl. Years pass and Megumi grows up to be the most beautiful of girls but still acts and fights like the boy that she really is. Upon entering High School she immediately beats up the school bully who falls in love with her. Thus begins her adventures looking for that book to change her back and fighting off both admirers and her on-coming femininity.::laird-3'"
2745,Robin-kun to 100 nin no Otomodachi Season 2,Kids,tv series,3,7.3,-76297.79866983456,'The legendary burglar Lupin III sets off on an adventurous trip across Italy and San Marino.'
29954,Saint Seiya: Legend of Crimson Youth,"Animation,Action,Fantasy",movie,1,4.17,9862.612147227148,"'The Sun God Abel returns to life, bent on punishing the humans and cleansing the Earth from their presence. When Athena joins him, leaving humans to their fate, the Bronze Saints must defend the Earth in their greatest battle yet.::Mario J Ramirez', ""Abel the resurrected Sun-God has come to take her sister Athena with him and rule the world together, he plains to destroy humanity in the form of terrible natural disasters, Athena chooses freely to go with Abel. Seiya and the other bronze knights can't believe she has turned her back on them. Abel has his own group of warriors as well as some of the formerly deceased golden knights fighting on his side. The bronze knights will have to fight their way through them to find Athena and save her as well as the Earth.::MRPHANTASM - COSENTINO"""
2740,Ryuseiki Gakusaver,"Short,Sci-Fi",movie,25,6.55,58831.88855222434,
2739,Punpun Polka,"Kids,Music",tv series,3,6.36,105160.30735261933,"""Usavich is a series about an odd pair of rabbits imprisoned in a Soviet Gulag. Shows the absurd everyday occurrences of the two rabbits' prison life, and the the two rabbits' life on the run from law enforcement."""
7593,Saishuu Shiken Kujira Progressive,"Drama,Romance",tv series,12,7.09,197251.0205434954,'Follow the life of Tadayasu Sawaki as he enrolls in an Agricultural University and learn about bacteria and viruses that he alone can see with the naked eye.::Alberto'
627,Madobe Nanami no Windows 7 de PC Jisaku Ouen Commercial!!,Comedy,tv series,26,8.42,81323.85409596833,"'Michiko is a free-willed ""sexy diva"" who escaped from prison, while Hatchin is a run away girl fleeing from her strict catholic foster family. The two join forces and set off on an unpredictable road trip seeking their own freedom.::J LeGault'"
10247,Saiyuki Gaiden,"Animation,Action,Comedy",tv series,1,6.31,-168585.9465948966,
23233,Tsubasa Chronicle: Spring Thunder,"Animation,Action,Adventure,Drama",movie,12,7.11,85801.59520143598,
8609,Red Garden,"Animation,Drama,Horror,Mystery,Thriller",tv series,1,7.95,-25592.129376872697,"'Kate, Claire, Rose, and Rachel once explored the streets of New York with the promise of limitless futures unfolding before them. But now, murdered and resurrected as killers, they must hunt demonic beasts no ordinary weapon can destroy.'"
26153,Fortune Quest,,movie,1,8.0,-65412.76315986625,
426,Initial D,"Animation,Action,Comedy,Sport",tv series,4,6.25,35606.59307493358,"'The story of a young delivery boy who becomes a drift-racing legend.::Nathan J Rossberg', ""Takumi Fujiwara is an average 18-year old high school student with an average job as a gas station attendant, and a not-so-average hand in the family business. To help his father's tofu shop, Takumi has been delivering tofu in his father's 'Eight-Six' Trueno (known as the Toyota Corolla GT-S in the US) to a hotel at the peak of Mt. Akina (the local mountain), every night at 4 a.m. In doing so, Takumi has been unknowingly training to be the greatest mountain-pass drift-racer in all of Japan. After a freak late-night encounter with Keisuke Takahashi, the number two driver of the infamous RedSuns team, Takumi is quickly, and unwillingly plunged into a high-speed world of white-knuckle contests on the most dangerous mountain passes in the Gunma prefecture. Assisted by the local Akina Speedstars team, his slightly obnoxious friend Itsuki, his somewhat shady girlfriend Natsuke and the sage-like words of his chain-smoking, ex-racer father Bunta, he'll need all the help he can get to outwit and outmaneuver Japan's most talented underground drift-racers.::Nathan J Rossberg"""
2659,Anita Manning,Reality-TV,tv series,1,7.26,267100.7187728269,
32376,Free!: FrFr - Short Movie,"Comedy,Sports",tv series,1,7.04,19214.499769023005,
4278,Dragon Ball Z: Summer Vacation Special,"Animation,Action,Comedy",movie,2,6.62,-144554.89524443183,"'This is a TV special that takes place directly after Dragon Ball Z movie 7. In it, Goku and Gohan discuss Dragon Ball movies 1-3 and Dragon Ball Z movies 1-7.::Anonymous'"
33339,"Grendizer, Getter Robo G, Great Mazinger: Decisive Battle! Great Sea Beast","Animation,Short,Action,Adventure,Sci-Fi",movie,63,6.96,-18380.71321151721,"'When a mysterious gigantic monster, called Dragosaur, appears from the depth of the oceans and threatens the world, a team of super-robots from Japan is activated and sent out to defeat it: Grendizer, The Great Mazinger and Getter G.::Luigi Marcucci'"
7666,Cook no Polka,"Kids,Music",movie,1,6.72,6214.777241584256,"'In the special episode to season 1, the queen from Valhalla planet arrives on earth with a virtual-world-program, called ""bride training boot camp"". They built several pairs which have to take a random card with a special situation that might occur if you are married. For instance Kazuto and Valkyrie have to make dinner, Raine and Kazuto\'s sister have to manage poverty or Akina and Hydra have to prepare a wedding ceremony as bride and groom (so everyone gets the most unlikely and unsuitable situation). The Queen from Valhalla Planet has been visiting Kazuto and the gang quite often. She tell them that she is was in Earth region for business purposes, in reality her main concern for coming around quite often is because she has concerns that Valkyrie wouldn\'t make a good wife for Kazuto. So she comes up with to put the gang through wedding training.::animenewsnetwork.com'"
33449,Hoshikuzu paradaisu,"Animation,Comedy,Romance",movie,1,5.67,-28769.96954796402,"""A high school student's father re-enters his life and brings along his famous new wife and daughter.::Anonymous"""
5397,Shinkyoku no Grimoire The Animation,"Demons,Fantasy,Hentai,Supernatural",tv series,13,7.28,-85951.36769796503,'Lord Ainz embarks on a series of comedic mishaps when he tries to deal with his maid subordinates the Pleiades.'
34051,Hare Tokidoki Buta (TV),Comedy,movie,0,0.0,-77119.18465255694,
23877,Rakusho! Hyper Doll,"Animation,Comedy",movie,1,4.21,-222886.94185028263,"'Disguised as schoolgirls, 2 superheroines would rather goof off instead of saving the Earth from gigantic monsters.::softsofa'"
17563,Pretty Rhythm: All Star Selection,"Music,Shoujo,Sports",movie,1,6.09,-200575.16765308092,'Plot unknown.'
1678,Yurusarezaru mono,"Short,Drama",movie,52,7.36,92412.83039980916,
21305,Choyaku Hyakunin Isshu: Uta Koi,Romance,tv series,0,0.0,-67616.00918640906,"'Uta Koi tells the ""super-liberal interpretation"" of the Hyakuninisshu anthology compiled during Japan\'s Heian period of 100 romantic poems from 100 different poets such as The Tale of Genji\'s Murasaki Shikibu.::https://myanimelist.net/anime/13349/Chouyaku_Hyakuninisshu__Uta_Koi?q=Choyaku%20Hyakunin%20Isshu'"
25729,Bunbuku chagama,Short,movie,1,7.69,-59224.49938596591,
30573,Mirai Shounen Conan (Movie),"Adventure,Drama,Sci-Fi",tv series,1,6.58,32177.526912265508,"'Takatoshi Tsuda joins Ousai Academy, a co-ed high school that until recently had been an all-girl school, where he is asked to join the student council as vice-president and a male representative.::Nolberto Roa'"
15043,Galaxy Angel,"Animation,Comedy,Sci-Fi",tv series,13,6.18,-46667.53803944468,"'The astronomical adventures of the Angel Brigade, a squad of females dispatched to retrieve powerful objects scattered around the Milky Way.::Serena Tsukino', 'The Angel Brigade is a five team members military branch of Transbaal Empire military. There mission is to track down and find the ""Lost Technology"". Somehow they most of the time mess up on the mission by getting into trouble and weird situations.::David'"
6131,Ore-sama Kingdom,"Romance,Shoujo",movie,365,5.48,109863.85378675033,"'A small group squad of American soldiers find horror behind enemy lines on the eve of D-Day.::Chockys', ""Night of the 5 to the 6 June, 1944. On the eve of D-Day, several American paratroopers are dropped behind enemy lines to carry out a mission crucial to the invasion's success: destroy a radio tower built in a little castle of an old French town that it's close to Normandy's beaches, and that Third Reich uses as straight communication between Berlin and beaches' bunkers. Due to the intense enemy fire caused by cannons and machine guns, all the planes are shoot down and the most of the soldiers die in the landing or they are killed by Nazis' night patrols after to take land. However, a private named Ed Boyce survives to meet Corporal Ford, a last-minute incorporation from Italy and a veteran expert in bombs and explosives; Tibbet, a rogue sniper; Chase, a war photographer; and finally private Dawson. After to watch the killing of their superior Sargeant Eldson by a Nazi night patrol, Ford assumes the mission as leader of the group and they try to get the town when Dawson dies after to step a landmine. Burying him in the forest, they meet Chloe, a villager who refugees the soldiers in her house where she lives with her old and ill aunt and her elder brother, child Paul. But the mission complicates when by chance Boyce get into the Nazi radio tower, just to find a horrible secret experiment with human beings that it could bring the victory to Hitler and would change the fate of the world forever. With D-Day approaching, Boyce and the others begin to realize there is more going on in this Nazi-occupied village than a simple military operation, having to fight against supernatural forces not only to destroy the radio tower, but destroy the own experiment before Hitler's gets his Third Reich of thousand years he promised.::Chockys"""
8353,Kyoro-chan,Animation,tv series,13,5.04,-77150.81079566432,
22675,Shiawase no katachi,"Animation,Comedy,Drama,Romance",tv series,5,4.67,100260.0564741797,
28593,RIN ~Daughters of Mnemosyne~,"Animation,Action,Adventure,Horror,Mystery,Thriller",tv series,5,6.38,-64707.112271584294,"""Rin Asogi runs a private investigation agency in Tokyo's Shinjuku district, performing odd jobs ranging from finding lost pets to hunting rare stamps in order to get by. Yet despite attempts at a normal life, she finds herself constantly hindered by the strange cases that come her way, figures from her dark past, and her inability to die.::Anonymous"""
7367,Isshoni Training 026: Bathtime with Hinako & Hiyoko,"Animation,Short",movie,1,6.95,-103383.18923614822,"'Hinako does some bath stretches, and Hiyoko joins her.'"
